,original,perturbed,type
50,"I saw this film opening weekend in Australia, anticipating with an excellent cast of Ledger, Edgerton, Bloom, Watts and Rush that the definitive story of Ned Kelly would unfold before me. Unfortunately, despite an outstanding performance by Heath Ledger in the lead role, the plot was paper thin....which doesn't inspire me to read ""Our Sunshine"". There were some other plus points, the support acting from Edgerton in particular, assured direction from Jordan (confirming his talent on show in Buffalo Soldiers as well), and production design that gave a real feel of harshness to the Australian bush, much as the Irish immigrants of the early 19th century must have seen it. But I can't help feeling that another opportunity has been missed to tell the real story of an Australian folk hero (or was he?)....in what I suspect is a concession to Hollywood and selling the picture in the US. Oh well, at least Jordan and the producers didn't agree to lose the beards just to please Universal...<br /><br />Guess I will just have to content myself with Peter Carey's excellent ""Secret History of the Kelly Gang"". 4/10","I saw this film open weekend in Australia, anticipating with an excellent cast of Ledger, Edgerton, Bloom, Watts and Rush that the definitive story of Ned Kelly would unfold before me. Alas, notwithstanding an outstanding performance by Heath Ledger in the lead role, the plot was paper thin....which doesn't inspire me to read ""Our Sunshine"". There were some other plus points, the support acting from Edgerton in particular, assured direction from Jordan (confirming his talent on show in Buffalo Soldiers as well), and production design that gave a real feel of harshness to the Australian bush, much as the Irish immigrants of the early 19th century must have seen it. But I can't help feeling that another opportunity has been missed to tell the real story of an Australian folk hero (or was he?)....in what I suspect is a concession to Hollywood and selling the picture in the US. Oh well, at least Jordan and the producers didn't agree to lose the beards just to please Universal...<br /><br />Guessing I will just have to content myself with Peter Carey's excellent ""Secret History of the Kelly Gang"". 4/10",Successful
339,"Robert Taylor definitely showed himself to be a fine dramatic actor in his role as a gun-slinging buffalo hunter in this 1956 western. It was one of the few times that Taylor would play a heavy in a film. Nonetheless, this picture was far from great as shortly after this, Taylor fled to television with the successful series The Detectives.<br /><br />Stuart Granger hid his British accent and turned in a formidable performance as Taylor's partner. <br /><br />Taylor is a bigot here and his hatred for the Indians really shows.<br /><br />Another very good performance here was by veteran actor Lloyd Nolan as an aged, drinking old-timer who joined in the hunt for buffalo as well. In his early scenes, Nolan was really doing an excellent take-off of Walter Huston in his Oscar-winning role in The Treasure of the Sierre Madre in 1948. Note the appearance of Russ Tamblyn in the film. The following year Tamblyn and Nolan would join in the phenomenal Peyton Place.<br /><br />The writing in the film is stiff at best. By the film's end, it's the elements of nature that did Taylor in. How about the elements of the writing here?","Robert Taylor definitely showed himself to be a fine dramatic actor in his role as a gun-slinging buffalo hunter in this 1956 westerner. It was one of the few times that Taylor would play a heavy in a film. Nonetheless, this picture was far from great as shortly after this, Taylor fled to television with the successful series The Detectives.<br /><br />Stuart Granger hid his British accent and turned in a formidable performance as Taylor's partner. <br /><br />Taylor is a bigot here and his hatred for the Indians really shows.<br /><br />Another very good performance here was by veteran actor Lloyd Nolan as an aged, drinking old-timer who joined in the hunt for buffalo as well. In his early scenes, Nolan was really doing an excellent take-off of Walter Huston in his Oscar-winning role in The Treasure of the Sierre Madre in 1948. Note the appearance of Russ Tamblyn in the film. The following year Tamblyn and Nolan would join in the phenomenal Peyton Place.<br /><br />The writing in the film is stiff at best. By the film's end, it's the elements of nature that did Taylor in. How about the elements of the writing here?",Successful
410,"When I saw the preview, I thought: this is going to be a great movie. And indeed it could have been. The actress playing the main character was very credible, and the beauty of the filming is undeniable. However the dialogues cast a dark shadow on the whole picture. The level of language was too familiar and too contemporary for an action taking place in 1610, and it took away most of the magic of the film. However, I must congratulate the translator, because the English sub-titles were more refined and appropriate that the original French cues, and it probably explains the good rating the movie received on the imbd!","When I saw the preview, I thought: this is going to be a great movie. And indeed it could have been. The actress playing the main character was very credible, and the beauty of the filming is undeniable. Nonetheless the dialogues cast a dark shadow on the totality photograph. The level of language was too familiar and too contemporary for an action taking place in 1610, and it took away most of the magic of the film. However, I must congratulate the translator, because the English sub-titles were more refined and appropriate that the original French cues, and it arguably explains the good rating the movie received on the imbd!",Successful
868,"When you see Boris Karloff and Bela Lugosi as co-stars, you expect to find a well done horror movie, but this was actually quite different, representing as it did what I would describe as an early effort at science fiction. Karloff and Lugosi both play scientists (Rukh and Benet respectively) - competitors to an extent, until Rukh wins Benet over with a demonstration that proves his great theory. The science here was - to say the least - a bit rough around the edges (thus science fiction, with the emphasis on the fiction) but somehow Rukh harnesses some sort of ray from Andromeda that allows him to look at the earth ""several thousand million years ago."" In that pre historic time, a huge meteorite slammed into Africa, leaving deposits of a substance the scientists call ""Radium X"" - which can heal and destroy. A large portion of the movie is set rather tediously in Africa, on a search for the meteorite deposits, which Rukh eventually finds and harnesses to create a great weapon, unfortunately infecting himself with some sort of disease that makes him a great weapon as well.<br /><br />Karloff and Lugosi were both pretty good here. Lugosi pulls off a role in which he's the good guy pretty well, although I frankly found him a bit unconvincing - especially during the scenes set in Africa. The story also plodded along a bit, and while it held my attention it didn't captivate me. Given that this is really a sci-fi rather than a horror flick, and that sci-fi was in its very early stages, I suppose the movie needs to be cut a bit of slack. It was OK - nothing more, but also nothing less than that. 4/10","When you see Boris Karloff and Bela Lugosi as co-stars, you expect to find a well done horror film, but this was actually quite different, represented as it did what I would describing as an early endeavor at science fiction. Karloff and Lugosi both play scientists (Rukh and Benet respectively) - contenders to an extent, until Rukh wins Benet over with a manifestation that demonstrates his tremendous theory. The science here was - to say the least - a bit rough about the edges (hence science fiction, with the focuses on the fiction) but somehow Rukh harnesses some sorts of ray from Andromeda that enables him to gaze at the earth ""several thousand million years ago."" In that pre historic time, a tremendous meteorite slammed into Africa, leave deposit of a substance the scientists call ""Radium X"" - which can heal and destroys. A considerable portion of the movies is set rather tediously in Africa, on a quest for the meteorite deposit, which Rukh lastly finds and harnesses to create a tremendous weapon, unfortunately infecting himself with some sorts of disease that makes him a tremendous weapon as well.<br /><br />Karloff and Lugosi were both pretty good here. Lugosi pulls off a role in which he's the good dude quite well, although I honestly discovered him a bit unconvincing - specially during the scenes set in Africa. The stories also plodded along a bit, and while it holds my attention it didn't captivate me. Afforded that this is genuinely a sci-fi rather than a horror flick, and that sci-fi was in its very early phases, I presume the movies needs to be cut a bit of slack. It was OK - nothing more, but also nothing less than that. 4/10",Successful
916,"OK, I am not Japanese. I do know a little about Japanese culture, and a little less about Japanese pop culture. Other than that, I am Spanish, I eat paella and I like black humor.<br /><br />Good, with that point set, I can comment on the movie: I have no idea on how it is enjoyable to the Japanese audiences, Mamoru Oshii is quite a good director- despite the overly pedantic postmodern stuff in the style of Talking Head, and even that was curious and somehow interesting- and I am surprised he came up with this. It may just be one of those lost-in-translation cases, I am afraid it is, but as a European viewer watching the film with subtext overloaded English subtitles I just thought it was horrible. The jokes seemed bad, the script was overcooked- I mean, give the audience a break, and shut up a little you damn narrator- to the point of almost making my head explode over an overkill of fast-paced speaking and absurd action.<br /><br />However, I thought the animation was really cool. The idea is great, and it is well exploited in those animated scenes. However, the eye-candy finishes as soon as the characters are left aside to start with an endless not funny at all mumbo-jumbo speech over still pictures. It just makes you want to fast forward to the next cut-out hysterical characters scene.<br /><br />I read Mamoru Oshii is actually planning on a sequel for this. The idea was good but horribly exploited. Maybe the second part will bring up the good parts of this first one and actually make an interesting movie, or maybe it will be more and more over-narrated scenes. But hell, if you thought Talking Head was dense, Amazing Lifes of Fast Food Gifters will give cause you a stroke.<br /><br />Of course, all this comment is based on the experiences of someone who is European. Probably this is totally useless to Japanese people, maybe it was a really funny film lost in cultural frontiers and translation. Maybe.","ALRIGHT, I am not Japanese. I do know a little about Japan culture, and a little less about Japanese pop culture. Other than that, I am Spanish, I ate paella and I like black humor.<br /><br />Good, with that point set, I can comment on the movie: I have no idea on how it is enjoyable to the Japan audiences, Mamoru Oshii is quite a good director- despite the overly pedantic postmodern stuff in the style of Talking Head, and even that was curious and somehow interesting- and I am surprised he came up with this. It may just be one of those lost-in-translation case, I am afraid it is, but as a European viewer watching the film with subtext overloaded English subtitles I just thought it was appalling. The jokes seemed bad, the script was overcooked- I mean, give the audience a break, and shut up a little you goddam narrator- to the point of almost making my head explode over an overkill of fast-paced speaking and absurd action.<br /><br />However, I think the animation was really cool. The thought is great, and it is well exploited in those animated scenes. Nonetheless, the eye-candy finishes as soon as the character are left aside to start with an infinite not funny at all mumbo-jumbo speeches over still pictures. It just makes you wanna to fast forward to the next cut-out hysterical characters scene.<br /><br />I read Mamoru Oshii is actually planning on a sequel for this. The idea was good but terribly exploited. Perhaps the second part will bring up the good parts of this first one and actually make an interesting movie, or maybe it will be more and more over-narrated scenes. But hell, if you thought Talking Head was dense, Amazing Lifes of Fast Food Gifters will give cause you a stroke.<br /><br />Of course, all this comment is based on the experiences of someone who is European. Probably this is abundantly worthless to Japans people, potentially it was a really funny film lost in cultural frontiers and translation. Potentially.",Successful
527,"The director states in the Behind-the-Scenes feature that he loves horror movies. He loves them so much that he dedicated the movie to Dario Argento, as well as other notable directors such as George A. Romero and Tobe Hooper. Basically dedicating this movie to those great directors is like giving your mother a piece of sh*t for Mother's Day. The first thing they did wrong was the casting. CAST PEOPLE THAT CAN ACT. Also, don't cast a person that is 40 years old for the role of a misunderstood, 18 year old recluse. That's right, he's been in high school for 22 years. The reactions made by people as they watch their boyfriends get their hearts ripped out is amusing. Or like one part when a guy gets stabbed in the ear with an ear of corn (haha get it), and his girlfriend just goes, ""Oh..my.. God?"" The scarecrow himself is quite a character. Doing flips off cars and calling people losers.<br /><br />The movie does have one redeeming factor... oh wait, no it doesn't.<br /><br />If you absolutely MUST see this movie, than just watch the Rock and Roll trailer on the DVD. It covers about everything and has a really gnarly song dude.","The director states in the Behind-the-Scenes feature that he loves horror movies. He loves them so much that he dedicated the movie to Dario Argento, as well as other notable directors such as George A. Romero and Tobe Hooper. Chiefly dedicating this movie to those great directors is like giving your mother a piece of sh*t for Mother's Day. The first thing they did wrong was the casting. CAST PEOPLE THAT CAN ACT. Also, don't cast a person that is 40 years old for the role of a misunderstood, 18 year old recluse. That's right, he's been in high school for 22 years. The reactions made by people as they watch their boyfriends get their hearts ripped out is amusing. Or like one part when a guy gets stabbed in the ear with an ear of corn (haha get it), and his girlfriend just goes, ""Oh..my.. God?"" The scarecrow himself is quite a character. Doing flips off cars and calling people losers.<br /><br />The movie does have one redeeming factor... oh wait, no it doesn't.<br /><br />If you absolutely MUST see this movie, than just watch the Rock and Roll trailer on the DVD. It covers about everything and has a genuinely gnarly song dude.",Successful
282,"JUST CAUSE showcases Sean Connery as a Harvard law prof, Kate Capshaw (does she still get work?) as his wife (slight age difference) and Lawrence Fishburne as a racist southern cop (!) and Ed Harris in a totally over the top rendition of a fundamentalist southern serial killer.<br /><br />Weird casting, but the movie plays serious mindf** with the audience. (don't read if you ever intend to seriously watch this film or to ever watch this film seriously due to the spoilers) First of all, I felt myself rolling my eyes repeatedly at the Liberal stereotypes: the cops are all sadistic and frame this black guy with no evidence. The coroner, witnesses and even the lawyer of the accused collaborate against him (he is accused of the rape and murder of a young girl) because he is black.<br /><br />Connery is a Harvard law prof who gives impassioned speeches about the injustices against blacks and against the barbarous death penalty. He is approached by the convicted man's grandmother to defend him and re-open the trial.<br /><br />Connery is stonewalled (yawn...) by the small town officials and the good IL' boys club but finds that the case against Blair, the alleged killer, now on death row, was all fabricated. The main evidence was his confession which was beaten out of him.<br /><br />The beating was administered by a black cop (!) who even played Russian roulette to get the confession out of him. Connery finds out that another inmate on death row actually did the murder and after a few tete a tetes with a seriously overacting, Hannibal Lecter-like Ed Harris, he finds out where Harris hid the murder weapon.<br /><br />He gets a re-trial and Blair is freed.<br /><br />I think... film over....<br /><br />Then suddenly! It turns out that Blair IS a psychotic psycho and that he used ""white guilt"" to enlist Connery. He concocted the story with Ed Harris in return for Blair carrying out a few murders for Harris.<br /><br />now Blair is on the loose again, thanks to Connery's deluded PC principles! The final 30 min. are a weird action movie tacked onto a legal drama, Connery and Fishburne fighting the serial killer in an alligator skinning house on stilts (yes, you read that right) in the everglades.<br /><br />That was one weird film.<br /><br />So the whole system is corrupt and inefficient, the cops are all just bullies and Abu Graib type torturers, but the criminals are really psychotics and deserve to fry.<br /><br />Truly depressing on every level! The system is completely rotten and the PC white guilt types who challenge it are seriously deluded too.<br /><br />Two thumbs down. Connery obviously had to make a mortgage payment or something.","JUST CAUSE showcases Sean Connery as a Harvard law prof, Kate Capshaw (does she still get work?) as his wife (slight age difference) and Lawrence Fishburne as a racist southern cop (!) and Ed Harris in a fully over the top rendition of a fundamentalist southern serial killer.<br /><br />Strange cast, but the films plays serious mindf** with the audience. (don't read if you ever intend to seriously watch this film or to ever watch this film seriously due to the spoilers) First of all, I felt myself roll my eyes repeatedly at the Liberal stereotypes: the cops are all sadistic and frame this black guy with no evidence. The coroner, witnesses and even the lawyer of the indicted collaborate against him (he is indicted of the rape and murder of a young girl) because he is black.<br /><br />Connery is a Harvard law prof who gives impassioned speeches about the injustices against blacks and against the barbarous death penalty. He is approached by the convicts man's grandmother to defend him and re-open the trial.<br /><br />Connery is stonewalled (yawn...) by the small town officials and the good IL' boys club but finds that the cases against Blair, the presumed killer, now on death row, was all fabricated. The main evidence was his confession which was beaten out of him.<br /><br />The beating was administered by a black cop (!) who even played Russian roulette to get the confession out of him. Connery finds out that another inmates on death row actually did the murder and after a few tete a tetes with a severely overacting, Hannibal Lecter-like Ed Harris, he finds out where Harris hidden the murder weapon.<br /><br />He gets a re-trial and Blair is freed.<br /><br />I think... film over....<br /><br />Then suddenly! It turns out that Blair IS a psychotic psycho and that he utilizes ""white guilt"" to enlist Connery. He concocted the story with Ed Harris in return for Blair carries out a few murders for Harris.<br /><br />now Blair is on the loose again, thanks to Connery's deluded PC principles! The final 30 min. are a weird action movie tacked onto a legal drama, Connery and Fishburne fighting the serial killer in an alligator skinning house on stilts (yes, you read that right) in the everglades.<br /><br />That was one weird film.<br /><br />So the whole system is corrupt and inefficient, the cops are all just bullies and Abu Graib type torturers, but the criminals are really psychotics and deserve to fry.<br /><br />Truly depressing on every level! The system is completely rotten and the PC white guilt types who challenge it are seriously deluded too.<br /><br />Two thumbs down. Connery obviously had to make a mortgage payment or something.",Successful
372,"The episodic version of Robert Heinlein's Starship Troopers plays out at a deathly slow pace, following Johnny Rico leaving his parents, the (not very attractive) girl he lusts for, and joining the mobile infantry. The aliens in the show are nothing like the barbaric bugs from the film, instead being squid-like monsters that shoot lasers out of their mouths.<br /><br />Throughout watching this version, I was continually amazed at just how fruity they've managed to make the whole thing. The show is concerned mostly with the relationships between the recruits, and the aching, prolonged gazes they give each other through their battle armour visors, with 80s synth pop sometimes arriving *during* the sparse battle sequences which at last turning up in the final few episodes. In terms of construction, it owes a debt to Top Gun, sharing much in terms of pacing and content (and all that implies).","The episodic version of Robert Heinlein's Starship Troopers plays out at a deathly slow tempo, following Johnny Rico leaving his parents, the (not very attractive) girl he lusts for, and joining the mobile infantry. The alien in the show are nothing like the barbaric bugs from the film, instead being squid-like monsters that shoot lasers out of their mouths.<br /><br />Throughout watching this version, I was continually amazed at just how fruity they've managed to make the whole thing. The show is concerned mostly with the relationships between the recruits, and the aching, prolonged gazes they give each other through their battle armour visors, with 80s synth pop sometimes arriving *during* the sparse battle sequences which at last turning up in the final few episodes. In terms of construction, it owes a debt to Top Gun, sharing much in terms of pacing and content (and all that implies).",Successful
