,original,perturbed,type
932,"You know all those letters to ""Father Christmas"" and ""Jesus"" that are sent every year? Well, it turns out that they are not actually delivered but dropped off in a half-forgotten corner of the post office to rot unless some bright spark figures out a way of posting them. As bizarre settings go, it's a winner and one which perfectly fits the strange movie that is ""Dead Letter Office"". Having said that, this is obviously an Australian film as opposed to a British one. If it was Royal Mail, most letters get this sort of treatment anyway. I haven't been in this flat for two years and we're still getting letters for a Mr Wang, some female priest of the Church of Latter Day I've-Never-Heard-Of-You and various catalogues for industrial equipment addressed to a plumbing company.<br /><br />""Dead Letter Office"" (the name given to the place where undeliverable mail ends up) follows the story of Alice (Miranda Otto) who grows up in a seriously divided home. Writing to her absent father, she only learns in adulthood that her letters haven't been delivered for one reason or another. So, logically, she gets a job at the D.L.O. and finds herself working alongside other social rejects including the brooding Chilean immigrant Frank Lopez (George Del Hoyo). Slowly, she finds herself drawn to him but can she find out where her dad is without bringing the self-contained world of the Dead Letters Office to its knees?<br /><br />Nothing against this film but I was reminded of the god-awful Heather Graham film ""Committed"" while watching this. However, this is so much better than that pile of horse crap but then again, that ain't difficult. For a start, this film is much more logical. True, the metaphors are somewhat blatant and the underflowing symbolism quickly becomes a flood. But at least this is cohesive and quirky without being complete drivel. It is also well acted. Both Otto and Del Hoyo are very good as the lovers looking for something they know they'll never find while other characters are peripheral at best. Part of the trouble is that it seems to wrap up far too quickly, leaving this viewer somewhat disappointed. The other part is that when you consider Australia's draconian immigration policy (i.e. if you don't speak English, rack off!), such a story is unlikely to take place in reality. The other characters, sadly, also help to destabilise the realism by proving to be little more than odd-ball stereotypes.<br /><br />Despite that, ""Dead Letter Office"" is certainly something a little different. It might not be to everyone's taste but I liked it. Yes, it was hackneyed and predictable but sometimes, it's nice to watch a film without guns or violence or heavy-duty swearing and nudity (no chance of that in an Australian film). There ain't any major laughs, there's no Bullet Time and the characters are usually one-dimensional. But it's the story that counts here and while it's not earth-shattering in its magnificence, it's a pleasant enough way of passing the time. It's the movie equivalent of a Sheryl Crow CD - nice to listen to now and again but you wouldn't really miss it if it wasn't there.","You know all those letters to ""Father Christmas"" and ""Jesus"" that are sent every year? Well, it turns out that they are not actually delivered but dropped off in a half-forgotten corner of the post office to rot unless some bright spark figures out a way of posting them. As bizarre settings go, it's a winner and one which perfectly fits the strange movie that is ""Dead Letter Office"". Having said that, this is clearly an Australian film as opposed to a British one. If it was Royal Mail, most letters get this kind of treatment anyway. I haven't been in this flat for two years and we're still getting letters for a Mr Wang, some female priest of the Church of Latter Day I've-Never-Heard-Of-You and various catalogue for industrial devices addressed to a plumbing company.<br /><br />""Dead Letter Office"" (the name given to the place where undeliverable mail ends up) follows the story of Alice (Miranda Otto) who grows up in a seriously divided home. Writing to her absent father, she only learns in adulthood that her letters haven't been delivered for one reason or another. So, logically, she gets a job at the D.L.O. and finds herself working alongside other social rejects including the brooding Chilean immigrant Frank Lopez (George Del Hoyo). Slowly, she finds herself drawn to him but can she find out where her dad is without bringing the self-contained world of the Dead Letters Office to its knees?<br /><br />Nothing against this film but I was reminded of the god-awful Heather Graham film ""Committed"" while watching this. Nevertheless, this is so much better than that piling of horse shit but then again, that ain't difficult. For a start, this film is much more logical. True, the metaphors are somewhat blatant and the underflowing symbolism quickly becomes a flood. But at least this is cohesive and quirky without being complete drivel. It is also well acted. Both Otto and Del Hoyo are very good as the lovers searching for something they know they'll never find while other characters are peripheral at best. Part of the problem is that it seem to wrap up far too quickly, leaving this viewer somewhat disappointed. The other part is that when you consider Australia's draconian immigration policy (i.e. if you don't speak English, rack off!), such a story is unlikely to take place in reality. The other characters, sadly, also help to destabilise the realism by proving to be little more than odd-ball stereotypes.<br /><br />Despite that, ""Dead Letter Office"" is certainly something a little different. It might not be to everyone's taste but I liked it. Yes, it was hackneyed and predictable but sometimes, it's nice to watch a film without guns or violence or heavy-duty swearing and nudity (no chance of that in an Australian film). There ain't any major laughs, there's no Bullet Time and the characters are usually one-dimensional. But it's the story that counts here and while it's not earth-shattering in its magnificence, it's a pleasant enough way of passing the time. It's the movie equivalent of a Sheryl Crow CD - nice to listen to now and again but you wouldn't really miss it if it wasn't there.",Successful
413,"It figures this is a French film, LOL, with the emphasis on young girls with much older men...why is it the French are so fixated on this kind of thing? When the age difference is this great, it really comes off as pervy! Valentina Cervi is beautiful (she bears a strong resemblance to Olivia Hussey, of Zeffirelli's '68 Romeo and Juliet, set in a similar period), but she looks about 15 and the actor playing Tassi, her painting instructor, looks...well, 50 is KIND.<br /><br />Other posters have done the work of explaining the historical record (unusually detailed in this case) of the real Artemisia, a great artist and one of the earliest recognized female painters of this period (17th century). Her story speaks to us in modern times particularly because of the age-old accusation that ""all great artists were men"" -- she pretty much blasts that assertion to bits -- and because the story of her rape trial is so poignant. Not only was she clearly assaulted, and forced into a degrading sexual relationship (because in those days marriage to your assaulter was the only way to avoid social shame), but Tassi was a serial rapist and possibly killed his wife and child.<br /><br />The movie does a terrible disservice by inverting this truly fascinating and remarkable real life story -- very dramatic and not in need of any ""spicing up"" -- because in some weird Frencified way, it's ""hotter"" to have an oversexed teenager drawing male sexual organs and having a hot love affair with a man old enough to be her grandfather. That's ""sexy"" -- the truth is boring and seems too feminist/politically correct.<br /><br />It also disturbs me that this is ONLY part of Artemisia life considered interesting enough to film. The fact that she painted for decades (her famous painting of Judith beheading Holfernes was painted AFTER, not before the rape), that she was the first woman admitted to the prestigious Florentine Academy, that she went on to have children...oh that's boring stuff. After all, that's about a middle aged woman and they aren't ""hot"" like teenagers.<br /><br />I understand that there is a lot of creative license in making a film (or a book) about a real historical character. You need to create dialog, have subplots, create dramatic structure. Certainly some details can be sacrificed -- it's no big deal if the dates are moved a few years, or if Artemisia is played by a blonde actress (when we know from her self portraits that she was a brunette...and a big boned one, not a skinny minny), or something like that. But to turn her story around on her, and make rape into a romance is actually sick and disturbing. It's even worse because the director is female. She should be horribly ashamed of herself!<br /><br />If you LIKE this (and I know some people could care less about the real woman artist and just like period costumes and hot sex), you will probably like ""Dangerous Beauty"" with Rufus Sewell and Catherine McCormack. Similarly based on heavily re-written history, with lots of heaving bosoms and jewel encrusted goblets: Bon Appetit!","It figures this is a French film, LOL, with the emphasis on young girls with much older men...why is it the French are so fixated on this kind of thing? When the age difference is this great, it really comes off as pervy! Valentina Cervi is beautiful (she bears a strong resemblance to Olivia Hussey, of Zeffirelli's '68 Romeo and Juliet, set in a similar period), but she looks about 15 and the actor playing Tassi, her painting instructor, looks...well, 50 is KIND.<br /><br />Other posters have done the work of explaining the historical record (unusually detailed in this case) of the real Artemisia, a great artist and one of the earliest recognized female painters of this period (17th century). Her story speaks to us in modern times particularly because of the age-old accusation that ""all great artists were men"" -- she pretty much blasts that assertion to bits -- and because the story of her rape trial is so poignant. Not only was she clearly assaulted, and forced into a degrading sexual relationship (because in those days marriage to your assaulter was the only way to avoid social shame), but Tassi was a serial rapist and possibly killed his wife and child.<br /><br />The movie does a frightful disservice by inverting this truly fascinating and remarkable real life story -- very dramatic and not in need of any ""spicing up"" -- because in some weird Frencified way, it's ""hotter"" to have an oversexed teenager drawing male sexual organs and having a hot love affair with a man old enough to be her grandfather. That's ""sexy"" -- the truth is boring and seems too feminist/politically correct.<br /><br />It also disturbs me that this is ONLY part of Artemisia life considered interesting enough to film. The fact that she painted for decades (her famous painting of Judith beheading Holfernes was painted AFTER, not before the rape), that she was the first woman admitted to the prestigious Florentine Academy, that she went on to have children...oh that's boring stuff. After all, that's about a middle aged woman and they aren't ""hot"" like teenagers.<br /><br />I understand that there is a lot of creative license in making a film (or a book) about a real historical character. You need to create dialog, have subplots, create dramatic structure. Certainly some details can be sacrificed -- it's no big deal if the dates are moved a few years, or if Artemisia is played by a blonde actress (when we know from her self portraits that she was a brunette...and a big boned one, not a skinny minny), or something like that. But to turn her story around on her, and make rape into a romance is actually sick and disturbing. It's even worse because the director is female. She should be horribly ashamed of herself!<br /><br />If you LIKE this (and I know some people could care less about the real woman artist and just like period costumes and hot sex), you will probably like ""Dangerous Beauty"" with Rufus Sewell and Catherine McCormack. Similarly based on heavily re-written history, with lots of heaving bosoms and jewel encrusted goblets: Bon Appetit!",Successful
199,"Mann photographs the Alberta Rocky Mountains in a superb fashion, and Jimmy Stewart and Walter Brennan give enjoyable performances as they always seem to do. <br /><br />But come on Hollywood - a Mountie telling the people of Dawson City, Yukon to elect themselves a marshal (yes a marshal!) and to enforce the law themselves, then gunfighters battling it out on the streets for control of the town? <br /><br />Nothing even remotely resembling that happened on the Canadian side of the border during the Klondike gold rush. Mr. Mann and company appear to have mistaken Dawson City for Deadwood, the Canadian North for the American Wild West.<br /><br />Canadian viewers be prepared for a Reefer Madness type of enjoyable howl with this ludicrous plot, or, to shake your head in disgust.","Mann photographing the Alberta Rocky Mountains in a superb fashion, and Jimmy Stewart and Walter Brennan give enjoyable performances as they always seem to do. <br /><br />But coming on Hollywood - a Mountie telling the people of Dawson City, Yukon to elect themselves a marshal (yes a marshal!) and to enforce the law themselves, then gunfighters battling it out on the streets for control of the town? <br /><br />Nothing even remotely resembling that happened on the Canadian side of the border during the Klondike gold rush. Mr. Mann and company appear to have mistaken Dawson City for Deadwood, the Canadian North for the American Wild West.<br /><br />Canadian viewers be prepared for a Reefer Madness types of enjoyable howl with this farcical plot, or, to shake your head in loathing.",Successful
345,"SHALLOW GRAVE begins with either a tribute or a rip off of the shower scene in PSYCHO. (I'm leaning toward rip off.) After that it gets worse and then surprisingly gets better, almost to the point of being original. Bad acting and amateurish directing bog down a fairly interesting little story, but the film already surpasses many in the ""Yankee comes down South to get killed by a bunch of rednecks"" genre because it is actually shot in the South.<br /><br />A group of college girls head to Ft. Lauderdale for summer vacation and are waylaid in Georgia by a flat tire after getting off the main road. (Note to Yankees: stay on the highway when you go to Florida.) Sue Ellen (Lisa Stahl) has to pee so she heads into the woods. When she finally finds a good spot to do her business she witnesses the local sheriff (Tony March) strangle his mistress (Merry Rozelle) to death. (Note to Yankees: do not wander off into the woods when in the South; not because you might witness a murder, but you may run across a marijuana plantation.) This is the point where the story, not the movie, actually comes close to being good.<br /><br />While Tony March will never have to practice his Oscar speech, his Sheriff Dean becomes a creepy facsimile of a normal guy torn by what he has done and what he must do. Tom Law is likable as Deputy Scott and is as authentic a Southern deputy as I've seen since Walton Goggins (Deputy Steve Naish) in HOUSE OF 1000 CORPSES.<br /><br />A few scenes in the movie are worth the mention. The girls stop at a BBQ in South Carolina and display their racism when a big black guy checks them out. Sue Ellen runs into a barn to hide behind some hay bales and in a shockingly realistic moment a large snake is hiding in the hay with her.<br /><br />And in the strangest scene, Sheriff Dean makes like he's about to rape Patty (Carol Cadby) and tells her to take off her clothes. Dean has turned the radio up to drown out the noise of what he's about to do. The preacher on the radio needs to go back and read his Bible. His sermon is about how Jezebel is saved by the blood of Jesus Christ. I feel sorry for this preacher's flock. Jezebel was in the Old Testament a few thousand years before Christ was born and by no means is she one of the five people you are going to meet in Heaven.","SHALLOW GRAVE commences with either a tribute or a rip off of the shower scene in PSYCHO. (I'm leaning towards rip off.) After that it gets worse and then surprisingly gets better, approximately to the point of being original. Bad acting and amateurish directing bog down a relatively interesting small tale, but the film already surpasses many in the ""Yankee happens down South to get killed by a bunch of rednecks"" genre because it is actually shot in the South.<br /><br />A group of college girls head to Ft. Lauderdale for summer vacation and are waylaid in Georgia by a flat tire after getting off the main path. (Noting to Yankees: stay on the highway when you go to Florida.) Sue Ellen (Lisa Stahl) has to pee so she heads into the woods. When she ultimately discoveries a good spot to do her business she witnesses the local sheriff (Toni March) strangle his mistress (Jubilant Rozelle) to death. (Notes to Yankees: do not wander off into the woods when in the South; not because you perhaps witness a murder, but you may run across a marijuana plantation.) This is the point where the story, not the film, actually happens close to being good.<br /><br />Although Tony March will never have to practice his Oscars speech, his Sheriff Dean becoming a creepy facsimile of a normal guy torn by what he has done and what he must do. Tom Law is likable as Deputy Scott and is as authentic a Southern deputy as I've seen since Walton Goggins (Deputy Steve Naish) in HOMES OF 1000 CORPSES.<br /><br />A few scenes in the movie are worth the mention. The girls stop at a BBQ in Southward Carolina and show their racism when a vast negro guy check them out. Sue Ellen runs into a barn to concealment backside some hay bales and in a stunningly realistic moment a vast snake is hide in the hay with her.<br /><br />And in the strangest scene, Sheriff Dean makes like he's about to rape Patty (Carol Cadby) and tells her to take off her clothing. Dean has turned the radio up to drowning out the noise of what he's about to do. The preacher on the radio need to go back and read his Bible. His preaching is about how Jezebel is saved by the blood of Jesus Christ. I feel sorry for this preacher's flock. Jezebel was in the Old Testament a few thousand years before Christ was born and by no means is she one of the five people you are going to meet in Heaven.",Successful
727,"I finally caught up to ""Starlight"" last night on television and all I can say is. . . wow! It's hard to know where to begin -- the incredibly hokey special effects (check out the laser beams shooting out of Willie's eyes!), the atrocious acting, the ponderous dialogue, the mismatched use of stock footage, or the air of earnest pretentiousness that infuses the entire production. This truly is a one-of-a-kind experience, and we should all be thankful for that. I nominate Jonathon Kay as the true heir to Ed Wood!","I finally caught up to ""Starlight"" last night on television and all I can say is. . . wow! It's hard to know where to begin -- the tremendously hokey special effects (check out the laser beams shooting out of Willie's eyes!), the horrifying acting, the ponderous dialogues, the mismatch utilizes of stock footage, or the air of earnest pretentiousness that infuses the entirety production. This truly is a one-of-a-kind experience, and we should all be thankful for that. I nominate Jonathon Kay as the true heir to Ed Wood!",Successful
377,"Jamie Foxx is my favorite comedian. However, I feel that he sold out in order to gain his first big budget lead role. Foxx follows in the footsteps of the likes of Chris Tucker, Martin Lawrence and Dave Chapple, who have all seen their talents wasted by stereotyping producers who think black males who commit pretty crimes is a funny concept (See: Money Talks, Blue Streak).<br /><br />Okay I laughed a few times and granted all of these comedians continue to pick up hilarious roles, but I would love to see these guys branch out ala Marlon Wayans portrayal in Requiem to a Dream. Or In Living Color's Tommy Davidson and Damon Wayans moving performances in Spike Lee's satire Bamboozled.","Jamie Foxx is my favorite comedian. Nevertheless, I feel that he sold out in order to gain his first big budgeted lead role. Foxx follows in the footsteps of the likes of Chris Tucker, Martin Lawrence and Dave Chapple, who have all seen their talents wasted by stereotyping producers who thoughts black males who commit pretty crimes is a funny concept (See: Money Talks, Blue Streak).<br /><br />Okay I laughed a few times and granted all of these comedians continue to pick up hilarious roles, but I would love to see these guys branch out ala Marlon Wayans portrayal in Requiem to a Dream. Or In Living Color's Tommy Davidson and Damon Wayans moving performances in Spike Lee's satire Bamboozled.",Successful
205,"This movie was made-for-TV, so taking that into account, I'm not going to rip into it as hard as I would a feature film. The script is sub-par, but it does succeed in being mildly humorous in spots, whether it means to be or not. The acting is mostly over-the-top, but that is true for many lower-budget movies.<br /><br />The aspect of this movie that I really hated, though, was that 90-95% of it is shot on film, but in random places, there will be 5-10 seconds where the footage is shot on video. You can tell because there is less contrast, the colors are less vivid, and the footage is clearly 30 frames per second instead of film's 24 frames per second. I'm not sure if maybe these scenes had to be shot later and at that time they didn't have the money to shoot on film (I assume this is why, anyway), but it is disorienting and really makes the film look shoddier than it had to look.<br /><br />Anyway, I've definitely seen worse movies, but I definitely wouldn't say that I enjoyed this movie and I can't recommend that anyone see it.","This film was made-for-TV, so taking that into account, I'm not going to tear into it as hard as I would a feature films. The script is sub-par, but it does succeed in being mildly humorous in spots, whether it means to be or not. The acting is principally over-the-top, but that is authentic for many lower-budget cinema.<br /><br />The aspect of this film that I really hates, although, was that 90-95% of it is shot on films, but in random places, there will be 5-10 second where the footage is shot on video. You can tell because there is less contrast, the colors are less vivid, and the footage is clearly 30 frames per second instead of film's 24 framework per second. I'm not sure if might these scenes had to be shot later and at that time they didn't have the money to shoot on film (I assume this is why, anyhow), but it is disorienting and truly makes the films look shoddier than it had to gaze.<br /><br />Anyhow, I've undoubtedly seen worse movies, but I assuredly wouldn't say that I enjoyed this movie and I can't recommend that someone behold it.",Successful
280,"I've seen my fair share of badly thought-out endings and final twists to films, but I don't recall any film that committed outright suicide like this one did.<br /><br />The film makers were clearly hoping that the great twist would 'surprise' us all.... and it did, but perhaps not in the way the directors had hoped. I was left feeling surprised that Connery, Harris, Fishburn and Capshaw had anything to do with this turkey, individually or collectively.<br /><br />The film up until the final thirty minutes was rather engaging and I like the way the story was unfolding and the nature of the film overall. But once the twist was revealed, the plot holes and inconsistencies were remarkable, the underlying motive for revenge was ill-conceived and the ways things so neatly worked out for Bobby Earl was ridiculously far-fetched. What's worse is that, once the twist was revealed, the remainder of the film became excruciatingly predictable.<br /><br />Harris gave a terrific performance and Connery is like Morgan Freeman in that he never gives a bad performance, even if the movie ain't that great! So all in all, it starts well and the unfolding keeps the viewer interested. The last 30 minutes is one of the most memorable nose dives in the history of cinema.","I've seen my fair shares of badly thought-out endings and final twists to films, but I don't recall any films that perpetrated outright suicide like this one did.<br /><br />The film makers were clearly hoping that the tremendous twist would 'surprise' us all.... and it did, but perhaps not in the way the directors had hoped. I was left feeling surprised that Connery, Harris, Fishburn and Capshaw had anything to do with this turkey, individually or collectively.<br /><br />The film up until the final thirty minutes was rather engaging and I like the way the story was unfolding and the nature of the film overall. But once the twist was showed, the plot holes and inconsistencies were remarkable, the underlying motive for revengeful was ill-conceived and the ways things so neatly worked out for Bobby Earl was absurdly far-fetched. What's worse is that, once the twist was revealed, the rest of the films became excruciatingly predictable.<br /><br />Harris yielded a terrific performance and Connery is like Morgan Freeman in that he never provides a bad performance, even if the film ain't that great! So all in all, it commences well and the unfolding keeps the viewer interested. The last 30 minutes is one of the most memorable nose dive in the history of cinema.",Successful
