,original,perturbed,type
633,"Bela Lugosi is not typecast in this fantastic twelve-part adventure serial, playing the lead as Frank Chandler/Chandu the Magician, enjoying his role as a representative of the forces of White Magic pushed against those of Black, while displaying vigourous fighting skill, successfully wooing a young Egyptian princess, and cutting a lean and dashing figure in yachting gear, complete with nautical cap. The somewhat lumpy plot engages Chandler/Chandu in an ongoing series of escapades pointed at achieving the rescue of his fiancee, Princess Nadji(Maria Alba) and others from the clutches of the idol-worshipping sect of Ubasti, which covets Nadji's blood in order to revivify an ancient mummified princess entombed upon the mysterious island of Lemuria. Director Ray Taylor, an old hand at such entertainments keeps events moving briskly, but repeated scenes and footage, a good deal of which is to be found in the previous year's Skull Island setting from KING KONG, and the port locale from SON OF KONG, reduces original action to less than 60 minutes from the serial's running length of over two and one-half hours and, if viewed at one sitting, becomes lacking in effect to most viewers, unless insomniac.","Bela Lugosi is not typecast in this superb twelve-part adventure series, play the lead as Frank Chandler/Chandu the Magician, enjoying his role as a representative of the forces of White Magic pushed against those of Black, while show vigourous combats skills, successfully wooing a young Egyptian princess, and cutting a lean and dashing figure in yachting gear, complete with nautical cap. The somewhat lumpy plot engages Chandler/Chandu in an ongoing series of escapades pointed at achieve the rescuing of his fiancee, Princess Nadji(Maria Alba) and others from the clutches of the idol-worshipping sect of Ubasti, which covets Nadji's blood in order to revivify an ancient mummified princess entombed upon the mysterious island of Lemuria. Director Ray Taylor, an old hand at such entertainments keeps events moving briskly, but recurrent scenes and footage, a good deal of which is to be found in the preceding year's Skull Island settings from KING KONG, and the port locale from SON OF KONG, reduced original actions to less than 60 minutes from the serial's running duration of over two and one-half hours and, if viewed at one sit, becoming lack in effect to most viewers, unless insomniac.",Successful
835,"Let's see. In the ""St. Elsewhere"" finale we found out that there was no hospital and that every thing had been in the mind of an autistic child. ""Newhart"" ended by telling us that it had all been a dream. And ""Roseanne"" ended by telling us that it all had taken place in her mind. Very ""creative"". Annoying was more like it. Yes, it was just a TV show and wasn't at all reality. It's just that when you get caught up in a great movie or TV show you end up at least wanting to believe that it's all ""real"". At least as far as the reality it portrays on screen. This type of series finale had been done twice before and was old hat, frustrating and simply not fun to watch. Now ""Newhart"" being all a dream? At least done in a creative way that far exceeded the expectations of anyone who loved the show. The idea itself was not too engaging but it was so brilliantly done that its arguably the Best Series Finale Ever. Roseanne left me feeling cheated after being such a loyal fan.","Let's behold. In the ""St. Elsewhere"" finale we found out that there was no hospital and that everything thing had been in the mind of an autistic child. ""Newhart"" ended by telling us that it had all been a dream. And ""Roseanne"" ended by telling us that it all had taken place in her mind. Very ""creative"". Annoying was more like it. Yes, it was just a TV show and wasn't at all reality. It's just that when you get caught up in a great movie or TELEVISION show you end up at least wanting to believe that it's all ""real"". At least as far as the reality it portrays on screen. This type of series finale had been accomplished twice before and was old hat, frustrating and merely not fun to watch. Now ""Newhart"" being all a dream? At least accomplished in a creative manner that far surpassed the expectations of anyone who adore the show. The thought itself was not too engaging but it was so beautifully accomplished that its arguably the Best Series Finale Ever. Roseanne left me feeling cheated after being such a faithful fan.",Successful
81,"I have been looking for this film for ages because it is quite rare to find as it was one of the video nasties. I finally found it on DVD at the end of last year it is a very low budget movie The story is set around amazon jungle tribes that are living in fear of the devil. Laura Crawford is a model who is kidnapped by a gang of thugs while she is working in South America. They take her into the jungle Laura is guarded by some ridiculous native who calls himself ""The Devil"" she has to go though all unpleasant things until they are happy. Maidens are Chained up. The devil demonstrates eating flesh in a horrible manner. Peter Weston, is the devil hunter, who goes into the jungle to try and rescue her,","I have been searching for this films for ages because it is quite rare to unearth as it was one of the video nasties. I finally discovered it on DVD at the end of last year it is a very low budgetary film The tale is set about amazon jungle tribal that are living in fear of the devil. Laura Crawford is a model who is kidnapped by a gang of thugs while she is work in South America. They take her into the jungle Laura is guarded by some absurd native who calls himself ""The Devil"" she has to go though all unpleasant things until they are happy. Maidens are Chained up. The devil illustrates eating flesh in a terrifying manner. Peter Weston, is the devil hunter, who goes into the jungle to try and rescues her,",Successful
391,"A particularly maligned example of Italian cult cinema with a nonsensical title to boot (if anything, the alternate THE MARK OF Satan is even less relevant to the plot!), this hybrid of Gothic Horror and Giallo (with a strong dose of Erotica) only contrives a flat sort of atmosphere throughout  actually matched by handling which is downright dreadful! Here, we get the usual group of people (an acting troupe) stranded on an island (to which they were invited by a Count  since he had become enamored of the leading lady, a dead-ringer for his missing spouse)! The characters are pretty much stereotypes: middle-aged but dashing hero (played by Giacomo Rossi-Stuart and whose family history bears more than its share of violent tragedy), demure heroine, sluttish companion (recalling Mae West and emerging the most annoying of the lot!), a meek but devoted stage manager (forever chided by one and all for his unmanly behavior!), a couple of lesbians, a mysterious gardener (the ubiquitous Luciano Pigozzi who, for once, gets in on the action, if you know what I mean), an envious housekeeper (nominal star Femi Benussi though, for what it is worth, this is really an ensemble piece), a religious fanatic of a butler, an impressionable chambermaid, etc. While the film is not by any means unwatchable, the atrocious dubbing, snail's pace, shoddy production (with the scenes depicting the raging sea lifted from some black-and-white film!) and the fact that the murders only occur within the concluding half-hour do not help matters. Besides, Marcello Giombini's score, though pleasant in itself, comes off as incongruously modern under the circumstances; that said, the revelation proves a surprisingly elaborate one (considering there is surely no shortage of suspects here).","A specially maligned examples of Italian cult cinema with a nonsensical title to boot (if something, the alternate THE MARK OF Satan is even less relevant to the plot!), this hybrid of Gothic Horror and Giallo (with a strong dose of Erotica) only contrives a flat sorts of atmosphere throughout  actually matched by handling which is downright dreadful! Here, we get the usual groups of people (an acting troupe) stranded on an island (to which they were invited by a Count  since he had become enamored of the leading lady, a dead-ringer for his missing spouse)! The character are pretty much stereotypes: middle-aged but dashing hero (played by Giacomo Rossi-Stuart and which family histories bears more than its exchanges of violent tragedy), demure heroine, sluttish companion (recalls Mae West and emerging the most irritating of the lot!), a meek but dedicated stage manager (forever chided by one and all for his unmanly behaviors!), a couple of lesbians, a mysterious gardener (the pervasive Luciano Pigozzi who, for once, gets in on the action, if you know what I mean), an envious housekeeper (nominal star Femi Benussi though, for what it is worth, this is genuinely an ensemble piece), a religious fanatic of a butler, an impressionable chambermaid, etc. While the film is not by any means unwatchable, the horrifying dubbing, snail's pace, shoddy production (with the scenes portraying the raging sea lifted from some black-and-white films!) and the fact that the murder only occur within the concluding half-hour do not assist issues. Additionally, Marcello Giombini's score, though enjoyable in itself, happens off as incongruously modern under the situations; that says, the revelation proves a surprisingly elaborate one (consider there is definitely no shortage of suspects here).",Successful
180,"Well, as Goethe once said, there really isn't any point in trying to pass a negative judgement that aspires to be objective on ""something that has had a great effect"". ""La Maman et La Putain"" has surely passed into history as an influence on much of what's been done in France and elsewhere in the past thirty years and no one interested in the history of film, certainly, should be dissuaded from watching it. To express a purely subjective judgement, however, I feel compelled to disagree with almost every other review posted here and say to people: ""Don't watch it; it's a waste of hours of your time that will just leave you feeling rather sick and angry."" And by that I don't mean ""sick and angry"" about ""the human condition"" or anything so general and profound as that, because that is exactly the line that most critics have adopted in their fulsome praise of the film - ""an ordeal to watch in its ruthless dissection of our emotional cowardice and cruelty"" and so on - and, if it really managed to put across a universally or even broadly relevant message of this sort, then the director would have good reason to be satisfied with himself, however pessimistic his conclusions may be. My beef with the film is rather that I don't see this hours-long record of empty vanity and petty treachery as being justified or excused by any GENERALLY relevant message at all. All three main characters are deeply morally unattractive individuals: Alexandre to the greatest degree, of course, because we see by far the most of him and because he seldom shuts up for more than thirty seconds; Marie perhaps to the least degree, because we see the least of her. Alexandre's affected and pretentious monologues have a kind of amusement value, of course, but the amusement wears thin as one comes more and more clearly to realize that Jean-Pierre Léaud is most likely not even acting and that, with absurd remarks like ""un homme beau comme un film de Nicholas Ray"", he really was just reproducing word-for-word opinions that were accepted as authentic and profound by the milieu in which he, along with the director Eustache, had been living for about ten years by the time of the making of the film. I suppose if the tone of relentless superficiality and triviality had been sustained throughout 100% of the film, it might have worked as a long sardonic comedy about a particularly shallow, worthless and despicable post-'68 milieu. What made, however, this viewer at least extremely angry with the director was his granting of at least one lengthy scene each to Alexandre and Veronika in which we are clearly expected to empathize with and feel for them as if they shared a moral universe with us. If a man can get away with living in the flat of and professing to love one woman, sleeping (mostly in this very flat) with another, and running around Paris proposing marriage to yet a third, well, I suppose I can wish him the best of luck in the dog-eat-dog world he's chosen to create for himself. What I can't, however, in all conscience do is listen even for a moment to maudlin monologues from him in which he speaks about his ""anxiety"" and his ""despair"". The same goes double for the even more despicable Veronika, whom we are shown barging drunk into the apartment and even the bed shared by Marie and Alexandre and behaving there with an infantile inconsistency tantamount to the most savage and heartless cruelty. As I say, if ""La Maman et La Putain"" is intended to be nothing more nor other than a portrait of Alexandre, Veronika and Marie, three individuals whom any even halfway decent person would never admit into their company let alone their home, then I suppose there is a kind of legitimacy in praising the director for being ""unflinching"" (though why one should even feel like ""flinching"" once one had consciously opted to create such thoroughly repellent characters to filmically observe I can't imagine). The problem, however, is that the director is clearly convinced - and appears to have succeeded in convincing generations of critics - that Alexander, Veronika and Marie are somehow representative of human beings in general and of the limits of human beings' emotional capabilities. This latter idea, however, is arrant and offensive nonsense. There may indeed be an inherent fallibility and tendency to tragedy in human relations in general and sexual relations in particular. But the nature and degree of this fallibility and tendency to tragedy can only possibly be determined by people who make a sincere and serious effort to make such relations work. It surely needs no cinematic or authorial genius to convey to us the information that a man who behaves like Alexandre is going to end up hated, miserable, and alone, or that women who insist on expecting love from a man like Alexandre are going to end up disappointed and bitter. Watch ""La Maman et La Putain"" if you're historically interested in what passed for culture and human interaction in a certain post-'68 Parisian milieu which was probably, unfortunately, not restricted to just a few particularly anti-social types like these. But please don't make the mistake of believing that what is recorded here has any general relevance for humanity in the way that a film by Jean Renoir or Martin Scorsese might be argued to have.","Well, as Goethe once say, there truly isn't any point in trying to pass a negative judgement that aspires to be objective on ""something that has had a great effect"". ""La Maman et La Putain"" has definitely passed into history as an influence on much of what's been done in France and elsewhere in the past thirty years and no one interested in the history of films, undoubtedly, should be deterred from watching it. To expresses a purely subjective judgement, nonetheless, I feel compelled to disagree with almost every other reviewed posted here and say to people: ""Don't watch it; it's a waste of hours of your time that will just leave you feeling rather ill and angry."" And by that I don't mean ""ill and angry"" about ""the human condition"" or anything so general and profound as that, because that is accurately the line that most critics have adopted in their fulsome praise of the film - ""an ordeal to watch in its ruthless dissection of our emotional cowardice and cruelty"" and so on - and, if it really managed to put across a universally or even broadly relevant message of this sort, then the director would have good reasons to be satisfied with himself, nevertheless pessimistic his finding may be. My beef with the film is rather that I don't see this hours-long record of empty vanity and inconsequential treachery as being warranted or excused by any GENERALLY relevant messages at all. All three main traits are deeply morally unattractive individuals: Alexandre to the greatest degree, of course, because we see by far the most of him and because he seldom shuts up for more than thirty seconds; Marie perhaps to the fewest degree, because we behold the least of her. Alexandre's affected and conceited monologues have a genre of amusement value, of course, but the amusement wears thin as one comes more and more clearly to realize that Jean-Pierre Léaud is most likely not even acting and that, with absurd comments like ""un homme beau comme un film de Nicholas Ray"", he genuinely was just reproducing word-for-word opinion that were accepts as authentic and profound by the milieu in which he, along with the director Eustache, had been living for about ten years by the time of the making of the film. I reckon if the tone of relentless superficiality and triviality had been sustained throughout 100% of the film, it might have worked as a long sardonic comedy about a particularly shallow, worthless and despicable post-'68 milieu. What made, however, this viewer at least extremely angry with the director was his granting of at least one lengthy scene each to Alexandre and Veronika in which we are clearly expected to empathize with and feel for them as if they shared a moral universe with us. If a man can get away with living in the flat of and professing to love one woman, sleeping (mostly in this very flat) with another, and running around Paris proposing marriage to yet a third, well, I suppose I can wish him the best of luck in the dog-eat-dog world he's chosen to create for himself. What I can't, however, in all conscience do is listen even for a moment to maudlin monologues from him in which he speaks about his ""anxiety"" and his ""despair"". The same goes double for the even more despicable Veronika, whom we are shown barging drunk into the apartment and even the bed shared by Marie and Alexandre and behaving there with an infantile inconsistency tantamount to the most savage and heartless cruelty. As I say, if ""La Maman et La Putain"" is intended to be nothing more nor other than a portrait of Alexandre, Veronika and Marie, three individuals whom any even halfway decent person would never admit into their company let alone their home, then I suppose there is a kind of legitimacy in praising the director for being ""unflinching"" (though why one should even feel like ""flinching"" once one had consciously opted to create such thoroughly repellent characters to filmically observe I can't imagine). The problem, however, is that the director is clearly convinced - and appears to have succeeded in convincing generations of critics - that Alexander, Veronika and Marie are somehow representative of human beings in general and of the limits of human beings' emotional capabilities. This latter idea, however, is arrant and offensive nonsense. There may indeed be an inherent fallibility and tendency to tragedy in human relations in general and sexual relations in particular. But the nature and degree of this fallibility and tendency to tragedy can only possibly be determined by people who make a sincere and serious effort to make such relations work. It surely needs no cinematic or authorial genius to convey to us the information that a man who behaves like Alexandre is going to end up hated, miserable, and alone, or that women who insist on expecting love from a man like Alexandre are going to end up disappointed and bitter. Watch ""La Maman et La Putain"" if you're historically interested in what passed for culture and human interaction in a certain post-'68 Parisian milieu which was probably, unfortunately, not restricted to just a few particularly anti-social types like these. But please don't make the mistake of believing that what is recorded here has any general relevance for humanity in the way that a film by Jean Renoir or Martin Scorsese might be argued to have.",Successful
954,"First I liked that movie. It seemed to me a nice comedy with some silly moments. The costume designer Albert Wolsky did his best!!! The same as wonderful set decorator Robert R. Benton - this man really had a very good taste!!! But the script writers disappointed me extremely. The best ending would be the scene on the ladder, but instead of it, they decided that the father and his daughter should be together. Don't like the ending. The father becomes boyfriend of his own daughter and his ex-wife knows about it and finds it alright. It would be OK, if the scriptwriters would for example say that now there is a different soul in the body, but they did not, they only deprived him of memories. The actors were good, they were really funny. Cybill Shepherd was charming, Robert Downey Jr. was very funny in the dancing scene : )))... But some of the moments spoil even the impression of good acting. For example, Corinne Jeffries, played by Cybill Shepherd after the death of her husband was waiting for him 23 years (it's a long time!), she was true to him, she loved nobody but him, and when she met him and was just about making love to him, after a scene with her friend Philip Train (Ryan O'Neal), she very easily betrayed the man she was longing for so many years!!! It would be a good movie, if not the ending and some missed human psychology.","First I liked that film. It seemed to me a nice comedy with some silly moments. The costume designer Albert Wolsky did his best!!! The same as resplendent set decorator Robert rs. Benton - this man truly had a very good taste!!! But the script writers disappointed me extraordinarily. The best ending would be the scene on the ladder, but instead of it, they decided that the father and his daughter should be together. Don't like the terminating. The fathers becoming boyfriend of his own daughter and his ex-wife knows about it and finds it ok. It would be OKAY, if the scriptwriters would for example say that now there is a different soul in the body, but they did not, they only deprived him of memories. The actors were good, they were truly funny. Cybill Shepherd was lovely, Robert Downey Jr. was very funny in the dance scene : )))... But some of the moments spoil even the impression of good acting. For examples, Corinne Jeffries, played by Cybill Shepherd after the death of her husband was waiting for him 23 years (it's a long time!), she was true to him, she loved nobody but him, and when she met him and was just about making love to him, after a scene with her friends Philip Train (Ryan O'Neal), she very easily betrayed the man she was longing for so many years!!! It would be a good film, if not the ending and some missed human psychology.",Successful
