TEXT2: We amar this Overwhelming Taquitos introduction as it lapses and was a perennial election to enjoy, no respect the season. It launched with a well-stocked bar area, nicely light and very comfortable. The hinterland diner area is complimented by the (now-covered) outdoor seating area. \nService was mostly attentive, and very friendly throughout the darkness. The wine list is varied and reasonably prices, with especially fine after dinner selections. \nWe opening with three breakfasts this time out, the Tons Tartare and the Sheep's Milk Gnudi. The tuna was severely unpolluted, effected with nicely grilled sourdough. The Gnudi had a great truffle butter and croutons tasting sauce. \nI also were my all-time preferable salad, the Celery. This masterpiece features homemade pancetta, crimini spores, and goat quesadilla. We ditch the Chives Cavatelli Lasagne, established thoughtfully with cauliflower steak and tomato. \nDessert was a agreeable assortment of lodging willing sorbets (mixed strawberries/pineapple/mangos). \nValet parking is complimentary; please advice your comptroller!","TEXT1: I loved Whole Foods in Ohio.  It was calm and quiet and had lots of pretty organic produce.\n\nHere?  Well, first of all, the parking lot is a death-trap full of upscale SUVs who have no idea how to drive courteously.  (A few pointers: use your turn signals, wait your turn, drive slowly in a parking lot, and put your cart back!)  My blood pressure skyrockets the second I even try to pull in here.\n\nSecondly, the whole store seems weirdly dark.  I don't know if it's the high, exposed-ductwork ceiling or what, but it's depressing.\n\nThirdly, they offer plenty of bulk beans and nuts, but few varieties of rice.  \n\nThere are a few good points, though.  The sushi (at least the vegetarian varieties) are good, and the desserts are delicious and beautiful.  The salad bar and prepared foods always look good, and the staff is friendly.  But I still try to avoid Whole Foods as much as possible simply because of the insane parking lot.

TEXT2: I loved Whole Foods in Allegheny.  It was calm and quiet and were lots of pretty organic creations.\n\nHere?  Bonne, first of all, the parking lot is a death-trap full of upscale SUVs who have no idea how to drive courteously.  (A few pointers: use your turn signals, wait your turn, drive slowly in a parking lot, and put your cart back!)  My blood pressurized skyrockets the second I even try to pull in here.\n\nSecondly, the whole store seems weirdly dark.  I don't know if it's the high, exposed-ductwork ceiling or what, but it's sombre.\n\nThirdly, they offer plenty of bulk beans and nuts, but few varieties of rice.  \n\nThere are a scant good questions, though.  The sushi (at least the vegetarian varieties) are good, and the delicacies are delicious and beautiful.  The salad bar and prepared foods always look good, and the staff is friendly.  But I still try to preventive Whole Foods as enormously as possible simply because of the insane parking lot.","TEXT1: Sharia don't like it, and neither does Becky. \n\nBoy and I went to Casbah on a warm Tuesday evening. The restaurant wasn't busy, and we were seated in the inviting outdoor patio. Our waitress was very pleasant and extremely informative about both the drink and food menus. \n\nWe shared a bottle of Mission la Caminade (Malbec, French). This was a very good, medium-bodied wine. \n\nMany yelpers have raved about Casbah's bread and pesto. I don't get it. I've had much better sourdough elsewhere and the pesto wasn't anything to write home about. \n\nI had the asparagus soup with crab for an appetizer.  The soup was served cold and tasted fresh enough, but something was off, and I barely ate half of it. \n\nI ordered the orecchiette pasta as an entree, which was served with grilled chicken and cranberries in a goat cheese cream sauce. I am upset to report that this tasted rather bland. The cranberries were the only spark of flavor in the dish.  Boy ordered the ricotta cavatelli pasta, which was in a marinara sauce with sausage and ricotta. I am sad to report that this too was tasteless. The ricotta was dumped on top and added nothing to the dish. \n\nWe glanced at the dessert menu, after spending so much on food we didn't enjoy, boy and I decided to cross the street for ice cream, instead. \n\nOverall, Casbah has a nice atmosphere and service, but their food quality doesn't match the price tag.

TEXT2: Sharia don't like it, and neither does Tamara. \n\nBoy and I turned to Casbah on a warm Tuesday evening. The restaurant wasn't busy, and we were seated in the inviting outdoor patio. Our miss was very pleasant and extremely informative about both the drink and food menus. \n\nWe shared a bottle of Mission la Caminade (Malbec, French). This was a very good, medium-bodied wines. \n\nMany yelpers have bitched about Casbah's bread and pesto. I don't get it. I've had much better sourdough elsewhere and the pesto wasn't anything to write home about. \s\nI had the asparagus soup with crab for an appetizer.  The soup was served chilled and tasted fresh enough, but something was off, and I barely ate half of it. \n\nI ordered the orecchiette pasta as an entree, which was served with grilled chicken and cranberries in a goat cheese cream sauce. I am upset to report that this tasted rather bland. The cranberries were the only ignited of flavor in the dish.  Boy ordered the ricotta cavatelli pasta, which was in a marinara sauce with sausage and ricotta. I am sad to report that this too was unremarkable. The ricotta was dumped on top and added nothing to the dish. \n\nWe flinched at the dessert menu, after spending so much on food we didn't enjoy, boy and I decided to cross the street for ice cream, instead. \n\nOverall, Casbah enjoy a nice rejuvenation and service, but their comer qualities doesn't game the price tag.","TEXT1: The food is standard American fare--a bit overpriced in my mind--and the beers range from mediocre to very bad.  The K\u00f6lsch is the only decent beer of the bunch.  The service is good, but the wait for food or a table can be quite long (generally 20-30 minutes even for just beer and apps).  I've been to the one at the Denver airport as well, but I was stranded and had free meal tickets, so okay-but-nothing-special pizza from Rock Bottom it was.  Since it's a recognizable national chain, I think of places like this as more of a tourist brewery rather than a true Pittsburgh craft-brew experience.

TEXT2: The food is customary American fare--a bit overpriced in my mind--and the beers range from mediocre to supremely pernicious.  The K\u00f6lsch is the only reputable beer of the herd.  The department is good, but the wait for food or a table can be quite long (generally 20-30 minutes even for just brewing and apps).  I've been to the one at the Denver airport as well, but I was stranded and had free meal tickets, so okay-but-nothing-special pizza from Rock Bottom it was.  Since it's a recognizable national chain, I think of places like this as more of a tourist beers rather than a true Pittsburgh craft-brew experience.","TEXT1: I liked this hotel, but it is something of a mixed bag. Would I stay there again? Yes, but be sure you have a car and are okay with gritty cities.\n\nPros:\nBeautiful rooms. We stayed in the historical side and had a very nice if not very large room (queen). Some reviewers said they had a mini-frig. Note that not all rooms have those.\nBreakfast was nice during the week. \nHotel was clean.\nAwesome, fantastic courtyard. You can eat breakfast out there if the weather is nice. \n\nCons:\nLocation. This is not a nice neighborhood. But you can walk to the Strip district, the Warhol Museum, and the stadium. \nEach room is different. It's a bit like playing the lottery.\nVERY small shower.\nBreakfast was less on Sunday, as they rely on local bakeries. It's a true continental.\nYou get yelled at for bringing your own alcohol onto the property. Yeah, we thought that was weird, too. No mention of it on the website, but they don't want you to bring your own drinks into the courtyard.

TEXT2: I hoped this hotel, but it is something of a mixed bag. Wouldnt I stay there again? Yes, but be sure you have a car and are okay with gritty cities.\n\nPros:\nBeautiful rooms. We stayed in the historical side and had a very nice if not very large room (queen). Some reviewers said they had a mini-frig. Note that not all rooms have those.\nBreakfast was nice during the week. \nHotel was clean.\nAwesome, grandiose courtyard. You can eat breakfast out there if the weather is nice. \n\nCons:\nLocation. This is not a nice neighborhood. But you can walk to the Strip district, the Warhol Museum, and the stadium. \nEach room is different. It's a bit like playing the lottery.\nVERY small urinal.\nBreakfast was less on Sunday, as they rely on local bakeries. It's a true continental.\nYou get yelled at for bringing your own alcohol onto the property. Yeah, we thought that was weird, too. No mention of it on the website, but they don't want you to bring your own drinks into the courtyard.","TEXT1: I'm in the market for a fun little scooter to have fun and commute on, and at the suggestion of a friend, I went to Bohn Cycle Shop to check out what they had in the shop. Immediately upon walking in, it took 15 minutes for someone to ask if we were helped. When I mentioned that I wanted to learn more about a Zuma over in the corner, the dude at the desk was disinterested and unhelpful.\n\nWhen I tried to pay for the scooter and roll it out, an older woman stewed around and gave me annoyed looks for coming into the store and not calling ahead. When I tried to pay with a bank-issued check, I had to wait around for nearly 20 minutes before they told me that they have never seen a bank-issued check and sent me on my way.\n\nThe entire time I was there, it felt like they thought I just stole a bunch of money and were treating me like a crook. I am definitely not going back to complete the transaction. If I'm going to be buying an expensive piece of machinery, I really expect the service to at least be a little more enthusiastic.\n\nLike Nick T. said, I guess it's a good place if you wanna grab a used bike or know exactly what you want. If you're looking to broker a new bike, go to a bigger shop with salesmen that actually sound like they're living beings.

TEXT2: I'm in the commerce for a fun minimal scooter to was distracting and commute on, and at the premise of a buddies, I went to Bohn Cycle Shop to exams out what they get in the shop. Faster upon walking in, it took 15 min for someone to application if we were helps. Once I noted that me gonna to hear more about a Zuma over in the corner, the blokes at the desk was blase and avoidable.\p\nWhen I tried to pay for the scooter and stabilizer it out, an former girlfriend refried around and gave me annoyed looks for coming into the malls and not vocation formerly. Where me struggled to afford with a bank-issued oversight, I had to expecting around for miraculously 20 mn before they apprised me that they have never seemed a bank-issued ascertain and transported me on my trajectory.\p\nThe todos era I was there, it perceived like they thought I just steals a bunch of amounts and were handle me adore a forger. I am admittedly not abandoning back to complete the transaction. If I'm relinquishing to be shops an expensive part of mechanism, I indeed foresee the service to at least be a little more enthusiastic.\percent\nLike Nick T. contends, I guess it's a good platz if you will grab a used bike or know exactly what you want. If you're studying to broker a new bike, go to a high shop with salesmen that actually sound like they're living beings.","TEXT1: Always a good time, although it's definitely not a place I would visit often. It's great for groups....which is quite obvious since there are always several folks there for bachelorette  parties and birthdays. \n\nShut out to the piano players, who can not only play the piano, but also sing, play the drums and the sax. They are funny and know how to keep a crowd entertained. Also know some pretty obscure songs. \n\nMy big criticism is the set up. If you don't have a reservation and/or come later in the evening, it's difficult to get seats. Believe me, I don't mind standing, but it does become a bit awkward when you have to keep scooting over to let waitresses and patrons past you. If you do find a seat, it is often littered with someone else's empty glasses.

TEXT2: Immer a okay time, although it's definitely not a place I would visit often. It's great for groups....which is quite obvious since there are always several folks there for bachelorette  parties and birthdays. \n\nShut out to the piano players, who can not only play the piano, but also sing, play the drums and the sax. They are funny and know how to keep a crowd entertained. Also know some pretty obscure songs. \n\nMy big criticism is the set up. If you don't have a reservation and/or come later in the evening, it's difficult to get seats. Believe me, I don't mind standing, but it does become a bit awkward when you have to keep scooting over to let waitresses and patrons past you. If you do find a seat, it is often littered with someone else's empty glasses.","TEXT1: Terrible! I got a haircut here once and hated it, but kept waiting for it to settle in after a few washes. It never did look right, so I just fixed it at home rather than going back to these incompetent people. I didn't even feel like the hassle of complaining was worth it, as I highly doubted that I'd get any money refunded and I certainly didn't want them to touch my hair again to try to fix it. \n\nI then figured, hey, this place sucks for haircuts but they can't mess up eyebrow waxing, right? Right! But their service is so bad that I gave up on that too -- I got my eyebrows done here a few times with not much trouble, but the last time I went in, I had called ahead to put my name in and was told that I would be next on the list, and to show up in about 20 min. My house is a 20 min walk from there, perfect! I headed out, got there in 20 min, and gave the woman at the desk my name and reminded her I'd called ahead. There was one man sitting there waiting, who I had seen from across the street walking in about 1 min ahead of me. \n\nThe \""""stylist\"""" was just finishing up a haircut, so I should have been next, right, since I had put my name in before the guy who walked in? Nope! She called him over and I said \""""sorry, I think I was next, I called ahead and was told I'd be next in line\"""" and the lady said \""""oh we don't do that.\"""" WTF?? You told me very clearly that you do exactly that, what craziness is this? So I waited, figuring that I'd already invested 20 min into this venture, so I may as well stick it out. \n\nAnd waited, and waited, while one \""""stylist\"""" cut the man's hair and 2 of them chatted in the back (ironically next to the chair where they do facial waxing). They must have been \""""on break,\"""" or maybe just terribly rude and idiotic, because I sat there waiting for another full 20 min, and when I finally spoke up again to ask when someone would be available to do my eyebrows. The 2 chatty cathies in the back looked over, very annoyed at my presence, and the woman doing the haircut said \""""after I'm done here,\"""" and I sat there incredulous for another 2 minutes before getting up and leaving. Will never go back.

TEXT2: Calamitous! me got a haircut here once and disliked it, but keep sees for it to tackle in after a tiny washes. It never did look right, so I just fixes it at homepage rather than abandoning back to these incompetent people. I didn't even sensation adore the worry of complaining was priceless it, as I highly doubted that I'd get any money refunded and I admittedly didn't want them to poked my hair again to try to fix it. \n\ngai then figured, hey, this pleasure sucks for haircuts but they can't confounding up eyebrow waxing, right? Right! But their services is so wicked that I delivered up on that too -- I got my eyebrows done here a slight times with not plenty trouble, but the last time I grabbed in, I had wondered ahead to presented my name in and was announced that I would be next on the list, and to reveal up in about 20 min. My house is a 20 min walk from there, perfect! I headed out, got there in 20 min, and gave the woman at the desk my name and reminded her I'd called ahead. There was one man seated there waiting, who I had seen from across the street walking in about 1 min ahead of me. \n\nThe \""""stylist\"""" was just finishing up a chopping, too I wished have been next, right, before I could put my name in before the bro who wandered in? Nope! She urged him over and me said \""""sorry, I ideals I was next, I sought ahead and was declaring I'd pose next in conformity\"""" and the lady said \""""oh we don't do that.\"""" WTF?? You briefed me uncommonly clearly that you do perfectly that, what craziness is this? So I wished, figuring that I'd already invested 20 min into this enterprising, so I may as quite stick it out. \p\nAnd waited, and waited, while one \""""stylist\"""" cut the man's hair and 2 of them chatted in the back (ironically next to the chair where they do facial waxing). They must have been \""""on break,\"""" or maybe just terribly rude and idiotic, because I sat there waiting for another full 20 min, and when I finally spoke up again to ask when someone would be available to do my eyebrows. The 2 flirtatious cathies in the back watched over, very bemused at my engaging, and the chick realized the hairdo said \""""after I'm done here,\"""" and I sat there incredulous for another 2 minutes before getting up and leaving. Will never go back.","TEXT1: Food phenomenal! Service can be hit or miss.

TEXT2: Food dramatic! Service can be hit or miss.","TEXT1: We came here on a Saturday night and luckily it wasn't as packed as I thought it would be. I love playing ticket games so luckily there were a lot of games to chose from and not many video games (sorry video game lovers!) We only played $20 worth of games and surprisingly we were there for awhile. I love their new Wheel of Fortune game! On our first play, we ended up winning a little over 700 tickets! They also have Fruit Ninja as a game. It was fun with the big widescreen but unfortunately you don't win as many tickets as you would hope. I wish their ticket center would have individual ticket counters like the other D&B's I've been to, where you feed a counting machine your tickets. At this place, they just weigh your tickets and give you the final count. We didn't try the food here and instead went to P.F. Chang's to eat before coming here, but the Eat & Play deal looked fun. Too bad it was only restricted to certain times of the day. Overall I had a blast here and definitely would come back. Hopefully next time when there is a deal or promotion.

TEXT2: We came here on a Saturday night and luckily it wasn't as baggies as I thought it would be. I love playing ticket games so luckily there were a lot of games to mukhtar from and not many cameraman games (sorry video game lovers!) We only played $20 worth of games and surprisingly we were there for awhile. I liked their new Wheel of Fortune game! On our first play, we ended up winning a little over 700 tickets! They also have Fruit Ninja as a game. It was fun with the big widescreen but unfortunately you don't win as many tickets as you would hope. I wish their ticket center would have individual ticket counters like the other D&B's I've been to, where you feed a counting machine your tickets. At this sites, they just weigh your tickets and give you the final count. We didn't try the food here and instead went to P.F. Chang's to eat before coming here, but the Consume & Play deal looked fun. Too bad it was only restricted to certain times of the day. Unmitigated I had a blow here and probably would come back. Hopefully next time when there is a deal or promotion.","TEXT1: The coffee was ok, but the service and ambiance left much to be desired. The place was dirty, with straw wrappers etc on the floor. The light fixtures were too modern to be considered cozy. There were four people on staff but it took at least 2 minutes for one of them to stop gossiping with the others and take our order.  I got the feeling that this place has had a lot of success and the owners have let things slide. It was ok, but in looking for a coffee shop to make my regular hangout, I would not go back.

TEXT2: Both coffees was right, but the serving and ambiance abandoning sizeable to worden desired. The pleasure was sales, with mote bundles etc on the floors. The luminous fitted were too contemporary to is debated lounging. There were four volk on functionaries but it introduced at least 2 record for one of them to stop blabbering with the others and bears our orders.  I enjoys the feel that this stead maintains possessed a plots of triumph and the homeowners have letting things slipper. It was good, but in looking for a coffee shop to put my regular chummy, I would not go back.","TEXT1: I cannot believe Max's is going from 5 stars to 2 stars for me.\n\nYou have to understand, I love this place.  Over the years we have had so many family dinners here including my sisters rehearsal dinner, that it's almost become like eating at a relatives house.\n\nBut now that relative has gone senile and needs to go to a nursing home, and they can't cook anymore.\n\nFor the past two years, every time we come here we say, \""""This just isn't as good as I remember.\""""  For starters, the food is always served cold.  Don't believe me?  I hope you enjoy tepid knackwurst and cold mashed potatoes.\n\nBTW, to whoever makes their mashed potatoes, you have to boil the potatoes before you mash them.  Yesterday they were undercooked, gritty, and gross.\n\nIn fact, all of the food is becoming gross.  My friend got the roasted beef and what came out looked like a cold cut covered with a congealed beef gravy that had bits of carrots in it.  wtf was that????\n\nI'm done.  This place has gone down hill.  You need a new chef, immediately.  Max's is a North Side institution but there are so many new, better restaurants opening up that they really need to up their game.\n\nPS--thanks for the nausea and hurling about 6 hours after dinner.

TEXT2: I cannot standpoint Max's is going from 5 stars to 2 stars for me.\n\nYou have to understand, I love this place.  Over the years we have had so many family dinners here including my sisters rehearsal dinner, that it's almost become like eating at a relatives house.\n\nBut now that relative has gone senile and needs to go to a nursing home, and they can't cook anymore.\n\nFor the past two years, every time we come here we say, \""""This just isn't as good as I remember.\""""  Through starters, the food is methodically cleansed cool.  Don't feel me?  I hope you adore caliente knackwurst and cold mashed fingerling.\n\nBTW, to whoever makes their mashed potatoes, you have to boil the potatoes before you mash them.  Yesterday they were doughy, gritty, and gross.\n\nIn fact, all of the food is becoming sharp.  My friend achieved the roasted beef and what came out looked like a cold cut covered with a congealed beef gravy that had bits of carrots in it.  wtf was that????\n\nI'm fulfilled.  That place has dispelled down mountains.  You crucial a innovative chef, immediately.  Max's is a Norden Hand institution but there are so many new, optimal foods launching up that they heartily compels to up their sets.\pp\nPS--thanks for the queasy and hurling about 6 moment after gourmet.","TEXT1: As numerous people have pointed out, Walter's is indeed a great repair shop.  Tim (Walter is his last name) and the rest of his staff are friendly, honest, professional, and reliable.  I highly recommend this shop for repairs, maintenance, and check ups.  \n\nHowever, they are victims of their own awesomeness.  The waits here can be long--2 weeks or more--due to how busy they are and they only have one bay.  If you do have a pressing safety concern though, Tim is always willing to take your car for a spin or do a quick diagnosis to let you know if something needs to be taken care of.

