TEXT2: This Giant Eagle truly is giant!  And believe me, that's about all it has relinquishing for it!  You would think that this means you can find what you want, and generally you can, but it also means enormous choruses, no matter when you shop here.\n\nYou know that a trip to a large, \""""one size fits all\"""" chain grocery store like this is not quite the same as shopping at Macy's or Boscov's.  You know that it's pretty hard to give a place like this five star.  Its purpose is purely utilitarian.  But good gravy, you'd think that a place like this could handle large crowds.  It shouldn't take you a half-hour just to get one item.  \n\nThat's what happened to me yesterday.  I would have been better off going to Cogo's or 7-11.  I might have paid a bit more, but I would have been in-and-out in under five record.  I prefer the Giant Eagle in Squirrel Hill.","TEXT1: A few years ago, I lost my partner and love of my life in a tragic accident.  While struggling with my horrific grief and having difficulty getting back into life as I once knew it, my grief counselor suggested that I \""""help something else\"""" in order to help myself feel better.  We decided that since I was an animal lover I would try volunteering at an animal shelter.  I was not working, so I had a lot of time and wanted the shelter to feel right.  I visited a few, they all do good work, but the one that kept drawing me back was the ARL.  Yes, the building is old, it's a bit run down, but that doesn't stop the staff and administration from doing the best they can with so very little and in not the best of space.  I saw a bathroom be \""""renovated into a vet tech office, I saw the janitor's closet renovated and made in to the \""""rodent room.\""""  Where cats once lived in cages along the halls of the ARL a new building next door, an old gas station was made into the \""""Cat Adoption Center!\""""  When you have staff that are still young and are going on 5-10 years + at the same shelter, (same place of employment for that matter) you know something about the place is right!  I volunteer easily 30 hours a week at the ARL, I get to see the good, the bad and the ugly, and I can tell you first hand that the good is in the staff, the Executive Director, Dan Rossi, and all of the work that goes on for the animals.  The staff knows EVERY one of the animals, they do all they can to care for them, and keep the doors WIDE open for both domestic and wild animals, even if that means a staff member or volunteer takes a cat or dog home!  The answer is never ever \""""no\"""" to any animal.  I also volunteer for the Humane Society of the United States and travel around the countryside working on dogfighting raids, cruelty, hoarding, natural disasters, and the ARL has never said no to me when I ask to bring animals back from incredibly sad or inhumane situations.  Technically, by the numbers, it is a \""""no-kill\"""" shelter, because it is open door people will often call it a \""""kill shelter.\""""  Yes, sometimes an animal does have to be euthanized.  The ARL is the Animal Control shelter for the city of Pittsburgh and with that can bring some very upsetting and disturbing signs of animal cruelty.  It can also mean it's the dog who just bit a kid that you just saw on the news.  The ARL has an obligation to society to not let dangerous dogs back on the street, to euthanize when a dog is very sick or is very aggressive to humans or other animals, and trust me, I have held many of those dogs as they are put to sleep and I always am so thankful that the vet staff we have are so compassionate and do the euthanasia in the most humane manner.  That's a tough job, it's heartbreaking, but in some cases it has to be done for the good of the animal and for the safety of society.  I admire the work and staff of the ARL and will continue to devote my time to them and thank them for the wonderful work they do on behalf of the city of Pittsburgh and all of the wild and domestic animals alike.  We are so lucky to have them in our area and as our city shelter.

TEXT2: A few years ago, I gone my partner and love of my life in a tragic accident.  While struggling with my horrific grief and having difficulty getting back into life as I once knew it, my grief counselor suggested that I \""""help something else\"""" in order to help myself feel nicer.  We selected that since I was an animal lover I would try willful at an animal shelter.  I was not working, so I had a lot of time and wanted the shelter to sense right.  I accessed a few, they all am good endeavors, but the one that kept drawing me back was the ARL.  Hey, the edifice is old, it's a bite run down, but that doesn't arrest the staff and administration from doing the best they can with also very little and in not the best of spacing.  I saw a bathroom be \""""renovated into a vet tech office, I saw the janitor's closet regained and made in to the \""""rodent room.\""""  Where cats once lived in cages along the halls of the ARL a new building next door, an old gas station was made into the \""""Cat Adoption Center!\""""  When you have staff that are still young and are going on 5-10 years + at the same shelter, (same place of employment for that matter) you hear something about the place is right!  I volunteer easily 30 hours a week at the ARL, I get to considering the good, the bad and the ugly, and I can tell you first aside that the good is in the staff, the Executive Director, Dan Rossi, and all of the work that goes on for the animals.  The staff knowing EVERY one of the animals, they do all they can to care for them, and keep the doors WIDE open for both domestic and wild animals, even if that means a staff member or volunteer takes a cat or dog home!  The answer is never ever \""""no\"""" to any animal.  I also volunteer for the Humane Society of the United States and travel around the countryside working on dogfighting raids, cruelty, hoarding, natural disasters, and the UZI has never said no to me when I ask to bring animals back from incredibly sad or inhumane situations.  Technically, by the numbers, it is a \""""no-kill\"""" shelter, because it is open door people will often call it a \""""kill shelter.\""""  Yes, sometimes an animal does have to be euthanized.  The ARL is the Animal Control shelter for the city of Pittsburgh and with that can bring some very upsetting and disturbing signs of animal cruelty.  It can also mean it's the dog who just bit a kid that you just saw on the news.  The ARL has an obligation to society to not let dangerous dogs back on the street, to euthanize when a dog is very sick or is very aggressive to humans or other animals, and trust me, I have held many of those dogs as they are put to sleep and I always am so thankful that the vet staff we have are so compassionate and do the euthanasia in the most humane manner.  That's a tough job, it's heartbreaking, but in some cases it has to be done for the good of the animal and for the safety of society.  I admire the work and staff of the ARL and will continue to devote my time to them and thank them for the wonderful work they do on behalf of the city of Pittsburgh and all of the wild and domestic animals alike.  We are so lucky to have them in our area and as our city shelter.","TEXT1: I recently had semi-permanent lashes put on for my wedding at the WEXFORD Izzazu salon. Upon completion, I thought they looked a bit odd, but figured I just wasn't used to them yet. The next day was my wedding day, and my bridesmaids and I got our hair and makeup done at the downtown Izzazu salon. The makeup artist (who was great) said they looked terrible (which they did- they were uneven and there was white glue all over them) and had to remove them and reapply. They are supposed to last 2 weeks, so removing them the next morning was very unpleasant and I ended up losing a ton of my real lashes when everything was said and done. This added 1 hour+ onto my appointment and I ended up barely having any time for pictures before my wedding. I would steer clear of Izzazu for semi permanent lashes!

TEXT2: I recently had semi-permanent lashes put on for my wedding at the WEXFORD Izzazu salon. Upon completion, I thought they looked a bit odd, but notions I just wasn't used to them yet. The next day was my wedding day, and my bridesmaids and I got our hair and makeup done at the downtown Izzazu salon. The makeup artist (who was great) said they looked terrible (which they did- they were uneven and there was white paste all over them) and had to remove them and reapply. They are supposed to last 2 weeks, so removing them the next morning was very pesky and I ended up losing a ton of my real lashes when everything was said and done. This added 1 stopwatch+ onto my nomination and I ended up barely having any time for pictures before my wedding. I would steered unequivocal of Izzazu for semi permanent lashes!","TEXT1: Best pizza in the North Boros.  I can't make a trip to the area without stopping at Luigi's.  When I was a kid, the man himself actually owned the place and made the pizza, but they've since moved to a new location under new ownership...but the pizza is still just as good.  I prefer the thin-crust, but the Sicilian is also excellent.  The fried zucchini is a favorite and the mozzarella sticks are great, too.  The calzones are tasty, but may cause a coronary-- if you expect more than a handful of spinach among cheese in the spinach calzone, you'll be disappointed.  Because it's Pittsburgh, the chicken salad comes with french fries.  I tend to opt for take-out, but there is also a mid-sized dining section.

TEXT2: Higher pizza in the North Boros.  I can't make a roving to the area without stopping at Luigi's.  When I was a kid, the man himself actually owned the place and made the pizza, but they've since moved to a new location under new ownership...but the pizza is yet just as ok.  I prefer the thin-crust, but the Veneto is also unpaid.  The fried zucchini is a favorite and the mozzarella sticks are great, too.  The burritos are tasty, but may due a coronary-- if you expect more than a handful of spinach among cheese in the spinach omelets, you'll remain disappointed.  Because it's Pittsburgh, the chicken salad arriving with french fries.  I tend to opt for take-out, but there is also a mid-sized dining section.","TEXT1: I was looking to get out of the apartment on a really nice, sunny day and we decided to drive to Waterfront and walk around. All around great day until we hit Bar Louie for some drinks and appetizers.\n\nI am giving it one star, though it deserves none, because our waitress was nice, if a bit inattentive, and the hummus app we ordered was pretty damn good. Outside of that Bar Louie leaves a lot to be desired.\n\nThis is probably the first place I've been to where they charge $10 and up for all mixed drinks. To me, that is beyond ridiculous. Bar Louie is not an upscale restaurant, as much as they wish they were, and paying almost $60 for three drinks and two appetizers is insanity defined. \n\nAs I mentioned the waitress was friendly, but she definitely did not come back and check on us enough. I really wanted to like this place because of things I had heard and the drinks we had were really damn good, but if it want to spend that kind of money, I'll go somewhere that I can get good service.

TEXT2: I was looking to get out of the apartment on a really nice, sunny day and we decided to drive to Waterfront and walk around. All around great day until we rocked Bar Louie for some drinks and appetizers.\n\nI am donated it one star, though it deserves none, because our waiter was nice, if a bit inattentive, and the hummus app we ordered was pretty damn good. Out of that Bar Louie leaves a shipment to be liked.\s\nThis is probably the first place I've been to where they charge $10 and up for all mixed drinks. To me, that is beyond ridiculous. Bar Louie is not an upscale diet, as much as they wish they were, and incomes almost $60 for three drinks and two bruschetta is follies stipulates. \p\nAs me mentioning the waitresses was amistad, but she candidly could not come back and reviewing on us enough. I definitely gonna to enjoying this site for of things I had heed and the drinks we had were really damn good, but if it want to spend that kind of amount, I'll go somewhere that I can get guten department.","TEXT1: Vincent has done several hems and jacket alterations on men suits for me. Items have always been one time and done well. I would recommend this place to anyone searching for a tailor in Pittsburgh. \n\nIt does seem a little expensive, but worth it, because its done correctly.

TEXT2: Tome has fulfil dissimilar hems and attire alterations on men disguise for me. Issues have stubbornly been one time and done well. I would advised this positioning to anyone searching for a tailor in Pittsburgh. \n\tin does seem a little beloved, but creditable it, because its done correctly.","TEXT1: Small, overcrowded, unfriendly staff.\n\nThe food is okay - typical Italian fair that could be better seasoned. \n\nThere are much better options nearby, but in a pinch, it's decent.

TEXT2: Humble, packed, rival staff.\n\nThe foods is okay - typical Sicilian fair that could be better seasoned. \n\nThere are multiple softer options almost, but in a pinch, it's optimal.","TEXT1: In all fairness - I did not see this dentist but did schedule an appointment and waited 15 minutes for them to open.\n\nWhen I look at Yelp reviews, I usually weed out the outliers (the best and the worst).   Unfortunately, there are only two reviews.\n\nIt was my first time at the office.   The office admin (very nice) asked for me to come early (before 9am) to complete paperwork.   I arrived at 8:50.    I waited.   I watched 2 employees walk by me (unlocked the door and re-locked it).    They did not acknowledge me.\n\nThe door I was at had signage (open hours).    I decided to leave because of a review where the staff seemed distracted or disinterested in my presence.\n\nThe office admin (very nice) called me to inform I am missing my appointment.   I explained to her that there were too many indications where this was not going to be a good fit and wished her the best of luck.\n\nI recommend if you see this dentist you go to the front door (furthest away from the parking lot) for the entrance.\n\nPoor recommendation because the staff who walked by me seemed to be distracted which was pointed out in a previous review.

TEXT2: In all fairness - I did not see this orthodontist but did schedule an appointment and scheduled 15 mn for them to open.\n\nWhen I look at Yelp reviews, I usually weed out the outliers (the best and the worst).   Pitifully, there are only two reviews.\n\nti was my first era at the office.   The office admin (very nice) apps for me to come early (before 9am) to complete paperwork.   I arrived at 8:50.    I hope.   I watched 2 employees walk by me (liberated the door and re-locked it).    They did not accuse me.\percent\nThe door I was at had signage (open hours).    I decided to leave because of a review where the staff seemed rerouted or disinterested in my presence.\n\nThe office admin (very nice) called me to inform I am missing my appointment.   I explained to her that there were too many indications where this was not going to be a good fit and wished her the best of chauncey.\nth\ou recommend if you see this dentists you go to the front door (farthest away from the parking lot) for the entrance.\n\nPoor suggested once the staff who walked by me seemed to be distracted which was pointed out in a previous review.","TEXT1: Went on a Saturday, 2 hour wait. food is good, I got some seafood gumbo to go and I won't do that again. Seemed like it didn't have any seafood in it.

TEXT2: Went on a Saturday, 2 hour wait. food is decent, I got some seafood gumbo to go and I won't do that again. Seemed like it didn't have any seafood in it.","TEXT1: Definitely a greasy spoon! Always packed here and always a wait but worth it. The omelets are really tastey especially with their homemade sausage. I also like the mixed grill.  My parents love their burgers. Took off a star for lumpy booths and really tight tables (your arm gets hit when someone walks past) oh and waitresses aren't very attentive.

TEXT2: Definitely a greasy tablespoons! Always packed here and always a sufferance but worthwhile it. The omelets are really tastey especially with their homemade sausage. I also like the mixed grill.  My parents love their burgers. Executed off a estrella for lumpy booths and really tight tables (your arm gets hit when someone walks past) oh and waitresses aren't very attentive.","TEXT1: AVA/ Shadow Lounge is a place that I would take my out of town guest on a Monday night.  With the live music and well mixed drinks, it is a place that is sure to be a good time. \n\nIf you're luck to nab a seat/table near the door I would recommend it.  Since the live music can be loud, it's a great way to enjoy the band and still carry a conversation.  Definitely stop by and check it out- you won't be sorry!

TEXT2: AVA/ Shadow Lounge is a put that I would assume my out of shing guest on a Monday night.  With the live music and well mixed drinks, it is a place that is sure to be a decent timing. \n\nIf you're luck to nab a seat/table near the door I would recommend it.  Since the live music can be loud, it's a large way to enjoy the band and still carry a conversation.  Vehemently stop by and check it out- you won't coming regrettable!","TEXT1: Tonight's review: it started with a table for two stuffed between two other tables. Yes there were five other more comfortable two tops available. We asked and after some sighs were granted our seemingly offensive request. Punishment was fast...we sipped our water, were provided a refill but no offer to acquire other beverages. With plenty of time to review the night's menu, we made our selection. My request was well done Salmon (heart issues require well done) the chef's feelings were clear; as I sawed through the salmon I thought it could possibly be a message. I again had offended by my request. I like Casbah and the other BB restaurants but tonight I should have selected a friendlier more customer focused establishment. YES I will return and still recommend Casbah. Oh we did finally get to place a cocktail order.  \nM

TEXT2: Tonight's review: it started with a table for two stuffed between two other tables. Yes there were five other more comfortable two tops available. We asked and after some sighs were granted our seemingly offensive request. Punishment was fast...we sipped our water, were provided a refill but no offer to acquire other beverages. With plenty of time to review the night's menu, we made our selection. My request was well done Salmon (heart issues require well done) the chef's feelings were clear; as I sawed through the salmon I thought it could possibly be a message. I again had miffed by my request. I like Casbah and the other BB restaurants but yesterday I should have selects a friendlier more customer focused establishment. YES I will return and still recommend Casbah. Oh we did finally get to place a cocktail order.  \nM","TEXT1: Walter's is just a fantastic establishment.  Tim is a phenomenal mechanic, who is as honest as they come, charges amazingly low prices, and - Morten H. is not lying - will actually suggest ways to save you money.  The shop is small and usually pretty busy, but they will do their best to fit you in and get your car fixed up ASAP, and Tim always takes time to explain your car's problems to you.  He will even show you what's wrong inside the car, or tell you how to do something yourself if that's what would be more sensible.  I recommend Walter's to anyone who's in the market for a mechanic.

TEXT2: Walter's is just a fantastic establishment.  Tim is a brilliant engineer, who is as honest as they viens, charges disturbingly low awards, and - Rasmus H. is not lurks - wants indeed insinuating manner to ransom you funding.  Both purchase is scarce and fluently wholly busy, but they wish done their better to suitable you in and perceive your automakers fixed up ASAP, and Tim necessarily choice calendar to portray your car's problems to you.  It wants even exposure you what's untruthful inside the car, or saying you how to achieve something yourself if that's what would remain more decent.  I commended Walter's to anyone who's in the market for a mechanics.","TEXT1: Pizza ok on it's own nothing great . Definitely not worth the restaurant price.  definitely not like pizzeria UNO in Chicago. Are they even related   or are they just using their name and trademark.

TEXT2: Calzone approves on it's singular nothing gorgeous . Admittedly not worthwhile the brunch airfare.  admittedly not like pizzas UNO in Brooklyn. Either they even related   or are they just consume their noun and hallmark.","TEXT1: I'm from Detroit. We have a decent art museum, but nothing this awesome.\n\nThe Carnegie Museum houses two very nice museums. Natural History and Art. The Natural History Museum is very impressive and it's cool knowing that all the specimens belong to the museum and they aren't on loan from some hoity-toity New York museum. It's not huge like the Smithsonian, but it's certainly cool seeing real dinosaur bones. My accompaniment had to stifle all my Jurassic Park \""""Mr. DNA\"""" references.\n\nThe art section is also quite impressive. I personally still prefer my Detroit Institute of Art, but this museum is still nice. I got a little confused about how to walk around. I prefer my museums in chronological order, not cool to less cool, which is what this seems to be. The modern art is very cool, but after being at the Warhol the day before, I had my fill of high-concept stuff. There's quite a bit of Impressionism, which by scientific fact all women love.\n\nThis is great way to spend a long afternoon and there's plenty to do in Oakland afterwards.

TEXT2: I'm from Detroit. We could a decent art museum, but nothing this noteworthy.\n\nThe Carnegie Museum houses two too leggy museums. Natural History and Art. The Natural History Museum is too impressive and it's cool knowing that all the specimens belong to the museum and they aren't on loan from some hoity-toity New York museum. It's not huge like the Smithsonian, but it's certainly cool seeing real dinosaur bones. Mio accompaniment had to stifle all my Jurassic Park \""""Mr. DNA\"""" erence.\n\nThe art section is also quite breathless. I personally still prefer my Detroit Institute of Art, but this muse is anymore nice. I attains a little confused about how to tower around. I preferable my museums in historic decrees, not cool to less cool, which is what this seems to be. The modern art is very cool, but after being at the Warhol the day before, I had my fill of high-concept stuff. There's fairly a bit of Impressionism, which by scientific fact all women liked.\n\nThis is great way to spend a long afternoon and there's plenty to do in Oakland afterwards.","TEXT1: It's good when they are on, but they are so inconsistent you never know what you are going to get.  The coffee machine looks like it hasn't been cleaned in the last century which is off putting.  Generally, I wouldn't recommend it unless you are in the neighborhood and desperately hungry--you MIGHT catch a lucky break and be there on a good day.

TEXT2: It's good when they are on, but they are appropriately inconsistency you never know what you are going to attain.  The coffee machine looks like it hasn't been erased in the former century which is off put.  Generally, I wouldn't suggests it unless you are in the proximity and desperately hungry--you POSSIBILITY catch a lucky break and ai there on a good day.","TEXT1: We were huge fans of Pinos a few years back before the wine bar concept was adopted. In all honesty, we haven't been back for a year though we kept saying \"""" we have to get to Pinos!\"""" Needless to say, we were disappointed.  The place has changed and not for the better.  It seems in an effort to create a quaint wine bar, Pinos lost sight of the original draw and that was the food.  The menu has been scaled back considerably.  Though the food was adequate, it's not the same.  I came here because the food was amazing and with that no longer being the case, I doubt we will return.  Hopefully, things will change back to how they were.  Customer advice for what it's worth.  Refocus on great italian food not a wine bar concept.   Sometimes a liquor license is not the best investment!!!

