TEXT2: We were huge fans of Pinos a few years back before the wine bar concept was adopted. In all honesty, we haven't been back for a year though we kept saying \"""" we have to get to Pinos!\"""" Trifling to say, we were bummed.  The place had changed and not for the better.  It seems in an effort to create a quaint wine bar, Pinos lost sight of the original draw and that was the food.  The menu has been accentuated back considerably.  Though the food was good, it's not the same.  I came here for the meal was amazing and with that no longer being the case, I unquestionably we will restore.  Hopefully, things will change back to how they were.  Customer advice for what it's worth.  Refocus on great italian food not a wine bar concept.   Sometimes a liquor license is not the best investment!!!","TEXT1: Our family loves this restaurant.  My children and I suffer from food allergies.   I have Celiac's Disease and their gluten free selection for a Chinese restaurant is great.  My children are a completely different ball game.  They have a rare disease called Eosinophilic Esophagitus where food attacks their body.  They are very limited on their food selctions due to not being able to consume any food with gluten, soy, eggs, dairy, nuts, tree nuts, fish, shellfish, amd corn.  This restaurant takes special care of my kids by making sure they get chicken that has not gone through the egg wash.  The servers and managers are all trained in how to be careful.  Our favorite manager is Joe and favorite server is Kevin.  Call ahead if you have any questions and they will answer your questions.

TEXT2: Our family worshiped this restaurant.  My children and I suffer from food dermatitis.   I have Celiac's Disease and their gluten free selection for a Chinese restaurant is great.  My brats are a completely different ball game.  They have a rare disease called Eosinophilic Esophagitus where food attacks their body.  They are very limited on their food selctions due to not being able to consume any food with gluten, soy, eggs, dairy, nuts, tree nuts, fish, shellfish, amd corn.  This restaurant takes special zorg of my kids by making sure they get chicken that has not gone through the egg wash.  The servers and managers are all forming in how to be careful.  Our favorite manager is Joe and favorite server is Kevin.  Call ahead if you have any questions and they will answer your questions.","TEXT1: My friends & I all purchased Groupons  for the Pittsburgh Improv on or around March 22nd, 2012. At that time, only a few big name comedians were listed on the Improv's website as Special Events. You can use the Groupon on anything that isn't a Special Event. That seemd reasonable. The day the Groupons were purchased, my friend Katrina called & reserved two tickets to Jim Jeffries for 3/30 at 10pm. They allowed her to use her Groupon & gave her a confirmation code & everything! Shortly after, they changed many of the comedians on their website, including Jim Jeffries, to Special Events. When I called I was told I could not use my Groupon. The same thing happened to many of my friends. It's a classic bait & switch. These comedians were NOT Special Events until after the Groupon came out. In addition, other restrictions, such not being able to use the Groupons on Saturdays & having to use the additional four vouchers for one show, were NOT listed under the restrictions when the Groupon was for sale. \n\nSo tonight, my friends & I had pretty much resolved ourselves to the fact that we were not going to the Improv because they wouldn't allow us to use our Groupons. But I walked over to the Will Call window with my friend Katrina so she could at least get her tickets. Big surprise - she was told they didn't have her reservation or her name in their computers! They wouldn't give her the tickets. It's an absolute joke of a deal. How is everyone going to use their Groupons by Sept. if all of the shows are Special Events now? \n\nIn addition, no one at the Improv answers the phones or responds to emails. \n\nMy friends & I (about 10 of us total) are all getting refunds through Groupon and/or our credit card companies & we are all reporting the Improv to the Better Business Bureau, etc. \n\nThe Pittsburgh Improv is extremely shady & does not care about their customers.

TEXT2: My friends & I all learned Groupons  for the Pittsburgh Comedic on or around March 22nd, 2012. At that time, only a nadir big name comedians were listed on the Improv's website as Special Cas. You can use the Groupon on anything that isn't a Special Event. That seemd judicious. The day the Groupons were purchased, my friend Katrina called & reserved two tickets to Jim Saunders for 3/30 at 10pm. They empowered her to use her Groupon & gave her a confirmation code & everything! Shortly after, they changed big of the comedians on their website, including Jim Hawes, to Special Events. Whenever I drew I was declaring I could not use my Groupon. The same thing happened to many of my friends. It's a classic attractions & switch. These comedians were NOT Special Events until after the Groupon came out. With complements, other restrictions, such not being apt to use the Groupons on Saturdays & taking to uses the additional four vouchers for one show, were NI demonstrated under the restrictions when the Groupon was for sale. \ies\nSo matinee, my friends & yo had pretty much overcome ourselves to the fact that we were not going to the Improvisation because they wouldn't allow us to use our Groupons. But I walked over to the Will Ask window with my friend Katrina so she could at least perceives her fare. Big surprise - she was enlightened they didn't have her qualms or her name in their computers! They wouldn't give her the billets. It's an utmost comical of a treat. How is everyone going to use their Groupons by Seventh. if all of the shows are Unique Manifestation now? \percent\nIn addendum, no one at the Improv riposte the mobiles or reactions to emails. \n\nMy friends & I (about 10 of us total) are all getting refunds through Groupon and/or our credit card companies & we are all reporting the Improv to the Refinements Activity Sala, etc. \n\nThe Binghamton Comedic is awfully undecided & does not zorg about their username.","TEXT1: While I have always had a great experience with my food, I feel the need to update my prior review based on my experience at brunch today.  \n\nWhen my food came out, there was a very visible hair on my plate. I was with a large group and did not want to make a scene, so I mentioned it to the server who immediately took my plate away. The manager on duty came out to apologize, which I did appreciate. However, I was a little surprised because when they brought my plate out about 5 minutes later, I could tell that it was the same exact plate. \n\nFirst off, it was not even warm, so if they made my meal on the spot you would think it would be hot, or at the very least warm. I had also substituted bacon for the sausage that normally comes with the entree, and if the chef had made a new plate on the spot, he would probably have sent it out with the sausage (or with a side of bacon again), which he did not (they had served my bacon on the side when they brought it out initially).     Everything was in the exact same place on the plate. I wasn't going to cause a scene, so I pretended to enjoy it, but did not. I was quite repulsed.\n\nin my last review I had said that Casbah was my favorite restaurant in Pittsburgh. I had mentioned that the Cassericia dish was my favorite but that they had removed it from the menu the last time I tried to order it there for dinner. I received a response from someone at the restaurant that she was not sure why I would think that because it is still offered, and I explained that the waiter told me it was removed from the menu. \n\nI'm not really sure what happened here, but I can tell you this... I don't think that Casbah is my favorite anymore. In fact not only is it not my favorite, it has taken a plunge to the bottom of my list of places to eat. \n\nFor me, if you expect to eat at a top restaurant, the service should be top of the line, and it has just been too inconsistent for my taste. No thanks Casbah!

TEXT2: While I have indefinitely had a great experience with my comer, I feel the demanding to update my prior review corroborated on my joys at brunch moment.  \nitrogen\nWhen my food came out, there was a very noteworthy hairdo on my platter. I was with a large group and did not want to make a scene, so I mentioned it to the server who immediately took my plate away. The manager on duty came out to apologize, which I gets appreciate. However, I was a little surprised because when they brought my plate out about 5 minutes later, I could tell that it was the same exact plate. \n\nFirst off, it was not even warm, so if they made my meal on the spot you would think it would be hot, or at the very least warm. I had also substituted bacon for the sausage that normally comes with the savory, and if the chef had made a new plate on the spot, he would probably have sent it out with the sausage (or with a side of bacon again), which he did not (they had served my bacon on the side when they brought it out initially).     Fullest was in the exact same place on the plate. I wasn't going to cause a scene, so I spurious to adored it, but did not. I was quite boycott.\n\nin my last review I ai said that Casbah was my favorite dinnertime in Pittsburgh. I had mentioned that the Cassericia plating was my favorite but that they had removed it from the menus the last time I struggled to order it there for dinner. I received a response from someone at the restaurant that she was not sure why I would think that because it is still suggests, and me explained that the waiter told me it was removed from the menu. \n\nI'm not really sure what happened here, but I can mentioned you this... me don't think that Casbah is my favorite anymore. In fact not only is it not my favorite, it has taken a plunge to the likes of my list of location to eat. \nth\nFor me, if you expect to eat at a top gourmet, the serves should be top of the iine, and it gets just been too inconsistent for my fruity. Any thanks Casbah!","TEXT1: Great selection of vegan, vegetarian, raw milk, prepared foods, bakery, cheeses and aged beef. Very expensive, trader Joe's and Market district come to mind as a cheaper alternative. Parking at this particular store is a nightmare.

TEXT2: Great selection of vegan, vegetarian, raw milk, prepared foods, bakery, cheeses and aged beef. Very dear, trader Joe's and Market district come to mind as a cheaper alternative. Parking at this particular store is a nightmare.","TEXT1: Ooooppss...update time.   Got the regular (steamed spinach and lasagna) from the hot bar on my way to work.   So, I'm on my dinner break sitting, chatting it up with a co worker while eating.  I see something white in the spinach just before putting it in my mouth.  WTF is that!  OMG, it looks like one of those fat ass worms we'd  pluck from the greens in my grandma's garden.  I threw the fork down and my co worker says...\"""" you're seeing stuff.\""""  Um NOT!  I sat there digging through the spinach determined to find that damn worm.  Thirty minutes later  SHAZAM...found it. Ugh, my coworker spread open the spinach leaf.  EEEkkkk, it was bigger and fatter with black spikes poking out.  FUCK!  Call the manager at Co-op and he says...\""""Bring it in for a refund, thanks for being so nice about it...We usually just see worms in the fruits.\""""  Geez, thanks for that lil tidbit.    This happened last week around the Sept 14, 2010.  Guess that means it's really organic, huh?

TEXT2: Ooooppss...update time.   Got the regular (steamed spinach and gratin) from the hot bar on my way to work.   So, I'm on my dinner break sitting, speaking it up with a co worker while eating.  I see something white in the spinach just before putting it in my mouth.  WTF is that!  OMG, it looks like one of those fat ass worms we'd  pluck from the greens in my grandma's garden.  I threw the fork down and my co worker says...\"""" you're seeing stuff.\""""  Um PAS!  I sat there digging through the spinach determined to find that damn worm.  Fortieth minutes later  SHAZAM...found it. Urgh, my coworker spread open the collard leaf.  EEEkkkk, it was bigger and fatter with black spikes poking out.  KISS!  Call the manager at Co-op and he says...\""""Delivering it in for a reimbursement, thanks for being so nice about it...Our usually just staring earthworms in the fruits.\""""  Delgado, thanks for that lil tidbit.    This arrives latest week around the Sept 14, 2010.  Guess that means it's really organic, huh?","TEXT1: The people that work here make an unfortunate incident a breeze to work through.  I woke up one morning to find a note attached to my windshield to inform me that I was the victim of a hit and run.  The damage was minimal, but after calling it into my insurance company, they directed me to come here.\n\nWithin minutes of me hanging up my phone with the insurance company my phone was ringing to indicate that Mikes was calling to set up an appointment to get my car in for an estimate.  I set up an appointment that was convenient for me and went about my day.\n\nWhen I arrived here to have my car viewed it was quite the easy task.  My wait was minimal, the staff were polite and I wasn't being jerked around.  Within five minutes of them looking at my car, I was out the door and heading back to my place.  \n\nUnfortunately, they did not do any work to my vehicle at this point because the police are still looking into the person that hit my car.  But if we get to that step, I am confident that they could not do anything wrong in my eyes.  If their body work for a vehicle is anything like their customer service, they are definitely one of the best places to go in the city.\n\nYes people, this isn't the best neighborhood in the city, but get over it.

TEXT2: The people that work here creating an unfortunate incident a nissim to operate through.  I woke up one morning to find a note attached to my windshield to inform me that I was the victim of a hit and run.  The damage was minimal, but after calling it into my insurance company, they directed me to come here.\n\nWithin minutes of me hanging up my phone with the insurance company my phone was ringing to indicate that Mikes was calling to set up an appointment to get my car in for an estimate.  I set up an appointment that was convenient for me and went about my day.\n\nWhen I arrived here to have my car viewed it was quite the easy task.  My hopes was minimal, the staff were polite and I wasn't being jerked around.  Within five minutes of them looking at my car, I was out the door and heading back to my place.  \n\nUnfortunately, they did not do any work to my vehicle at this point because the police are still looking into the person that hit my car.  But if we get to that step, I am confident that they could not do anything wrong in my eyes.  If their body work for a vehicle is anything like their customer service, they are probably one of the best places to go in the city.\n\nYes people, this isn't the best neighborhood in the city, but get over it.","TEXT1: Great little gem! The food was fantastic was very food and just the right price. The Italian food was amazing, but you can not leave without a dessert and be prepared for giant serving. I had the carrot cake yummy!! Def a place everyone should try.

TEXT2: Overwhelming lowest sapphire! The grocery was fantastic was very food and just the right prizes. The Italian food was amazing, but you can not leave without a dessert and be prepared for giant service. I had the carrot cake godlike!! Def a place everyone shouldnt try.","TEXT1: I was underwhelmed with our dining experience. We are just learning Portuguese for an upcoming trip to Brazil and were excited about the option of using some of the vocab we had learned.\n\nMenu was somewhat limited, although we didn't try any starters which many of the other reviews state are the best offerings on the menu. I ordered the seafood stew and my husband had the chicken dish. The stew had seafood: clams, mussels, shrimp, scallops, and some type of summer sausage, but not much else. The broth was oily. My husband's chicken was prepared adequately; however the rice it was paired with was extremely underdone while the veggies were over-cooked and mushy. \n\nI might go back once more with a bottle of wine for appetizers only but for the price I will dine on entrees elsewhere.

TEXT2: me was underwhelmed with our sandwiches experimenting. We are just lectured Portuguese for an subsequent trip to Brazil and were delighted about the substitutions of use some of the vocab we had gain.\n\nMenu was somewhat limitation, although we didn't experiments any starters which many of the other reviews status are the finest offerings on the path. I commanded the seafood cooked and my husband possesses the fowl dish. The stew had fishes: squids, mussels, shrimp, scallops, and some fella of summer pastrami, but not many else. The celery was oily. My husband's wuss was devising adequately; however the rice it was peers with was overly underdone while the broccoli were over-cooked and okra. \n\ou risque go back once more with a litres of winemaker for appetizers only but for the price I preparedness dinning on entres elsewhere.","TEXT1: It's yet another Michael's, and it's a very good one. Recommended always. For those who love crafting, Michael's is a godsend.

TEXT2: It's yet another Michael's, and it's a very okay one. Recommended always. For those who love crafting, Michael's is a haggling.","TEXT1: Another good meal ... this time the Housemade Meatloaf. It's a blend of turkey and sausage instead of the standard ground beef. A refreshing and delicious twist on a comfort food staple. Served over cheddar mashed and mixed veggies. The server could have behaved like she wanted to be there but everyone has a bad day once in awhile. Service was prompt just the same. Overall good experience.

TEXT2: Another adequate meals ... this time the Housemade Meatloaf. It's a blend of turkey and sausage instead of the standard ground beef. A refreshing and delicious twist on a comfort food staple. Served over cheddar mashed and mixed veggies. The server could have behaved like she wanted to be there but everyone has a bad day once in awhile. Service was prompt just the same. Overall good experience.","TEXT1: The food is usually pretty good, however the service is almost ALWAYS very VERY slow. Most of the staff are pretty friendly and sweet but there are a few sour ones in the bunch that make the experience not as nice as it could be. Although they still technically do their job, you can FEEL very negative vibes from them and see how inefficient they are with the way they do things. It's a hit and miss. Unless you know one of the servers and their schedules. The low rating is mainly for the slow service and the handful of staff members who aren't very pleasant.

TEXT2: The food is generally pretty good, however the service is almost ALWAYS uncommonly VERY slower. Most of the official are pretty friendly and sweet but there are a few sour ones in the bunch that make the experience not as nice as it could be. Except they still technically do their job, you can FEEL very baleful vibes from them and see how inefficient they are with the way they do things. It's a hit and miss. Notwithstanding you savoir one of the servers and their schedules. The weaker notations is typically for the slow serve and the handful of staff members who aren't too delicious.","TEXT1: I'm torn!  If I could give it 4.5 stars instead of 5.0 I would, but I can't quite do 5 because I've been to other Pittsburgh facilities that have better court facilities and my own home courts out West didn't get a 5, so I can't be accused of bias, haha.\n\nPITC is just that, the Pittsburgh indoor tennis club.  It is conveniently (for Shadyside and surrounding areas) located in the East Liberty area, very close to Target, PetSmart, and Pizza Sola.\n\nThere's five courts, four full courts and one singles-only court.  They play faster than average with a low bounce unless you're a heavy top-spin hitter.  They're definitely kept in good condition and for an indoor facility that seems to be older in age the lighting is quite good.\n\nI did their two hour clinic on Sunday afternoon after playing a USTA match there and I can definitely say it is a great great great value.  You get an excellent workout and the teacher during the clinic actually gives your pointers and provides remarks on your game.\n\nDefinitely looking forward to trying out more of their clinics in the future.

TEXT2: I'm torn!  If I could furnishes it 4.5 stars elsewhere of 5.0 I would, but I can't much making 5 than I've been to other Pittsburgh facilities that have better court facilities and my own home courts out Ouest didn't perceive a 5, once I can't be accused of bias, wasnt.\n\nPITC is just that, the Pennsylvania indoor tennis club.  It is suspiciously (for Shadyside and surrounding areas) located in the East Liberty area, very close to Target, PetSmart, and Pizza Sola.\n\nThere's five courts, four full courts and one singles-only court.  They play rush than average with a low bounce unless you're a heavy top-spin hitter.  They're definitely kept in good condition and for an indoor facility that seems to be older in age the lighting is quite good.\n\nI wants their two hour clinic on Sunday afternoon after playing a USTA match there and I can admittedly avowed it is a peachy sizable noteworthy value.  You get an excellent aerobics and the teacher during the ambulatory actually constitutes your pointer and provides remarks on your game.\n\nDefinitely searching impatiently to trying out more of their clinique in the future.","TEXT1: Before I finally made it over to this range I heard the same thing from most people - it's just fine to go work on your swing. I had such a low expectation I was pleasantly surprised. \n\nIt's a fairly big range - if you are familiar with Scally's in Moon, it seems like it has almost as many tees, though its not nearly as nice a facility. \n\nThe guys in the pro shop were two of the friendlier guys I've come across at ranges or at courses. Yards were indeed marked and there are some targets to aim for, and even some hazards to aim away from. \n\nA big red flag to me was the extra charge ($3) to hit off the grass. I am no range expert, but this is the 4th one I've been to and the first I've seen of that sort of nickel and diming....\n\nPrice for the golf balls was reasonable and I do plan to be back every week until they close up in October for the season. Hopefully, since its for sale, it will reopen as a golf facility again.

TEXT2: Before I finally made it over to this range I heard the same thing from most people - it's just fine to go work on your swing. I had such a low expectation I was neatly unnerved. \n\nIt's a fairly big range - if you are familiar with Scally's in Moon, it seems like it has almost as many tees, though its not nearly as nice a facility. \n\nThe guys in the pro shop were two of the friendlier guys I've come across at ranges or at courses. Yards were indeed marked and there are some targets to aim for, and even some hazards to aim away from. \n\nA big red flag to me was the extra charge ($3) to hit off the grass. I am no range expert, but this is the 4th one I've been to and the first I've seen of that sort of nickel and diming....\n\nPrice for the golf balls was reasonable and I do plan to be back every week until they close up in October for the season. Hopefully, since its for sale, it will reopen as a golf facility again.","TEXT1: Tasty horchata - dessert before the meal of veggie Cuban with smoked tempeh ... Yum!\nCool funky space with low key music & friendly waitresses with plenty of tats

TEXT2: Fleshy horchata - dessert before the meal of veggie Cuban with smoked tempeh ... Appetizing!\nCool peachy space with low key music & sympathetic waitresses with plenty of tats","TEXT1: We love this Big Burrito establishment as it matures and becomes a perennial choice to enjoy, no matter the season. It starts with a well-stocked bar area, nicely lit and very comfortable. The indoor dining area is complimented by the (now-covered) outdoor seating area. \nService was mostly attentive, and very friendly throughout the evening. The wine list is varied and reasonably prices, with especially fine after dinner selections. \nWe started with two appetizers this time out, the Tuna Tartare and the Sheep's Milk Gnudi. The tuna was very clean, served with nicely grilled sourdough. The Gnudi had a great truffle butter and tarragon flavored sauce. \nI also had my all-time favorite salad, the Arugula. This masterpiece features homemade pancetta, crimini mushrooms, and goat cheese. We split the Ricotta Cavatelli Pasta, prepared thoughtfully with fennel sausage and spinach. \nDessert was a nice assortment of house prepared sorbets (mixed berry/pineapple/grapefruit). \nValet parking is complimentary; please tip your driver!

