Timestamp,"TEXT1: We love the Priory!\n\nI don't remember how we found this place, but I feel so lucky we did.  A beautiful restoration of a lovely old building, the Priory is a comfortable, tasteful, beautiful hotel in a convenient part of the city.  We found the staff to be very friendly and accommodating, plenty of help and advice for weary holiday travelers, always delivered with a smile.  We will return to the Priory.

TEXT2: We love the Rectory!\nth\nah don't remember how we found this mise, but I feel so lucky we did.  A grandiose restoration of a lovable outmoded institution, the Gatehouse is a uneasy, overdressed, beautiful hotel in a convenient proportion of the city.  We found the personnel to constitute too pleasing and harboring, adequate of help and advice for unwell shindig voyage, necessarily delivered with a smile.  We will return to the Vicarage.","TEXT1: Very good home style Italian... Very friendly staff. You should bring a bottle of red to go with your dinner... Worth it!

TEXT2: Markedly ok home style Ltalian... Very gracious staff. You should translate a bottle of red to go with your dinner... Useful it!","TEXT1: I have always had a great dinner at Mitchell's but something has changed. Went there last night about 5:30, the place was maybe half full. We were seated and when it finally occurred to us that no one had been to the table at all to ask about drinks or even bring water, I started timing.... 14 minutes later we decided to leave. Told the hostess what had happened and got a blank stare.  Sorry but not going back there again.

TEXT2: I have always am a great dinner at Mitchell's but something has changed. Faded there last soir about 5:30, the place was maybe half comprehensive. We were seated and when it finally occurred to us that no one had been to the mesas at all to ask about drinks or even bring river, I started timing.... 14 record later we decided to enable. Mentioning the signorina what had happened and got a white stare.  Sorry but not disappearing back there again.","TEXT1: Regarding quality of beverage, this is just your average Starbucks. I can't complain but am not blown away either. However, I really like the location of this shop, which is located in the center of The Waterfront's specialty retail shops. Though in the midst of a lot of retail, the surrounding area is very picturesque with pretty green grass, flowers, and a fountain. Hanging out here is very relaxing.

TEXT2: Regarding quality of beverage, this is just your average Latte. I can't complain but am not blown away either. However, I truthfully like the location of this shop, which is located in the center of The Waterfront's specialty retail shops. Though in the midst of a lot of retail, the surrounding area is very picturesque with pretty green grass, flowers, and a fountain. Hanging out here is very relaxing.","TEXT1: Horrifying.  This place should be ashamed of itself.  DO NOT STAY HERE.  Beyond dirty, just absolutely rank.

TEXT2: Horrifying.  This pleasure should be ashamed of itself.  DO SANS STAY TODAY.  Beyond decadent, just absolutely class.","TEXT1: I was so excited when my husband gave me tickets to go here to see funny man Bill Crawford, part of the DVE morning show for those of you who never heard of him.  That is funny because as I was telling people about going it became clear there are A LOT of people that haven't... Oh Well... Let me mention this was my first time there.\n\nSo I was warned in advance of the possible long waits outside and the two item minimum.  Well to my pleasant surprise there was no wait, walked right in, greeted, an usher showed us to our seats and we waited less than 5 minutes to be asked for our order.  This was nice.  I will say that the show started at 8pm, and we were there by 7:20 or so.  There were already people seated so we were by no means very early, and heck there were people with full course meals and tables of 10.  The price of the mixed drinks were not disclosed on the menu, leading me to believe that it may leave me short for the mortgage next month, but they did have a 60 minute dogfish head IPA for $6.00.  Now that may seem rather expensive and it is, but doable so I indeed did it... My husband got a domestic and it was between 4-5 bucks.  We opted not to eat there, as we were going to Rock Bottom after wards and I will get to that review later...\n\nSo the show was good.  There were moments that I think the comedians may have went off track and were just bantering, but luckily enough they rebound and got back to making everyone laugh instead of being uncomfortable.  There were a total of 4 comedians, the MC, and two opening acts for Crawford.  I actually really enjoyed them.  \n\nThe one or two things I didn't like about the place.  The bathrooms are in the lobby.  As this seems normal there is no separate area to enter back into the room without having to make your way through people who are waiting to be seated... This was/is stupid.  I was actually nervous that they were going to stop me and ask for my ticket which they safely secured at my first entrance.  The same also goes for smoking.  Since we were so early I took a break and it was again awkward reentering.  Maybe they need to have some type of system to get around this.  A stamped hand?  A ticket stub?  Not sure but I know I would have felt better unlike feeling like I was sneaking into the place.  \n\nI would definitely return to the Improv.  I just hope I always have a rather positive experience!

TEXT2: I was so excited when my husband gave me tickets to go here to see funny man Bill Crawford, part of the DVE morning show for those of you who never heard of him.  That is funny because as I was telling people about going it became clear there are A LOT of people that haven't... Oh Well... Let me mention this was my first time there.\n\nSo I was warned in advance of the possible long pending outside and the two item minimum.  Well to my pleasant wonder there was no wait, walked right in, rejoice, an usher showed us to our seats and we waited slightest than 5 minutes to be asked for our order.  This was fine.  me will say that the show started at 8pm, and we were there by 7:20 or so.  There were already people seated so we were by no means very promptly, and heck there were people with full course meals and tables of 10.  The price of the mixed drinks were not disclosed on the menu, leading me to believe that it may leave me short for the mortgage next month, but they did have a 60 minute dogfish head IPA for $6.00.  Now that may seem rather expensive and it is, but doable so I indeed did it... My husband got a domestic and it was between 4-5 bucks.  We opted not to consume there, as we were going to Rock Bottom after wards and I will get to that review later...\n\nSo the exhibit was good.  There were moments that I think the comedians may have went off track and were just bantering, but luckily enough they rebound and got back to making everyone laugh instead of being uncomfortable.  There were a total of 4 comedians, the MC, and two opening acts for Crawford.  I actually really enjoyed them.  \n\nThe one or three things I didn't like about the place.  The toilet are in the lobby.  As this seems normal there is no separate area to enter back into the room without having to make your way through people who are waiting to be seated... This was/is stupid.  I was actually nervous that they were going to stop me and ask for my ticket which they safely secured at my first entrance.  The same also goes for smoking.  After we were so early I took a break and it was again awkward reentering.  Maybe they need to have some type of system to get around this.  A stamped hand?  A ticket stub?  Not sure but I know I would have felt brighter unlike feeling like I was sneaking into the place.  \n\nI would definitely return to the Improv.  I just hope I always have a rather positive experience!","TEXT1: The order process went well and the delivery arrived in a timely manner. I saw a picture of the flowers my friend received and the arrangement  wasn't even close to what was pictured on the website...a lot more filler flowers despite ordering the premium arrangement. I picked this place specifically because of what they offered despite other cheaper places in the area. I am disappointed because I wanted the best arrangement possible for my friend who is going through a tough time. \n\nI will not order from this place again.

TEXT2: The order process carried well and the delivery arrived in a timely manner. I saw a picture of the flowers my friend received and the arrangement  wasn't even close to what was pictured on the website...a lot more filled flowers despite ordering the premium arrangement. I picked this place specifically because of what they offered despite other cheaper places in the area. I am despondent because I enjoyed the best arrangement possible for my friend who is going through a tough time. \n\nicht eagerness not order from this stead again.","TEXT1: Another Northside neighborhood favorite! Although the physical structure and ambiance leave a bit to be desired. The food and staff surely make up for it!  The staff is always super friendly, even when you stroll in late in the evening a glass or two of wine into your night. \n\nThe food is all house made and truly delicious! The Virginia spots are one of my personal favorites. Honesty anything you try you'll be sure to love.\n\nIt is BYOB but beware of the corkage fee per person.

TEXT2: Another Fulton neighborhood favorite! Except the physical institution and rejuvenation leave a scant to be hoped. The comer and staff surely give up for it!  The staff is always super friendly, even when you stroll in late in the evening a glass or two of wine into your night. \n\nThe food is all house implemented and admittedly nice! The Virginie bloodstains are one of my personal favorites. Honesty anything you attempt you'll be sure to love.\n\nIt is BYOB but beware of the corkage fee per person.","TEXT1: Among the best of the 'burgh.  Great live acts on a regular basis.

TEXT2: Among the strictest of the 'burgh.  Overwhelming live acts on a regular basis.","TEXT1: I had a gift card so I decided to use it for a to go order. The food tasted frozen and microwaved. Nothing special just around average!

TEXT2: I had a gift cards so I decided to resort it for a to go order. Both malnutrition savored chilled and microwaved. Any special just around average!","TEXT1: The menu online gives no prices, and the entrees are ridiculously overpriced for what you get - a good meal, but far too much food, and nothing extraordinary. The entrees are $50 - $60. BE WARNED - if you want atmosphere to go with your $60 entree, you'd better REQUEST DOWNSTAIRS! Otherwise you can have your anniversary dinner in a small room in front of large televisions. Who knew? And the staff will definitely not accommodate your request for a more romantic spot - even if they know it is your tenth anniversary! Wow. Should have walked out.

TEXT2: The way lnternet gives no prices, and the entrees are surprisingly overpriced for what you get - a good meal, but quite too much food, and nothing extraordinary. The entrees are $50 - $60. BE WARNED - if you want atmosphere to skip with your $60 entree, you'd better REQUEST DOWNSTAIRS! Alia you can have your anniversary dinner in a petite board in front of large televisions. Who imagined? Neither the staff will definitely not tailored your request for a more romantic spot - even if they know it is your tenth birthday! Wahoo. Would have came out.","TEXT1: I took a subaru outback here for the annual state safety and emissions inspections.  First I was charged more for this service than what was clearly posted on the service station wall.  Secondly I was failed for a lug nut that had rusted to the point that the technicians could not get it off.   I was quoted $425 for them to get it off.  I was able to accomplish this with a $6 bottle of penetrating oil and a breaker bar.  \n\nWhen I returned to have the reinspection I was charged for it (their policy posted on the service wall clearly states you get a second inspection within 30 days of initially failing free of charge).  This time they were able to get the lug nut off but supposedly could not get it back on.  This was odd as I had taken it off and put it back on numerous times to ensure it was okay to pass.  They once again quoted me $425, stating they would have to replace the wheel stud.  The new wheel stud cost me $3.50 at the local parts store and I did the job in under an hour without a single power tool.  \n\nThis shop is not following the guidelines they have clearly posted on their wall and are fabricating problems in an effort to overcharge you for simple repairs.  Avoid this shop.

TEXT2: I pick a nissan steakhouse here for the yearly nationals safest and emissions controls.  Principled I was convicted more for this service than what was ostensibly published on the servicing station fence.  B I was mistaken for a lug cashews that am oxide to the comments that the technicians could not have it off.   I was quoted $425 for them to becoming it off.  me was skillful to cater this with a $6 brew of penetrating oils and a changer striped.  \n\nWhen I capitulated to had the reinspection me was charging for it (their policies post on the serve mur apparently states you acquired a ii inspection within 30 days of temporarily weaknesses rid of charging).  This day they were skillful to arrives the lug fou off but potentially could not have it back on.  That was quirky as I had taken it off and brings it back on varied moments to ensures it was bon to col.  They once again quoted me $425, stating they would do to alternating the wheel pierce.  Both innovative wheel piercing cost me $3.50 at the localized components stored and me did the job in under an hour without a lonely energy instruments.  \n\nThis shop is not following the guide they get clearly posted on their mur and are fabricating problems in an effort to overcharge you for simple repairs.  Prevented this shop.","TEXT1: I am a jack of all trades and a do it yourself-er at heart. While in college I worked as a promotional photographer for my very dear friends salon. As a barter service she always did my hair for free! !0 years I had this deal going on. As you can imagine I was pretty spoiled and didn't want to start paying to get my hair did. I began coloring it myself. Now as a licensed skin care specialist you pick things up from the cosmetologists working with you.\n\nI killed it, fried it and melted it. My hair was in dire straights! I have dark hair but I love being a red head. Marcia Cross red to be exact. Whoops! Lightening that many levels should not ever be done by a novice. What can I say?  I'm stubborn that way, and think I can do it all! \n\nI reached out to Emilio for help! I have to say that after many hours of laying down color he managed to make my hair healthy again and I left feeling like a movie star. A red headed movie star! I was flipping my hair all the way to the parking garage and even did a photo-shoot later that evening. Yes I did a photo-shoot because I needed a professional head shot for my work portfolio.\n\n\nI don't know if I'm being too harsh but my hair did turn out much darker than I had wanted it to be. I know sometimes it is hard to predict the outcome when mixing chemistries. \n\nThe other problem I had was the price tag, or the surprise when I went to pay. $250.00 for a color correction! I know this is normal sometimes when fixing the damage but it is also crucial to give your client some kind of idea on payment. I had gone in for color estimated at around $70. I think they did a decent job but for that money It should have been closer to what I asked for. Needless to say I haven't been back but would recommend in a jam.

TEXT2: I am a jack of all trades and a do it yourself-er at heart. While in college I worked as a promotional photographer for my very dear friends salon. As a barter service she always did my hair for free! !0 years I had this deal going on. As you can imagine I was pretty spoiled and didn't want to start paying to get my hair did. I began coloring it myself. Now as a licensed skin care specialist you pick things up from the cosmetologists working with you.\n\nI killed it, fried it and melted it. My hair was in dire straights! I have dark hair but I love being a red head. Marcia Cross red to be exact. Whoops! Lightening that many levels should not ever be done by a novice. What can I say?  I'm stubborn that way, and think I can do it all! \n\nI reached out to Emilio for help! I have to say that after many hours of laying down color he managed to make my hair healthy again and I left feeling like a movie star. A red headed movie star! I was flipping my hair all the way to the parking garage and even did a photo-shoot later that evening. Yes I did a photo-shoot because I needed a professional head shot for my work portfolio.\n\n\nI don't know if I'm being too harsh but my hair did turn out much darker than I had wanted it to be. I know sometimes it is hard to predict the outcome when mixing chemistries. \n\nThe other problem I had was the price tag, or the surprise when I went to pay. $250.00 for a color correction! I know this is normal sometimes when fixing the damage but it is also crucial to give your client some kind of idea on payment. I had gone in for color estimated at around $70. I think they did a decent job but for that money It should have been closer to what I asked for. Needless to say I haven't been back but would recommend in a jams.","TEXT1: I brought my car here in 2006 for repair of a scratched bumper.  The damage was minimal, but the work required removing my entire bumper for repainting.  The staff were very helpful in explaining my options and presenting me with a few choices to get the most bang for my buck.  They completed the work in the quoted amount of time and did a great job.  A few weeks later, I noticed a spot that needed touched up and they handled it immediately and without question.  I would definitely recommend these guys if you need bodywork or paint work done.

TEXT2: I arose my carro here in 2006 for heal of a inlaid bumper.  The affect was puny, but the collaborators require abolition my aggregate bumpers for paint.  The collaborators were critically lucrative in exposing my variant and submitting me with a few alternatives to procured the most blasting for my bucks.  They terminates the endeavors in the catalogued amount of stardate and got a formidable employing.  A scant jour later, me faced a placing that oblige touche up and they addressing it immediatly and without things.  I would openly applauds these fellas if you request corps or paint employment finalized.","TEXT1: Great european style boutique hotel.  You can not beat this hotel for the money!

TEXT2: Overwhelming european style boutique hotel.  You can not subjugate this hotel for the money!","TEXT1: Average run of the mill store.  Associates are young teens and they really don't know where anything is.  Luckily I am able to get around to find everything.  Found my puppy treats and moved on.

TEXT2: Average run of the mill store.  Mates are young teens and they really don't know where anything is.  Luckily I am able to get around to finds everything.  Found my doggy treats and became on.","TEXT1: We go here all the time and have ordered almost everything on the menu and never been disappointed. It's veggie diner food at it's best (at least in my opinion). My bf is a meat & potatoes man but he absolutely loves the breakfast  Homefries with tofu instead of eggs. The waitstaff have always been exceptionally nice and very attentive. This establishment is best described as a greasy spoon for vegans and vegetarians so if you go in expecting gourmet, you may find yourself disappointed.\n\nOn cold wintery days try a Mexican Hot Chocolate - it will surely warm your heart!

TEXT2: We go here all the time and have decreed almost everything on the menu and never been illusions. It's slaw diner food at it's advisable (at least in my notification). My bf is a meat & potatoes man but he clearly loves the breakfast  Homefries with tofu instead of eggs. The waitstaff have always been exceptionally nice and very attentive. This establishment is best described as a greasy shocker for vegans and vegetarians so if you budge in expectations gourmet, you may find yourself disappointed.\n\none cold wintery days try a Mexican Hot Chocolate - it will surely warm your cardiology!","TEXT1: I've been introduced to their kale offerings and must admit, I'm a huge fan. There's a kale salad that you can ask them to put in a wrap and it's absolutely phenomenal. Almost all of their veg options are fantastic.\nThe downside of QS is their Sunday brunch. I know, I know most brunches are breakfast foods only, and this place is no exception. On a personal level, I don't really care for breakfast food for lunch and since you have no other choices, it's not my thing. \nLike I said though, this place is fantastic for veg food, so give it a try.

TEXT2: I've been introduced to their kale offerings and must admit, I'm a huge midshipman. There's a kale lettuce that you can ask them to put in a wrap and it's absolutely admirable. Barely all of their veggies options are admirable.\nThe downside of QS is their Sunday brunch. I know, I know most brunches are breakfast foods only, and this place is no immunities. On a personal level, I don't really care for breakfast food for lunch and since you have no other choices, it's not my thing. \nLike I said though, this place is glamorous for veg food, so allowing it a attempt.","TEXT1: I've been back to Quiet Storm many times. I can accept the hit or miss service since it's pretty cheap and casual. That's not really an excuse for bad service, it only somehow softens the blow, but why be mediocre? \n\nThe environment is comfortable (unless you sense the servers don't want you there). The music ranges and is appropriate for the environment. It's never too loud or aggressive. Free wi-fi helps and the milkshakes are slammin! The food is inconsistent, but often good. The Black-a-dilla is my favorite. \n\nI really want to like Quiet Storm, but it only merits 2 stars. Their food, service, and hours are inconsistent. It seems they often close early. \n\nOwners, please stick to your business hours. It's not like you're open that late to begin with! Perhaps everybody wants to go home, I don't blame them for that, and you may have run out of a few things, but try to imagine the disappointment of trekking out there to enjoy your favorite shake or snack and then being turned away.  \n\nOR, If you believe this is an acceptable business practice, it would be less infuriating if you simply changed your hours to '9am - until we feel like it.'  This way there are no set expectations and we can't really begrudge you for it. \n\n...My vote is to just stick with the hours you created.\n\nThanks!

TEXT2: I've been back to Calmness Rain immeasurable times. I can admit the hitting or miss servicing since it's pretty cheap and casual. That's not really an appologize for bad servicing, it only somehow softens the blast, but why be bland? \pp\nThe environs is comfortable (unless you sense the servers don't want you there). Both musica ranges and is appropriate for the environment. It's never too vowel or arrogant. Free wi-fi helped and the milkshakes are slammin! The food is inconsistent, but often good. The Black-a-dilla is my favorite. \s\nope perfectly going to like Quiet Storm, but it only bottom 2 stars. Their food, department, and calendars are paradoxical. It seems they often close vite. \n\nOwners, please stick to your business times. It's not like you're open that late to begin with! Perhaps everybody wants to go home, I don't blame them for that, and you may have run out of a few things, but try to imagine the disappointment of trekking out there to enjoy your favorite shake or snack and then being turned away.  \n\nOR, If you believe this is an permissible business practice, it would be less exasperating if you simply changed your hours to '9am - until we feel like it.'  This path there are no set expectations and we can't really begrudge you for it. \n\n...Mana voters is to just stick with the hours you created.\n\nThanks!","TEXT1: I am a history fan...so when a friend told me about this I made sure he took me to go see it.  The property is very beautiful...\nWe waited a few minutes and signed in....surprising it was discount day!  The waiting area itself was exquisite and already gave rich history of the property and the people who had lived there. By the time we finished looking it over, our tour guide came in.  She was perfect...very knowledgeable and sweet.  She answered any questions we had and made us feel very welcome there.  She gave us ample time to roam around each room.  \n\nThe house is amazing and moreso the car collection.  That is free...and a must-see.  Also is you like art don't miss the art collection.

