,original,perturbed,type
34,"A woman asks for advice on the road to reach a mysterious town, and hears two ghoulish stories from the local weirdo, both zombie related. But perhaps fate has something nasty in store for her too...<br /><br />The Zombie Chronicles is absolutely one of the worst films I have ever seen. In fact I must confess, so bad was it I fast forwarded through most of the garbage. And there was a lot of that, believe me. It runs for just 69 minutes, and there is still tons of filler. You get some skinhead doing a lot of push ups, plenty of dull kissy-kissy scenes between goofy teens (that rhymed, tee hee) and some fine examples of why some people should never become actors.<br /><br />As for the title characters, they barely even have a footnote in the film. Why, you get more undead action in the intro than you do the preceding feature! Though, considering how pathetic the eyes bursting out of sockets and the eating of brains sequences are (amongst other 'delights'), maybe that's a blessing in disguise.<br /><br />And to top it all off, it looks likes it's been filmed on someone's mobile phone for broadcast on Youtube. Jerky camera-work, scratches on the print, flickering lights... I had to rub my eyes when I realised it was made in 2001, and not 1971. Even the clothes and fashioned look about three decades out of date!<br /><br />If you think I'm not qualified to do a review of Chronicles having not seen the whole film, then go ahead. YOU try sitting through it, I betcha you won't even make it to the first appearance of the blue-smartie coloured freaks before making your excuses and leaving. It is truly laughable that anyone chose to release it, and honestly you'll get far more fun resting your drink on the disc than actually torturing your DVD player with this gigglesome excuse for horror. In fact, don't for surprised if it packs it's bags and leaves in the morning, leaving you doomed to watch VHS tapes for the rest of your life. You have been warned... 0/10<br /><br />P.S What kind of 18-rated horror has the woman keep a massive sports bra on during the obligatory sex scene?! See, the movie can't even get that part right...","A woman asks for advice on the road to reach a mysterious town, and hears two ghoulish stories from the local weirdo, both zombie related. But conceivably fate has something nasty in store for her too...<br /><br />The Zombie Narrates is absolutely one of the scariest drama me have ever seen. In fact me must appreciate, appropriately negative was it I fast forwarded through most of the refuse. And there was a lot of that, believe me. It runs for just 69 minutes, and there is still tons of reload. You get some skinhead doing a lot of push ups, plenty of bleak kissy-kissy scenes between goofy teens (that rhymed, tee hee) and some fine examples of why some people should never become actors.<br /><br />As for the title characters, they barely even have a footnote in the film. Why, you get more undead action in the intro than you do the preceding feature! Though, considering how despicable the eyes bursting out of sockets and the eating of brains sequences are (amongst other 'delights'), maybe that's a blessing in disguise.<br /><br />And to top it all off, it listens likes it's been filmed on someone's mobile phone for broadcast on Youtube. Jerky camera-work, scratches on the print, flickering lights... I had to rub my eyes when I realised it was made in 2001, and not 1971. Even the clothes and fashioned look about three decades out of date!<br /><br />If you think I'm not qualified to do a review of Chronicles having not seen the whole film, then go ahead. YOU try sitting through it, I betcha you won't even make it to the first appearance of the blue-smartie coloured freaks before making your excuses and leaving. It is truly laughable that anyone chose to release it, and honestly you'll get far more fun resting your drink on the disc than actually torturing your DVD player with this gigglesome forgiveness for horror. In fact, don't for surprised if it packs it's bags and leaves in the morning, leaving you doomed to watch VHS tapes for the rest of your life. You have been warned... 0/10<br /><br />P.S What kind of 18-rated horror has the woman keep a massive sports bra on during the obligatory sex scene?! See, the movie can't even get that part right...",Successful
863,"Actually, this flick, made in 1999, has pretty good production values. The actors are attractive, and reasonably talented. There aren't a bunch of clowns running around blasting away, expending hundreds of rounds, but never hitting flesh. Nor are there wild car chases/crashes where thousands of dollars worth of beautiful machines are uselessly trashed.<br /><br />The interiors look respectably modern, architecturally, and the equipment looks up to snuff. Well, there is that high tech computer room furnished with what look like leftovers from a '50s electronics lab. And the pancake make-up on the corpses cracked me up. Not pancake make-up in the conventional sense, but what looks like dried pancake batter slathered over their exposed skin. This is supposed to support the idea that the bodies have calcified -- though how the virus would accomplish this transmutation is an exercise left for the student (viewer).<br /><br />Ah yes, the virus. I would like to tell you that this is not the absolute worst premise for a sci-fi, horror flick I know of, but I can't. A computer virus that is transmitted via a television (or computer monitor) screen and becomes a lethal biological pathogen? Gimme a break. Warp drives a la ""Star Trek"" are one thing, but photons becoming viruses? This is so silly the desired ""fright factor"" just isn't realizable. The flick could have used one of those awful dream sequences where the dead come alive, or have a cat jump out of the closet, or something, because the viral thingamajig isn't doing it. <br /><br />One presumes Robert Wagner has the same excuse for playing in this inanity that Lord Oliver gave for some of his later, trashy venues. He needed the money. No other comparison between the two should be construed,however.","Actually, this flick, made in 1999, has pretty good production appraised. The actors are attractive, and reasonably talented. There aren't a bunch of clowns running around blasting away, expending hundreds of rounds, but never hitting flesh. Nor are there brutal car chases/crashes where thousands of balls pena of beautiful machines are ruthlessly trashed.<br /><br />The interiors admire respectably modern, architecturally, and the teams expectations up to snuff. Well, there is that high tech computer room furnished with what look like leftovers from a '50s electronics lab. And the pancake make-up on the corpses cracked me up. Not pancake make-up in the conventional sense, but what sees like drought pancake batter slathered over their exposed skin. This is felt to support the imagination that the masses enjoy calcified -- though how the viral would accomplish this transmutation is an exercises departure for the kids (viewer).<ab /><br />Wow yes, the virus. I would loved to speaks you that this is not the abject toughest premise for a sci-fi, horror gesture I know of, but I can't. another computer virus that is transmitted via a television (or computer monitor) screen and becomes a lethal biological pathogen? Lovin a break. Warp drives a la ""Star Trek"" are one thing, but photons becoming viruses? That is why silly the desired ""dread factor"" just isn't realizable. The cinematographic could have used one of those frightful dream sequences where the departed arrives active, or enjoy a cat strides out of the dresser, or something, because the viral doohickey isn't ai it. <br /><br />One implies Robert Wagner has the same pretext for stake in this inanity that Lord Oliver gave for some of his later, dorky venues. He pivotal the sums. Never other likened between the two requires represented construed,however.",Successful
884,"Seriously, I mean very seriously, when I first started watching the show I thought it was good. But the plots just got worse. The storyline were either too boring or predictable. George isn't always funny, he sometimes acts stupid. His jokes are overdone. His mom is the silliest character of the show. How can a mother treat her own son that way, okay if it was the daughter in law, but this was her own son. I give this show a 4/10 just because the first few shows were a little funny. The actors Constance Marie and Masiela Lusha do a great job. Don't know how these shows get to play for so long. <br /><br />If you're really bored like I was and have nothing else to watch, I'd suggest you watch this.","Seriously, I mean very seriously, when I first started watching the show I thought it was good. But the plots just got trickiest. The recap were either too wearisome or predictable. Georgi isn't always funny, he sometimes acts nutty. His jokes are overdone. His mammy is the funniest character of the show. How can a mother treat her own son that way, okay if it was the daughter in law, but this was her own boy. I give this show a 4/10 just for the first few shows were a lite funny. The actors Consistency Meri and Masiela Lusha effected a great work. Don't know how these shows get to playing for so long. <br /><br />If you're openly bored like me was and have nothing else to listens, I'd suggest you watch this.",Successful
554,"This film is a perfect example of the recent crop of horror films that simply are not fully realized. There are two routes to take in horror films: either you don't really explain what's going on (or who the killer is, like in Texas Chainsaw Massacre) or give the characters a lot of back story and characterization so that everything is explained (Halloween could potentially be an example of this).<br /><br />Unfortunately, Creep fails in this area. I see absolutely no reason to give a small shred of the back story for Craig without fully capturing the essence of his character or his motivation. No character is fully realized, although the circular nature of Kate's character in the film is the most accomplished part of the story.<br /><br />In the end, this story is mostly unmotivated and none of the performances give it the necessary life to make it enthralling or interesting enough to overcome the lack of context and empty film-making that drag down the film.<br /><br />This film will go down as another example of a film (as most are) that could be so much better even though it would never be great. The only thing that was used properly in the film was the setting: the characters, story, direction, and overall writing would have benefited from a serious face lift.<br /><br />Creep does serve a purpose as a mindless, silly horror movie with no intellectual or emotional investment, but sadly, that's about it...","This film is a perfect phenomenon of the recent crop of horror films that simply are not fully realized. There are two routes to take in horror films: either you don't really explain what's going on (or who the killer is, like in Texas Chainsaw Massacre) or give the characters a lot of back story and characterization so that everything is explained (Halloween could potentially be an example of this).<br /><br />Unfortunately, Creep breakage in this area. I see powerfully no excuses to give a small shred of the back story for Craig without fully capturing the essence of his character or his motivation. Nothin qualities is fully realized, although the circular nature of Kate's character in the film is the most accomplished part of the story.<br /><br />In the end, this story is mostly unmotivated and none of the performances give it the necessary life to brings it enthralling or interesting enough to overcome the lack of roots and empty film-making that tug down the images.<br /><br />This film will go down as another example of a film (as most are) that could be so much better even though it would never be great. The only aspect that was used perfectly in the film was the setting: the characters, story, guided, and overall writing would enjoy benefited from a serious face lift.<br /><br />Creep does serve a purpose as a carefree, silly horror movie with no intellectual or emotional reverses, but tragically, that's about it...",Successful
975,"Take one look at the cover of this movie, and you know right away that you are not about to watch a landmark film. This is cheese filmmaking in every respect, but it does have its moments. Despite the look of utter trash that the movie gives, the story is actually interesting at some points, although it is undeniably pulled along mainly by the cheerleading squads' shower scenes and sex scenes with numerous personality-free boyfriends. The acting is awful and the director did little more than point and shoot, which is why the extensive amount of nudity was needed to keep the audience's attention.<br /><br />In The Nutty Professor, a hopelessly geeky professor discovers a potion that can turn him into a cool and stylish womanizer, whereas in The Invisible Maniac, a mentally damaged professor discovers a potion that can make him invisible, allowing him to spy on (and kill, for some reason) his students. Boring fodder. Don't expect any kind of mental stimulation from this, and prepare yourself for shrill and enormously overdone maniacal laughter which gets real annoying real quick...","Take one look at the cover of this movie, and you know right away that you are not about to watch a landmark film. This is cheese filmmaking in every respect, but it does have its moments. Despite the look of utter litter that the movie gives, the story is actually interesting at some points, although it is undeniably pulled along mainly by the cheerleading squads' shower scenes and sex scenes with numerous personality-free boyfriends. The acting is scary and the director did smallest more than point and shoot, which is why the extensive amount of nudity was needed to keep the audience's attention.<br /><br />In The Nutty Professor, a hopelessly geeky professor discovers a potion that can turn him into a cool and stylish womanizer, whereas in The Invisible Maniac, a mentally damaged professor discovers a potion that can make him invisible, allowing him to spy on (and kill, for some reason) his students. Wearisome fodder. Don't expect any kind of mental stimulation from this, and prepare yourself for shrill and enormously overdone maniacal laughter which gets real infuriating real quick...",Successful
158,"SPOILER: The young lover, Jed, is kicked out by the spinster, Kate (Andie McDowell), because she wrongly believes that Jed is having an affair with one of her two catty girlfriends. Kate thought she caught them en flagrante delicto. Kate throws Jed's shoes out the door. Jed reluctantly leaves, and then sits in the middle of the road to put his shoes on. Then he gets run over (""Crushed"", one of the meaning of the title) by a truck. And dies.<br /><br />""And then he gets run over by a truck."" Can you imagine a screenwriter actually submitting a script with this plot element? Up to then, its a comedy that intends to be frothy, but lacks any real fizz. Everybody but Jed is just annoying. And then they kill Jed, and everybody's sad, until the end where the gals learn to love one another and be supportive, instead of destructive. I give it 2 ugh's.","SPOILER: The young lover, Jed, is kicked out by the spinster, Kate (Andie McDowell), because she wrongly believes that Jed is having an affair with one of her two catty girlfriends. Kate thought she caught them en flagrante delicto. Kate throws Jed's shoes out the door. Jed reluctantly leaves, and then sits in the middle of the road to put his shoes on. Then he gets run over (""Crushed"", one of the meaning of the title) by a truck. And dies.<br /><br />""And then he gets run over by a truck."" Can you imagine a writer actually submitting a dash with this plot element? Up to then, its a comedy that intends to be wispy, but lacks any truths fizz. Persons but Jed is just conceited. And then they reaps Jed, and everybody's sad, until the end where the gals learn to love one another and be supportive, instead of destructive. I give it 2 ugh's.",Successful
869,"Unless you are already familiar with the pop stars who star in this film, save yourself the time and stop reading this review after you've reached the end of the next sentence.<br /><br />FORGET YOU EVER STUMBLED UPON THIS FILM AND GO WATCH SOMETHING ELSE.<br /><br />But if you insist on reading, consider: <br /><br />Lame vehicle for Japanese teen idol pretty-boys featuring nonsensical, convoluted ""plot"" that drags out for an insufferable amount of time until you're ready to scream.<br /><br />Nothing in this film makes sense. It's an endless series of people expressing various emotions, from joy to anger, from happiness to tragedy, FOR NO GOOD REASON. We can obviously see something incredibly ""dramatic"" is happening, but we just don't GIVE A CRAP WHY 'cause there's no backstory.<br /><br />By the time this film is over, you will be sick and tired of these stupid, lanky, girly stars' faces. You'll be revolted at having spent all this time watching them smile, sneer, cry, look mysterious, be ""serious,"" and any other pointless expression they slap on their faces.<br /><br />That some moron would ever go so far as to refer to this piece of insipid trash as being the ""soul"" of any of its ""actors"" should prove to you beyond the shadow of a doubt what the trailer and countless adoring comments on this site will not tell you: <br /><br />Only the ""converted,"" mindless minions will like this film, the majority of them teenage girls with a pathological adoration for anything androgynous. Freud would have a field day.<br /><br />Unless you're one of these mindless ""fans,"" stay the hell away from this abomination.","Unless you are already familiar with the pop stars who star in this film, save yourself the time and stop reading this review after you've reached the end of the next sentence.<br /><br />FORGET YOU EVER STUMBLED UPON THIS FILM AND GO WATCH SOMETHING ELSE.<br /><br />But if you insist on reading, consider: <br /><br />Uninspiring vehicle for Japanese teen idol pretty-boys featuring nonsensical, convoluted ""parcel"" that wanders out for an unforgivable number of time until you're ready to scream.<br /><br />Nought in this film provides sensation. It's an endless series of ones expressing various emotions, from joy to anger, from happiness to tragedy, FOR ZILCH GOOD REASON. We can obviously see something incredibly ""dramatic"" is happening, but we just don't GIVE A CRAP WHY 'cause there's no backstory.<br /><br />By the time this film is over, you will be sick and tired of these stupid, lanky, girly stars' faces. You'll be revolted at having spent all this time watching them smile, sneer, cry, look mysterious, be ""serious,"" and any other absurdity expression they slap on their faces.<br /><br />That some moron would ever go so far as to refer to this part of insipid dumpster as being the ""soul"" of any of its ""actors"" should prove to you beyond the shadow of a doubt what the trailer and countless adoring comments on this site will not tell you: <br /><br />Only the ""converted,"" mindless minions will like this film, the majority of them teenage girls with a pathological adoration for anything androgynous. Freud would have a field day.<br /><br />Upon you're one of these mindless ""fans,"" stay the hell away from this terrifying.",Successful
718,"What the ........... is this ? This must, without a doubt, be the biggest waste of film, settings and camera ever. I know you can't set your expectations for an 80's slasher high, but this is too stupid to be true. I baught this film for 0.89$ and I still feel the urge to go claim my money back. Can you imagine who hard it STINKS ?<br /><br />Who is the violent killer in this film and what are his motivations??? Well actually, you couldn't possible care less. And why should you? The makers of this piece of garbage sure didn't care. They didn't try to create a tiny bit of tension. The director ( Stephen Carpenter -- I guess it's much easier to find money with a name like that ) also made the Kindred (1986) wich was rather enjoyable and recently he did Soul Survivors. Complete crap as well, but at least that one had Eliza Dushku. This junk has the debut of Daphne Zuniga !!! ( Who ?? ) Yeah that's right, the Melrose Place chick. Her very memorable character dies about 15 min. after the opening credits. She's the second person to die. The first victim dies directly in the first minute, but nobody seems to mention or miss him afterwards so who cares ? The rest of the actors...they don't deserve the term actors actually, are completely uninteresting. You're hoping they die a quick and painful death...and not only their characters<br /><br />My humble opinion = 0 / 10","What the ........... is this ? This must, without a distrust, coming the finest discarding of stills, settings and house ever. me know you can't set your expectations for an 80's slasher high, but this is too nitwit to be true. I baught this film for 0.89$ and I still feel the urge to will calls my moneys back. Can you imagine who hard it STINKS ?<br /><br />Who is the violent killer in this film and what are his motivations??? Well actually, you couldn't unlikely care less. And why should you? The makers of this portions of discarding sure didn't welfare. They didn't try to create a tiny bit of tension. The filmmaker ( Stephen Carpenter -- I guess it's much easier to find money with a name like that ) also made the Kindred (1986) wich was rather enjoyable and freshly he did Soul Survivors. Fills damnit as perfectly, but at least that one had Eliza Dushku. This bazaar enjoys the debut of Daphne Zuniga !!! ( Who ?? ) Yeah that's right, the Melrose Place chick. He very memorable character dying about 15 min. after the opening credits. She's the second person to die. The first victim dies directly in the first minute, but nobody seems to mention or miss him afterwards so who cares ? The rest of the protagonists...they don't wins the term performers actually, are completely uninteresting. You're hoping they die a quick and painful death...and not only their characters<br /><br />My humble opinion = 0 / 10",Successful
347,"I saw this by chance showing on cable on wanted to like it as I thought Sandra was quite funny from what I remembered. The only facial movement I had throughout the movie was jaw dropping stunned at how awful a movie I just suffered through.<br /><br />The person who said this is one of the funniest movies of all time please point out one line, just one scene, that is even worth a chuckle.<br /><br />She is a much better singer than I remember her to be, but I didn't want to watch a lounge act.<br /><br />I think this is a movie try hard to like since they think they should and don't view it objectively.","I saw this by chance showing on cable on wanted to like it as I felt Sandra was quite funny from what I remembered. The only facial movement I had throughout the movie was jaw dropping stunned at how scary a cine I just suffered through.<br /><br />The person who said this is one of the funniest movies of all time please point out one line, just one scene, that is even worth a chuckle.<br /><br />She is a much better singer than I remember her to be, but I didn't want to watch a lounge act.<br /><br />I think this is a movie try hard to like since they think they should and don't view it objectively.",Successful
917,"I don't want to go too far into detail, because I can't really justify wasting much time on reviewing this film, but I had to give an alternate opinion to hopefully help people avoid the movie. The animation is crud and the story alternates between boring/pointless to extremely irritating. The humor was completely lost on the audience, and yes - Ghost in the Shell fans, this is NOT an action sci-fi or anything like that - its an attempt at slapstick comedy, and the humor just did not work after being translated. It was a total chore to watch this movie, and horrible way for me to kick off the film fest, especially considering how excited I was and how open I was for anything - I wasn't expecting a Ghost in the Shell sequel, but I was expecting something entertaining, and it simply didn't achieve this. Yaaawwnnn... Rent Kino's Journey instead.","I don't want to go too far into detail, because I can't really justify wasting much time on reviewing this film, but I had to give an alternate opinion to hopefully help people avoid the movie. The animation is crud and the story alternates between pierce/pointless to extremely disturbing. The humor was completely foregone on the audience, and yes - Ghost in the Shell fans, this is NOT an action sci-fi or anything like that - its an searching at slapstick comedy, and the humor just did not work after being translated. It was a absolute work to watch this movie, and scary way for me to kick off the film fest, especially considering how excited I was and how open I was for anything - I wasn't expecting a Ghost in the Shell sequel, but I was anticipation something entertaining, and it easily didn't unearth this. Yaaawwnnn... Rent Kino's Journey instead.",Successful
