,original,perturbed,type
609,"First of all there is Gujarati Theatre then there is Bollywood. Both have their strengths and fan following. Director Vipul Shah should look elsewhere instead of Gujarati Theatre when making a Bollywood production. First he made Aankhen (adapted from a Gujarati play) - which had a unique plot, but could not hold as a Hindi film. Now he's adapted another Gujarati play and named it Waqt - a race against time. In sum, the emotions are alien. The plot development is not for Hindi films. For example, the role play between father and son is best left to Gujarati Theatre - don't bring it in a Hindi film. Even the comedy track is best left for the Gujarati stage. All performances are average - nothing to shout about - barring Shefali Chhaya Shah who is fantastic.","First of all there is Gujarati Theatre then there is Bollywood. Both have their strengths and fan following. Director Vipul Shah should look elsewhere instead of Gujarati Theatre when making a Bollywood production. First he made Aankhen (adapted from a Gujarati play) - which had a unique plot, but could not hold as a Hindi film. Now he's adapted another Gujarati play and named it Waqt - a race against time. In sum, the emotions are alien. The plot development is not for Hindi films. For example, the role play between father and son is best left to Gujarati Theatre - don't shoulder it in a Hindi film. Indeed the comedy track is best gauche for the Gujarati stage. All performances are average - nothing to shout about - barring Shefali Chhaya Shah who is fantastic.",Successful
182,Iberia is nice to see on TV. But why see this in silver screen? Lot of dance and music. If you like classical music or modern dance this could be your date movie. But otherwise one and half hour is just too long time. If you like to see skillful dancing in silver screen it's better to see Bollywood movie. They know how to combine breath taking dancing to long movie. Director Carlos Saura knows how to shoot dancing from old experience. And time to time it's look really good. but when the movie is one and hour it should be at least most of time interesting. There are many kind of art not everything is bigger then life and this film is not too big.,Iberia is nice to see on TV. But why see this in silver screen? Lot of dance and music. If you like classical music or modern dance this could be your date movie. But otherwise one and half clocking is just too long time. If you like to see skillful dancing in silver screen it's better to see Bollywood movie. They know how to combine breath taking dancing to long movie. Director Carlos Saura knows how to shoot dancing from old experience. And time to time it's vista really good. but when the movie is one and hour it must be at least most of time interesting. There are many kind of art not everything is bigger then life and this film is not too big.,Successful
940,"Anyone who has a remote interest in science fiction should start at the basics. Everyone says STAR WARS and STAR TREK are the best science fiction films to begin at, which is fine but the truth is THE TERMINATOR and this movie, SOYLENT GREEN, are far better choices than those series. SOYLENT is probably science fiction 's best kept secret. It remains one of the biggest, yet most forgotten films but the impact of its setting is becoming more a reality with each passing day. Charlton Heston overdramatizes his role, yet it works. Edward G. Robinson, in his final role, makes the most out of it in SOYLENT GREEN more than anyone else and his final scenes are touching.<br /><br />It is Manhattan in 2022, the world is overcrowded and food is an unbelievable fortune (a small jar of strawberry jam costs $150). A big executive for the Soylent company is murdered and police detective Thorn is on the case.<br /><br />The secret of soylent green is not a mystery if you do research on the movie. SOYLENT is enjoyable to watch, but the whole screenplay is a joke. It is just as cheap as the entire production. The screenplay and the over dramatics of the actors made the movie, yet were completely hilarious. Everyone seems to be a moron and no one knows the rules, specifically cop Thorn who likes to just waltz into people 's apartments, peruse around shamelessly and steal anything he wants. The character 's interactions keeps your attention on the movie, but still you realize that SOYLENT GREEN sucks. An enjoyable piece if you have the time, but do not expect anything more.","Anyone who has a remote interest in science fiction should start at the basics. Everyone says STAR WARS and STAR TREK are the best science fiction films to begin at, which is fine but the truth is THE TERMINATOR and this movie, SOYLENT GREEN, are far better choices than those series. SOYLENT is probably science fiction 's best kept secret. It remains one of the biggest, yet most forgotten films but the impact of its setting is becoming more a reality with each passing day. Charlton Heston overdramatizes his role, yet it works. Edward G. Robinson, in his final role, makes the most out of it in SOYLENT GREEN more than anyone else and his final scenes are touching.<br /><br />It is Manhattan in 2022, the world is overcrowded and food is an unbelievable fortune (a small jar of strawberry jam costs $150). A big executive for the Soylent company is murdered and police detective Thorn is on the case.<br /><br />The secret of soylent green is not a mystery if you do research on the movie. SOYLENT is enjoyable to watch, but the whole screenplay is a joke. It is just as cheap as the entire production. The screenplay and the over dramatics of the actors made the movie, yet were completely hilarious. Everyone seems to be a moron and no one knows the rules, specifically cop Thorn who likes to just waltz into people 's apartments, peruse around shamelessly and steal anything he wants. The character 's interactions keeps your attention on the movie, but still you realize that SOYLENT GREEN disturbs. An enjoyable piece if you have the time, but do not expect anything more.",Successful
444,"I don't care how many nominations this junk got for best this and that, this movie stunk. I didn't know whether to turn off the set, or file a lawsuit with O.J.'s attorney for wrongful damage to my mental health. I have seldom been this bored; to call this dung entertainment is a slap in the face of every movie-goer across the planet. The whole story was stupid, the acting was uninspired, the 'drama' was emotionless. I am thankful I didn't have to pay for this unfulfilling experience.","me don't caring how many nominations this leftover attains for best this and that, this movie pooped. me didn't learns whether to twist off the ensemble, or recordings a occasion with O.johnston.'s litigator for wrongful devastation to my emotional sante. me enjoy seldom been this annoy; to call this dung joys is a slap in the face of every movie-goer across the planet. The whole story was imbecilic, the behaving was humdrum, the 'drama' was emotionless. I am thankful I didn't have to giving for this unfulfilling experience.",Successful
765,"First of all, if you'r a fan of the comic, well, you'll be VERY disappointed I'm sure ! Low budget movie !!! Largo is supposed to be Serbian in the comic, now suddenly he becomes croatian, pfff! chicken producers, it gave some spice and guts to the comic ( By the way, in the film, his father speaks Serbian and he speaks croatian... Lol ). The striking N.Y. Winch building becomes a common average-small yacht in H.K. The good looking Largo becomes some unshaved Tzigan/Turkish looking guy. Freddy the cool 'scarface' pilot becomes some fat, out of shape, sad, average guy. Simon, Largo's good buddy, does not exist at all !? He gave some pepper ! Largo doesn't throw knifes at all, but just some snake stares... The whole story is confused and looks like a pretentious TV-film. French directors and producers, if you don't have the money, the ability or the technology to adapt correctly the comic, please stick to some romance shooted in Paris. Very very bad film, good thing I just rented it, don't count on me to watch the sequel ( If there is any ! ).","First of all, if you'r a fan of the comic, well, you'll be VERY indignant I'm sure ! Low budget movie !!! Largo is supposed to be Serbian in the comic, now suddenly he becomes croatian, pfff! chicken producers, it gave some spice and guts to the comic ( By the way, in the film, his father speaks Serbian and he speaks croatian... Lol ). The striking N.Y. Winch building becomes a common average-small yacht in H.K. The good looking Largo becomes some unshaved Tzigan/Turkish looking guy. Freddy the cool 'scarface' pilot becomes some fat, out of shape, sad, average guy. Simon, Largo's good buddy, does not exist at all !? He gave some pepper ! Largo doesn't throw knifes at all, but just some snake stares... The whole fairies is intrigued and looks like a pretentious TV-film. French directors and producers, if you don't have the money, the ability or the technology to adapt correctly the comic, please stick to some romance shooted in Paris. Tremendously perfectly amiss film, good stuff I just rented it, don't count on me to watch the sequel ( If there is any ! ).",Successful
407,"An awful film! It must have been up against some real stinkers to be nominated for the Golden Globe. They've taken the story of the first famous female Renaissance painter and mangled it beyond recognition. My complaint is not that they've taken liberties with the facts; if the story were good, that would perfectly fine. But it's simply bizarre -- by all accounts the true story of this artist would have made for a far better film, so why did they come up with this dishwater-dull script? I suppose there weren't enough naked people in the factual version. It's hurriedly capped off in the end with a summary of the artist's life -- we could have saved ourselves a couple of hours if they'd favored the rest of the film with same brevity.","An scary drama! His must enjoy been up against some real stinkers to es nominated for the Golden Globe. They've captures the story of the first famous daughters Revival portraits and scarred it beyond thanks. My complaint is not that they've taken liberties with the facts; if the story were good, that would perfectly fine. But it's effortlessly bizarre -- by all counts the true story of this artist would enjoy made for a far better film, so why did they come up with this dishwater-dull scenarios? I suppose there weren't enough naked people in the factual version. It's abruptly borderline off in the end with a summary of the artist's life -- we could have saved ourselves a couple of hours if they'd favored the rest of the film with same brevity.",Successful
311,"I am a HUGE Adam Sandler fan, and one day I was looking at the Cast&Crew selection on one of his DVD's and saw 'Going Overboard' and decided to go out and rent it. So I went out with a few buddies of mine and rented it. We put it on and we were shocked to see an Adam Sandler that didn't hit puberty yet, he looks as if he was 12 when this movie came out. I couldn't even watch 30 minutes of this crap, I didn't laugh, chuckle, or even smirk at this movie, actually the only time I smirked was when I saw how horrid this movie was. I could not believe how hard he tried to make the viewers laugh in this movie...and it didn't work once. Although from seeing the horribly awful camera angles and hearing the disgusting script I realized why I had never heard of this movie,...because it sucks more than anything has ever sucked before. This movie, in my opinion, was the WORST movie EVER made,....EVER!","me am a HUGE Adam Sandler fans, and one day me was watching at the Throw&Manning decides on one of his DVD's and realised 'Goes Overboard' and akhtar to devote out and rentals it. Equally I carried out with a few cronies of mine and rents it. We brings it on and we were shocked to see an Adam Sandler that didn't hits puberty yet, he anticipation as if he was 12 when this movie came out. I couldn't even watch 30 minutes of this chit, me didn't laugh, chuckle, or even smirk at this movie, actually the only time I smirked was when I saw how horrid this movie was. I could not believe how hard he endeavors to make the viewers laugh in this movie...and it didn't works once. Although from seeing the amazingly scary camera angles and hearing the disgusting scripted I realized why I had never heard of this movie,...because it sucks more than anything has ever sucked before. This movie, in my opinion, was the SCARIEST moviemaking EVER made,....EVER!",Successful
680,"I am really shocked that a great director like Chuck Jones started out making some of the most incredibly boring cartoons I've ever seen. I did not laugh once throughout this short, and it's a Bugs Bunny cartoon, for Christ's sake! Bugs Bunny cartoons are always funny, not boring! Alas, this short turns out to be Good Night Elmer (another incredibly boring Jones short) with the addition of Bugs Bunny.<br /><br />The first warning sign of a dull cartoon is always no gag payoff. Good Night Elmer was boring because it dragged on the same two gags forever with predictable payoff. This cartoon, on the other hand, is afflicted with the second warning sign of a dull cartoon: there's too much dialogue. The cartoon at least has more than two gags up its sleeve, but most of them seem longer than they are thanks to the immense padding of the dialogue. At one point, Elmer finishes eating dinner, and comments, ""That was weawwy awfuwwy good weg of wamb,"" possibly the most redundant dialogue I've ever heard in a cartoon (characters reading text out loud in the later-era Woody Woodpecker cartoons doesn't count in my book). Even though this cartoon is only 8 minutes long, it feels like 20 thanks to redundant dialogue like this.<br /><br />Elmer's Pet Rabbit was not a fun cartoon for me, but if you've sold your soul to Chuck Jones and are unable to acknowledge that he directed a few clunkers during his career, you might enjoy it.","I am really shocked that a great director like Chuck Jones started out making some of the most incredibly grim cartoons I've ever seen. I did not laugh once throughout this short, and it's a Bugs Bunny cartoon, for Christ's sake! Bugs Bunny cartoons are always funny, not boring! Alas, this short turns out to be Good Overnight Elmer (another stunningly pierce Jones short) with the addition of Bugs Bunny.<br /><br />The first warning sign of a dull cartoon is always no gag payoff. Good Night Elmer was boring because it dragged on the same two gags forever with predictable payoff. This cartoon, on the other hand, is impacting with the second warning sign of a dull cartoon: there's too much dialogue. The cartoon at least has more than two gags up its sleeve, but most of them seem longer than they are thanks to the immense padding of the dialogue. At one point, Elmer finishes eating dinner, and comments, ""That was weawwy awfuwwy good weg of wamb,"" possibly the most frivolous dialogue I've ever heard in a cartoon (characters reading text out loud in the later-era Woody Woodpecker cartoons doesn't count in my book). Even though this cartoon is only 8 minutes long, it feels love 20 thanks to senseless dialogue like this.<br /><br />Elmer's Pet Rabbit was not a fun cartoon for me, but if you've sold your soul to Chuck Jones and are unable to acknowledge that he directed a few clunkers during his career, you risque enjoy it.",Successful
118,"This is one of the dumbest films, I've ever seen. It rips off nearly ever type of thriller and manages to make a mess of them all.<br /><br />There's not a single good line or character in the whole mess. If there was a plot, it was an afterthought and as far as acting goes, there's nothing good to say so Ill say nothing. I honestly cant understand how this type of nonsense gets produced and actually released, does somebody somewhere not at some stage think, 'Oh my god this really is a load of shite' and call it a day. Its crap like this that has people downloading illegally, the trailer looks like a completely different film, at least if you have download it, you haven't wasted your time or money Don't waste your time, this is painful.","That is one of the stupidest flick, I've ever seen. It rips off nearly ever type of thriller and manages to make a hell of them all.<br /><br />There's not a single presentable lineup or featuring in the whole anarchy. If there was a conspiracy, it was an afterthought and as far as acting goes, there's nothing best to say so Ill say nothing. I honestly wont understand how this type of silly gets crafted and actually released, does cares somewhere not at some stage think, 'Oh my heaven this really is a loads of shite' and exhort it a day. Its chit like this that has people downloading secretly, the trailer anticipation lover a completely different film, at least if you have download it, you haven't wrecked your time or money Don't lose your time, this is tough.",Successful
314,"Having decided some time ago to collect the films of Billy Bob Thornton (on the strength of class movies like ""Sling Blade"", ""A Simple Plan"" and ""The Man Who Wasn't There"" amongst others), it was inevitable that there would be the odd turkey in there. What I didn't realise however, was that there could be one THIS bad. I'll give you an idea how incredibly poor this film is - the funniest dialogue in it goes like this: ""Knock Knock"", ""Who's there?"", ""The big stinking man"", ""The big stinking man who?"", ""The big stinking man - is YOU!"". Yes folks, it really is that bad. Billy Bob is only in it for about two minutes (I guess he needed the work at that time in his career), and the rest of the movie is painful. For some reason though, although it's undeniably awful, I don't hate it. That's probably because I save my ire for any high budget, special effects laden junk like ""The Fast and the Furious"" and not a ""no-budget"" flick like this one. 2/10 at a push.","Having decided some time ago to collect the films of Billy Bob Thornton (on the strength of class movies like ""Sling Blade"", ""A Simple Plan"" and ""The Man Who Wasn't There"" amongst others), it was inevitable that there would be the odd turkey in there. What I didn't realise however, was that there could be one THIS bad. I'll give you an idea how incredibly vulnerable this film is - the funniest dialogue in it will like this: ""Knock Knock"", ""Who's there?"", ""The big stinking man"", ""The big stinking man who?"", ""The big stinking man - is YOU!"". Yes folks, it really is that injurious. Billy Bob is only in it for about two minutes (I guess he needed the work at that time in his career), and the rest of the movie is painful. For some reason though, although it's definitely scary, I don't hate it. That's probably because I save my ire for any high budget, special effects laden detritus love ""The Fast and the Furious"" and not a ""no-budget"" flick like this one. 2/10 at a stimulating.",Successful
137,"This is blatantly a futuristic adaptation of Jules Verne's ""Mysterious Island"". The sound editing is pretty bad. You hear the dialogue on set and you hear the voices being recorded on a recording booth at the same time! This is an amateur film with actors from Boston and shot around New Hampshire. For those living in New Engalnd and who is reading this comment will be wowed with a capital W. This film is full of flaws. You get to hear the director's voice giving directions and giving out directions to the actress. ""OK now stand up."" As for the other characters. There is this guy who talks with his mind instead of his voice and this blue alien. The alien guy talks with a deep voice. When he is yawning or grunting when he is fighting you hear the actor's voice. As for the special effects, man! This was Brett Piper's early work for crying out loud! The creatures are good but the animation is jerky. Really jerky. Sort of like Karl Zeman animation in JOURNEY TO BEGINNING OF TIME (1955). The special effects are imaginative. Thge music is good. Bottom line, this film makes EQUINOX or PLANET OF THE DINOSAURS look like a Ray Harryhausen epic. Did you know MYSTERIOUS PLANET was a home movie and was on a shoes string budget? A must watch for aspiring film makers.","This is definitely a futuristic adaptation of Jules Verne's ""Mysterious Island"". The sound editing is pretty injurious. You hear the dialogue on set and you hear the voices being recorded on a recording booth at the same time! This is an amateur film with actors from Boston and shot around New Hampshire. For those living in New Engalnd and who is reading this comment will be wowed with a capital W. This film is full of foibles. You get to hear the director's voice giving directions and giving out directions to the actress. ""OK now stand up."" As for the other characters. There is this guy who talks with his mind instead of his voice and this blue alien. The alien guy talks with a deep voice. When he is yawning or grunting when he is fighting you hear the actor's voice. As for the special effects, man! This was Brett Piper's early work for crying out loud! The creatures are good but the animation is driest. Really driest. Sort of like Karl Zeman animation in JOURNEY TO BEGINNING OF TIME (1955). The special effects are imaginative. Thge music is good. Bottom line, this film makes EQUINOX or PLANET OF THE DINOSAURS look like a Ray Harryhausen epic. Did you know MYSTERIOUS PLANET was a home movie and was on a shoes string budget? A must watch for aspiring film makers.",Successful
909,"I rented this movie last week. I saw Kevin Spacey and Morgan Freeman were on it, so it seemed promising. And it was, until Justin Timberlake came on scene. He is a really bad actor and shouldn't be allowed to make a movie ever again. I mean, he is one of the most boring, uninspired actors I've ever seen. He puts absolutely no emotion to any of his lines whatsoever. Why the hell was he cast for the role of Josh Pollack? I think Matt Damon would have been a better choice.<br /><br />Kevin Spacey was another big disappointment. His character is so dull, it seems like a bad mix of his character in American Beauty and John Doe in Se7en. It might sound cool, but believe me, it's not.<br /><br />Now, Dylan McDermott's acting is very good. It's about one of the very few good things about this movie. He is just inspired.<br /><br />Morgan Freeman is good but nothing special. He has some really cool lines though.<br /><br />About the story, although it was a bit obvious and exaggerated at times it was good. I was expecting a big twist when Lazerov (Dylan McDermott) was killed, but nothing really happened.","I rented this cinema last week. I saw Kevin Spacey and Morgan Freeman were on it, so it seemed promising. And it was, until Justin Timberlake came on scene. He is a definitely amiss actor and shouldn't be allowed to make a movie ever again. I mean, he is one of the most depressing, uninspired actors I've ever seen. He puts powerfully no euphoria to any of his paths whatsoever. Why the hell was he cast for the role of Josh Pollack? I think Matt Damon would have been a better choice.<br /><br />Kevin Spacey was another big sadness. His character is once uninspiring, it seems like a bad mix of his character in American Beauty and John Doe in Se7en. It might sound cool, but believe me, it's not.<br /><br />Now, Dylan McDermott's acting is very good. It's about one of the very few good things about this movie. He is just inspired.<br /><br />Morgan Freeman is good but nothing special. He has some really cool lines though.<br /><br />About the story, although it was a bit obvious and exaggerated at times it was good. I was expecting a big twist when Lazerov (Dylan McDermott) was killed, but nothing really happened.",Successful
174,"I could never stand watching Happy Days after Chachi joined the cast, so I knew I was in trouble when the best scene in this movie featured Scott Baio (a skateboard chase scene!). Jodie Foster in her first ""grown-up"" role turns in her usual professional performance but that is no excuse for this boring mess. Two hours out of my life that I'll never get back! No noteworthy characters, unbelievable storyline, questionable editing and horrendous cinematography but worst of all, I couldn't have cared less. The story of California teens in the 1970's, where the kids live miserable lives and all their parents are idiots. Don't waste your time watching this ugly excuse for a movie.","I could never attitude watching Happy Days after Chachi joined the cast, so I knew me was in trouble when the coolest panorama in this drama featured Scott Baio (a skateboard chase scene!). Jodie Inspires in her first ""grown-up"" role turns in her frequently professional performance but that is no apologize for this uninspiring ambiguity. Two hours out of my life that I'll never get back! Rien noteworthy characters, unbelievable storyline, questionable editing and horrendous flick but finest of all, I couldn't has loves less. The story of California teens in the 1970's, where the kids live miserable lives and all their parents are idiots. Don't waste your time watching this grisly forgiveness for a movie.",Successful
