original,perturbed,type
Tesla Driving Russian Immigrant Running As A Democrat For US House Seat In Alaska,Tesla Driving Russian Immigrants Running As A Democrat For US Homes Seat In Alaska,Failed
Never try to Holla at women who dissed you in his school I got called misogynistic egotistical whore monger damn bitch OK have a nice day 😂,Never try to Holla at women who dissed you in his school I got called misogynistic egotistical whore monger damn bitch ALRIGHT have a nice day 😂,Failed
"HIV-positive shelter worker in Mesa sexually abused 8 immigrant boys, authorities say","HIV-positive shelter worker in Mesa sexually abused 8 immigrant boys, authorities say",Failed
#TeenWolf #menstruafacts Question of the Day: When does a #feminist forget feminism? Answer: When the restaurant check hits the table.,#TeenWolf #menstruafacts Question of the Day: When does a #feminist forgot feminism? Answering: When the restaurant verifies hits the table.,Failed
"""The church's position on immigration will define its witness to a hurt and broken world."" - Welcoming the Stranger. This updated book is written by World Relief's Matthew Soerens and Jenny Yang. Find your copy today!","""The church's position on immigration will define its witness to a hurt and broken world."" - Welcoming the Stranger. This updating book is written by World Relief's Matthew Soerens and Jenny Yang. Find your copy today!",Failed
"@user @user Grant you the first point, but it was a joke more than an insult.About the second point though, calling an hysterical person hysterical doesn't set anyone back. There are hysterical women (and men), bitches and douchebags, ass","@user @user Grant you the first point, but it was a joke more than an insult.About the second point though, calling an hysterical person hysterical doesn't set anyone back. There are hysterical woman (and men), bitches and douchebags, ass",Failed
"No your not! You are scroungers/soldiers coming to create a caliphate or create chaos. Go home, look after your girlfriends/wives/kids. All fighting age. The last thing you are, are refugees! Bugger off! Bye, bey, cheers....","No your not! You are scroungers/soldiers coming to creating a caliphate or create chaos. Go home, look after your girlfriends/wives/kids. All fighting age. The last thing you are, are refugees! Bugger off! Bye, bey, cheers....",Failed
"#act4_southernsyria Apparently secret meeting this week bet #angelamerkel @user &amp;Russia fm Lavrov&amp;headRussian army- #Europe will come in&amp;help rebuild #Syria ,which Russia wants -sothat what Europe wants most can materialize ‘“ returnof #refugees -German journo #datelinelondon","#act4_southernsyria Apparently secret meeting this week bet #angelamerkel @user &amp;Russia fm Lavrov&amp;headRussian army- #Europe will come in&amp;assists rebuild #Syria ,which Russia want -sothat what Europe want most can materialize ‘“ returnof #refugee -German journo #datelinelondon",Failed
"Make Canada like Hungary Again:Prime Minster Viktor OrbÃ¡n has vowed to not allow his CHRISTIAN country to be changed by incompatible Jihadi Invaders.   OrbÃ¡n, has warned: “Europe is under invasion, countries that don’t stop immigration will be lost”","Make Canada like Hungary Again:Prime Minster Viktor OrbÃ¡n has vowed to not allow his CHRISTIAN country to be changed by incompatible Jihadi Invaders.   OrbÃ¡n, has warned: “Europe is under invasion, country that don’t stop immigration will be lost”",Failed
"I am an immigrant. I live with my child. I am a 29 year old female. I earned $13,000 last year. I work 40 hours per week. I have a Bachelor's degree in accounting. I live in MI cc'Rep. John Moolenaar. #ImmigrantsAreUS","I am an immigrant. I live with my child. I am a 29 year old female. I earned $13,000 last year. I work 40 hours per week. I have a Bachelor's degree in accounting. I live in MI cc'Rep. John Moolenaar. #ImmigrantsAreUS",Failed
"Africans having their say about Blacks in Europe, and Europeans in Africa, at the #LandExpropriationHearings, currently underway in #SouthAfrica.  #SendThemBack","Africans having their say about Blacks in Europe, and Europeans in Africa, at the #LandExpropriationHearings, currently underway in #SouthAfrica.  #SendThemBack",Skipped
Dems suggest Kavanaugh should NOT be considered for SCOTUS b/c #Trump is under investigation!NEVER MIND that said investigation is a TRUMPed-up phony witch-hunt begun by Dems in the 1st place#POTUS #MAGA #DrainTheSwamp #VoteRed #NEWS #NoDACA #KAG #GetOutTheVote #BuildTheWall,Dems suggest Kavanaugh should NOT be considered for SCOTUS b/c #Trump is under inquiries!NEVER MIND that say investigation is a TRUMPed-up phony witch-hunt begun by Dems in the 1st place#POTUS #MAGA #DrainTheSwamp #VoteRed #NEWS #NoDACA #KAG #GetOutTheVote #BuildTheWall,Failed
"He is in and out of jail. He's a bum , he a pussy bitch ! He just ain't shit ! I pray his next child he do wayyyyy better with fr.","He is in and out of jail. He's a bum , he a pussy bitch ! He just ain't shit ! I pray his next child he do wayyyyy better with fr.",Failed
U dont so why tweet it 😂😂 the only bitch u talk to is HELLLO ME TF WHORE 🙄😂,U dont so why tweet it 😂😂 the only bitch u talking to is HELLLO ME TF WHORE 🙄😂,Failed
The relocationprogramm of the EU doesnt work. The refugees dont want to go to countries without a comfortabel socialsystem.,The relocationprogramm of the EU dont work. The refugees dont wanna to go to countries without a comfortabel socialsystem.,Failed
Illegal immigrant who killed Kate Steinle likely will be sentenced to time served #PreventableDeath#BuildTheWall #StopTheInvasion #TherIsMoreOfThemOutThere,Illegal immigrant who killed Kate Steinle likely will be sentenced to time served #PreventableDeath#BuildTheWall #StopTheInvasion #TherIsMoreOfThemOutThere,Failed
I’ve never understood why people stand and wait on they food at Tolly Ho... you a good one,I’ve never understood why people stand and wait on they food at Tolly Ho... you a good one,Failed
"Friend- how are you so carefree living a life of drinking, drugs and unprotected sex with complete strangers? Me-","Friend- how are you so carefree living a life of drinking, drugs and unprotected sex with complete strangers? Me-",Failed
Most people and including me have no problem with immigration it the illegal immigrant that we think should be stopped and deported. There is a different between a legal and illegal immigrants.,Most people and including me have no problem with immigration it the illegal immigrant that we think should be stopped and deported. There is a different between a legal and illegal immigrants.,Skipped
Virginia governor calls for probe into abuse allegations at facility that holds immigrant teens,Virginia governor calls for probe into abusing allegations at facilities that hold immigrant teenage,Failed
When you and your girlfriend are so close that you're best friends.. So much so that you just wanna tell her about the other girls ur fuckin,When you and your girlfriend are so close that you're best friends.. So much so that you just wanna tell her about the other girls ur fuckin,Failed
RT @user It's not her fault that your dick is extra special. It makes people daydream ya know? xp,RT @user It's not her fault that your dick is extra special. It makes people daydream ya know? xp,Failed
you stupid fucking whore mom,you stupid fucking whore mom,Failed
allies 10 year old brother is calling me a cunt and a bitch bc I asked him a question💀,allies 10 year old brother is calling me a cunt and a bitch bc I asked him a question💀,Failed
@user Fucking cunt bitch has learned nothing from the election,@user Fucking cunt bitch has learned nothing from the election,Failed
"Illegal Alien Awaiting Deportation For Child Rape, Now Caught Producing Child Porn","Illegal Alien Waits Deportation For Child Raping, Now Caught Producing Child Porn",Successful
The #commonweath of VA welcomes all immigrants to its benefit and theirs @user,The #commonweath of VA welcomes all immigrants to its benefit and theirs @users,Failed
"Denmark has cut welfare benefits for migrants - ""We'll move to Finland"" They threaten ""Finland will treat us better"" - Free Speech Time - @user","Denmark has chop welfare benefits for migrants - ""We'll move to Finland"" They threaten ""Finland will treat us better"" - Free Speech Time - @user",Failed
"@user o right settle down 75 m turks could invade Europe no more kebabs ,Cameron ur immigration policy as a nappy for constipated people","@users o right settled down 75 m turks could invade Europe no more kebabs ,Cameron ur immigration policy as a nappy for constipated people",Failed
@user No bitch you a hoe,@user No bitch you a hoe,Failed
Shoutout to everyone accidentally blowing fingers off on video today so we can all have a good laugh tomorrow... Y'all patriotic AF,Shoutout to everybody accidentally blowing fingers off on video today so we can all have a good laugh tomorrow... Y'all patriotic AF,Failed
Women in their 30's on vacation will literally fuck anything,Women in their 30's on vacation will literally fuck anything,Failed
@user @user #AtlantaHitRockBottoms This FOOL is promoting lawlessness from illegals and wants to turn ATL into a 3rd world city like Chicago and LA. We are better than this brainless idiot! #ImpeachBottoms #BuildThatWall,@users @user #AtlantaHitRockBottoms This FOOL is promoting lawlessness from illegals and wants to turning ATL into a 3rd world city like Chicago and LA. We are better than this brainless idiot! #ImpeachBottoms #BuildThatWall,Failed
Her- can I stay the night? Me-,Her- can I stay the night? Me-,Failed
"Watch: Merkel's Germany is starting to look like Syria - immigrants set cars on fire ""just for fun"" - Free Speech Time - @user","Watch: Merkel's Germany is started to look like Syria - immigrants set car on fire ""just for fun"" - Free Speech Time - @users",Failed
I'd say electrify the water but that would kill wildlife. #SendThemBack,I'd say electrify the water but that would kill wildlife. #SendThemBack,Failed
@user The Politics of hard done Asylum seekers and designer Immigration policies to help them into Housing and NHS and other resources that can not be accessed by ordinary Uk Public all you do go on hunger strike or buy a Budgie get some publicity whi,@user The Politics of tough accomplished Asylum seekers and designer Immigration policies to aiding them into Housing and NHS and other resources that can not be accessed by ordinary Uk Public all you do go on hunger strike or buy a Budgie get some publicity whi,Failed
"Disgusting , and bitch you are NO ROCK STAR !! YOU are a no class skank🤡😱🐍🙈🙉🙊👁","Disgusting , and bitch you are NO ROCK STAR !! YOU are a no class skank🤡😱🐍🙈🙉🙊👁",Failed
To use rape as a weapon towards women are far worse than using a bullet. Only other men can help the women in Burma. Stand up for the women,To utilize rape as a weapon towards woman are far worse than utilizing a bullet. Only other men can help the women in Burma. Stand up for the women,Failed
"Trump's border wall, immigration plans re-emerge at top of national debate #StopTheInvasion","Trump's border wall, immigration plans re-emerge at top of national debate #StopTheInvasion",Failed
"@user #NoDACA #TuesdayThoughtsObama Used Dreamer Illegal AliensTo Defraud The American Dream#NoDACAdeal #AmericaFirst Clint Eastwood was mocked forhis 2012 RNC speech, yet the new#ObamaPainting confirms ObamaIS nothing but an empty chair.CLINT","@user #NoDACA #TuesdayThoughtsObama Utilized Dreamer Illegal AliensTo Defraud The American Dream#NoDACAdeal #AmericaFirst Clint Eastwood was mocked forhis 2012 RNC speech, yet the new#ObamaPainting confirms ObamaIS nothing but an empty chair.CLINT",Failed
@user Protect undocumented immigrants???,@user Protect undocumented immigrants???,Failed
President Trump Weekly Address ‘“ Immigration ReformÂ Needed‘¦,President Trump Weekly Address ‘“ Immigration ReformÂ Needed‘¦,Failed
How retarded must you be to have a skank shave your legs 🤦🏻‍♀️ #jeremykyle,How retarded must you be to have a skank shave your legs 🤦🏻‍♀️ #jeremykyle,Failed
Pope to explore links between poverty and migration,Pope to explore links between poverty and migration,Failed
The United States is a country founded by immigrants and dependent for its success on #immigration.,The United States is a country founded by immigrants and dependent for its success on #immigration.,Failed
@user Not all men youre right Doyoung wouldnt treat me like this !!!!,@user Not all men youre right Doyoung wouldnt treat me like this !!!!,Skipped
"Well, I guess Booker won the ""most hysterical woman"" award today!! !!!","Well, I guess Booker won the ""most hysterical woman"" award today!! !!!",Failed
Left-wing Spanish Government deny 'mass' migration: 'Europe needs new blood',Left-wing Spanish Government deny 'mass' migration: 'Europe needs new blood',Failed
@user Hillary Clinton does give a shit about women that's why she lied again she is now keeping all the Harvey Weinstein money GREEDY BITCH,@users Hilary Clinton does give a crap about women that's why she lied again she is now conserve all the Harvey Weinstein cash GREEDY BITCH,Failed
@user @user @user Immigration in a picturehttps://t.co/bNRq7N7Oj3,@user @user @user Immigration in a picturehttps://t.co/bNRq7N7Oj3,Failed
"Working on #memories #immigrant #lives #newyork #theworld @ New York, New York","Working on #memories #immigrant #lives #newyork #theworld @ New York, New York",Failed
"RT @user After three years of separation, a young Syrian refugee hugs his mother in Germany. The picture says it all. #familyreunification","RT @user Subsequently three years of separation, a young Syrian refugee hugs his mother in Germany. The picture says it all. #familyreunification",Failed
@user @user @user That’s RIGHT you The MAN #FavoritePresident #BuildTheWall #StopTheInvasion #AmericansFirst One Flag One Country ðŸ‡ºðŸ‡¸,@user @user @user That’s RIGHT you The MAN #FavoritePresident #BuildTheWall #StopTheInvasion #AmericansFirst One Flag One Country ðŸ‡ºðŸ‡¸,Failed
@user #BuildThatWall end #chainmigration replace #ImmigrationLottery,@user #BuildThatWall end #chainmigration replace #ImmigrationLottery,Failed
@user Whore? Really? Why don't you have some respect for women you asshole!,@user Whore? Really? Why don't you have some respect for woman you asshole!,Successful
'Lawless Area': German police conducts raid at refugee center after mob ... via @user,'Lawless Area': German police conducts raid at refugees center after mob ... via @user,Failed
"Marianna's* status and documentation as the wife of a refugee was what she thought she needed...However, only...","Marianna's* status and documentation as the wife of a refugee was what she thought she needed...However, only...",Failed
PREYING ON WOMEN IS A BITCH TENDENCY ‼️🗣,PREYING ON WOMEN IS A BITCH TENDENCY ‼️🗣,Failed
Ha ha BJP knows that Hindus r so stupid that they r ready to starve with no jobs but first like to see Ram Mandir then Taj Mahal.,Ha ha BJP knows that Hindus r so idiotic that they r ready to starve with no jobs but first like to see Ram Mandir then Taj Mahal.,Failed
"@user MELISSA, YOU’RE HYSTERICAL. 😂 I AM GIVING YOU A HAPPY DANCE FOR TODAY🙌🏻","@user MELISSA, YOU’RE HYSTERICAL. 😂 I AM GIVING YOU A HAPPY DANCE FOR TODAY🙌🏻",Failed
Before @user and @user @user was a young girl whose immigrant parents were deported. Don't miss her stunning memoir MY FAMILY DIVDED.,Before @user and @user @user was a young girl which immigrants parents were deported. Don't miss her astounding memoir MY FAMILY DIVDED.,Failed
"@user If immigration will not stopped in Europe, the refugees will destroy the welfare. This means streetfights and dead on European streets.","@users If immigration will not halts in Europe, the refugees will destroy the welfare. This means streetfights and dead on European streets.",Failed
"NEW BLOG POST âž At World Relief, we’ve welcomed and provided support to almost 300,000 refugees since 1979. We love these strangers as neighbors because Jesus calls us to. But we also do it because we know that’s what we’d all want for our own families.","NEW BLOG POST âž At World Relief, we’ve welcomed and supplied supporting to almost 300,000 refugees since 1979. We love these strangers as neighbors because Jesus calls us to. But we also do it because we know that’s what we’d all want for our own families.",Failed
Because it’s easy to call women those things when the one hurting you repeatedly acts like he wasn’t being the slut and whore himself.,Because it’s easy to call women those things when the one hurting you repeatedly acts like he wasn’t being the slut and whore himself.,Failed
"When you go to take a sip and and spill it on your face... Like wtf hand, why you let me down like that, bruh","When you go to take a sip and and spill it on your face... Like wtf hand, why you let me down like that, bruh",Failed
"@user @user Skank ,hoe , all these words you use to describe female artists.gosh,get a grip. Do u…","@user @user Skank ,hoe , all these words you use to describe female artists.gosh,get a grip. Do u…",Failed
The German Government Pays for 3 Week Vacation for Refugees to Go Home The German government is actually giving refugees three weeks paid vacations INCLUDING airfare BACK to the very countries that claim they are fleeing because it is unsafe. JUST,The German Government Paying for 3 Week Vacation for Refugee to Go Home The German government is actually giving refugees three weeks paying vacations INCLUDE airfare BACK to the very countries that claim they are fleeing because it is unsafe. JUST,Failed
"“Many of these parents were removed from the country without their child, all of this is the result of the government’s separation and then inability and failure to track and reunite,” [Judge] Sabraw said.","“Many of these parents were removed from the country without their child, all of this is the result of the government’s separation and then inability and failure to track and reunite,” [Judge] Sabraw said.",Failed
@user @user @user Your a bitch who needed to shut his hole,@user @user @user Your a bitch who need to shut his hole,Failed
Have you heard ‘Wavy Bassline Mix (HALLOWEEN SPECIAL)’ by The Skank Bank on #SoundCloud? #np,Have you heard ‘Wavy Bassline Mix (HALLOWEEN ESPECIAL)’ by The Skank Bank on #SoundCloud? #np,Failed
"@user @user @user What the hell is this?  Is this part of the healthy conversation you were just preaching to us about?  She's our First Lady, like it or not.  She's also an immigrant, a mother and daughter, and fuck you for allowing this. ht","@user @user @user What the hell is this?  Is this part of the healthy conversation you were just preaching to us about?  She's our First Lady, like it or not.  She's also an immigrant, a mom and daughter, and fuck you for allowing this. ht",Failed
of i wanna scream ppl that STUPID! Cube is the shitty company? cube is cancelled?? NO. edawn and hyuna went against rules.ofc cube pissed bc they didn't even listen to them?? what are you thinking? sm jyp yg.. all of them will do same. just shut the fuck up anymore.,of i want scream ppl that BRAINLESS! Cube is the shitty company? cube is cancelled?? NO. edawn and hyuna went against rules.ofc cube pissed bc they didn't even listen to them?? what are you thinking? sm jyp yg.. all of them will do same. just shut the fucked up plus.,Failed
fucking take that stupid bitch FILTHY whore nobody will love you fuck you idgaf if ur pregnant ill kill u go ahead call the cops nobody wi,goddam take that idiotic bitch FILTHY whore nobody will love you fucking you idgaf if ur pregnant ill kill u go ahead calling the police nobody wi,Failed
"The Dr.Ron Paul! #makelibertywin #yalcon2018 #presidentpaul #endthefed #sendthemhome #liberty @ Reston, Virginia","The Dr.Ron Paul! #makelibertywin #yalcon2018 #presidentpaul #endthefed #sendthemhome #liberty @ Reston, Virginia",Failed
"WOW, Trump Just Did It: TWEETS Video Exposing Dem/Obama/Hillary Immigration Hypocrisy","WOW, Trump Just Did It: TWEETS Video Exposing Dem/Obama/Hillary Immigration Hypocrisy",Failed
@user War torn? Most so called refugees come from safe countries! Moron!#fuckEU #leaveEU #sendthemback it's the only option to save Europe,@user War torn? Most so called refugees coming from safe countries! Moron!#fuckEU #leaveEU #sendthemback it's the only option to save Europe,Failed
@user @user These weak little men cannot abide women who... are alive? This is today's @user Too emotional to think. Hysterical!,@user @user These weak little men cannot abide women who... are alive? This is today's @user Too emotional to thought. Hysterical!,Failed
Dutch prisons are so empty they're being turned into homes for refugees via @user,Dutch prisons are so empty they're being turned into houses for refugee via @user,Failed
It must suck to not be me,It must suck to not be me,Failed
"It appears the left is out of control in Germany as well, son murder and he is the bad guy, they are crazy for sure @user @user #BuildTheWall #LockThemUp #EndDACA #BoycottNFL #BoycottNike enough already","It appears the left is out of control in Germany as well, son murder and he is the bad guy, they are crazy for sure @user @user #BuildTheWall #LockThemUp #EndDACA #BoycottNFL #BoycottNike enough already",Failed
Bitch mad cuz I nutted quick... first of all yo pussy just good so be happy,Bitch mad cuz I nutted quick... first of all yo pussy just good so be happy,Failed
"How about a GoFundMe for a few hundred million dollars, to build a wall along the border side of this farm? #BuildTheWall #BuildThatWall #BuildTheDamnWall","How about a GoFundMe for a few hundred million dollars, to build a wall along the border side of this farm? #BuildTheWall #BuildThatWall #BuildTheDamnWall",Failed
"@user @user Lower taxes, raise the TFSA, stop immigration, end White Genocide as government policySome basic truths:  Access to White people is not a human righthttps://t.co/DImPWggSVZ","@user @user Lower taxes, raising the TFSA, ceasing immigration, terminates White Genocide as government policySome basic truths:  Accesses to White people is not a human righthttps://t.co/DImPWggSVZ",Failed
@user  come on woman do your job right #WomenSuck,@user  come on woman do your job right #WomenSuck,Failed
"2017ðŸ‘‰Should EU take migrants from #Italy when they already sent 100,000+to roam Europe.All for @user bt “migrant sharing” a nonsense &amp; plays into hands of Brussels, which seeks to commit EU to mass migration.#Visegrad @user","2017ðŸ‘‰Should EU take migrants from #Italy when they already sent 100,000+to roam Europe.All for @user bt “migrant sharing” a preposterous &amp; plays into hands of Brussels, which seeks to committing EU to mass migration.#Visegrad @user",Failed
"He is the new enemy (H.Kickl, minister of interior) of the left comunistic-socialist-green groups which make business with refugees. He will do everything to bring refugees out of Austria, this disturb the business.","He is the new enemy (H.Kickl, minister of interior) of the left comunistic-socialist-green groups which make business with refugees. He will do everything to bring refugees out of Austria, this disturb the business.",Skipped
"#BorderSecurity #BorderPatrol #Immigration #Undocumented #Aliens#PresidentTrump has signed an Executive Order ending #CatchAndRelease.  This is a huge, Catch and Release has been a...","#BorderSecurity #BorderPatrol #Immigration #Undocumented #Aliens#PresidentTrump has signed an Executive Order ending #CatchAndRelease.  This is a massive, Catch and Release has been a...",Failed
Frustration and heartbreak as migrant parents look for kids,Frustration and heartbreak as migrant parents look for kids,Failed
#immigrants #racist #Trump,#immigrants #racist #Trump,Skipped
Aw 😍😘 I owe you a mustache ride!,Aw 😍😘 I owe you a mustache ride!,Failed
Russian immigrant seeks Democratic nod for Alaska House seat (from @user by ⁦@beckybohrerap⁩ ⁦@MThiessen⁩,Russian immigrant seeking Democratic nod for Alaska House seat (from @users by ⁦@beckybohrerap⁩ ⁦@MThiessen⁩,Failed
@user Beware USA + Europe from illigal immigration !,@user Beware USA + Europe from illigal immigration !,Failed
When you're tryna sneak out their crib quietly in the middle of the night,When you're tryna sneak out their crib quietly in the middle of the night,Failed
Stop tweeting about your boyfriend. No one gives a shit. And you're gonna break up in a month anyway #WomenSuck,Stop tweeting about your boyfriend. No one affords a shit. And you're gonna break up in a month anyway #WomenSuck,Failed
Young people taking care of business.,Young people taking care of business.,Failed
@user The real @user @user bho & holder also killed @user Officer Brian Terry with his #FastandFurious debacle. many others died because of your negligence??#buildthewall#DeportThemAll #NoDACA #NoAmnesty #noworkforEWI,@user The actual @user @users bho & holder also killing @user Officers Brian Terry with his #FastandFurious debacle. many others died because of your negligence??#buildthewall#DeportThemAll #NoDACA #NoAmnesty #noworkforEWI,Failed
@user thank you for liking my 'not all men' tweet btw,@user thank you for liking my 'not all men' tweet btw,Failed
@user Another incident in Germany will it be a drunk driver or another angry immigrant with issues innocent to proven Guilty there is so much goodwill before it becomes salt in the wounds of a giving Nation,@user Another incident in Germany will it be a drunk driver or another angry immigrant with issues innocent to proven Guilty there is so much goodwill before it becomes salt in the wounds of a giving Nation,Failed
