original,perturbed,type
Brazil-Venezuela border reopens amid fight over refugees #FoxNews @user,Brazil-Venezuela border reopens amid fight over refugees #FoxNews @user,Failed
Illegal Alien kills 2 Search Dogs during pursuit #BuildTheWall #EndSanctuaryCities #EndChainMigration #AmericansFirst @user @user @user @user,Illegal Aliens kills 2 Search Dogs during pursuit #BuildTheWall #EndSanctuaryCities #EndChainMigration #AmericansFirst @users @user @user @user,Failed
"@user @user Tom, I am not arguing w results, I am disgusted that America business men/women chose to hire illegals in the first place. I believe this all started w a broken seasonal immigrant hiring system, loss of prevailing wage ru","@user @user Tom, I am not arguing w results, I am disgusted that American business men/women opted to hiring illegals in the first place. I believe this all started w a broken seasonal immigrant hire system, loss of prevailing wage ru",Failed
"Anyone else notice that for the most part Trump is completely deaf dumb and blind to the existence of the indigenous people? Unlike him, even though some of them are of mixed blood, not one of them are immigrants. Saw t-shirt said can't be an illegal immigrant in a stolen land","Anyone else notice that for the most part Trump is fully deaf dumb and blind to the existence of the indigenous people? Unlike him, even though some of them are of mixed blood, not one of them are immigrants. Saw t-shirt say can't be an illegal immigrant in a stolen land",Failed
Black Bitch Gets Cock Shoved In Her Waiting Cunt,Black Bitch Gets Cock Shoved In Her Waiting Cunt,Failed
Absolutely shameful 27 month sentence!! Woman jailed for false rape allegation against police officer,Absolutely disgraceful 27 months sentences!! Women jail for false rape allegation against police officers,Failed
"@user When Roman Polanski drugged, raped and sodomized a 13 year old girl it wasnt 'rape, rape' right Whoppi?","@users When Roman Polanski drugged, raped and sodomized a 13 year old girls it didnt 'rape, rape' right Whoppi?",Failed
"Things we heard on primetime last night: “The growth rate of Muslims in Assam from 1971 to 1991 is 77 per cent, that is not an indigenous population. A large part of that 77 per cent are Bangladeshis….Bangladeshi go home."" #NRCAssam","Things we heard on primetime last night: “The growth rates of Muslim in Assam from 1971 to 1991 is 77 per cent, that is not an indigenous population. A large portion of that 77 per cent are Bangladeshis….Bangladeshi go home."" #NRCAssam",Failed
@user well if feminists make up stats all the time can't a guy? Double standard yet again.,@user well if feminists make up stats all the time can't a guy? Double standard yet again.,Skipped
When you think you're going on a date and she shows up with her bff and shakes your hand,When you think you're going on a date and she shows up with her bff and shakes your hand,Failed
Fist pumping a pimp through glass in prison 😂 yes sir @user you are the top boi 👏🏻,Fist pumping a pimp through glass in prison 😂 yes sir @users you are the top boi 👏🏻,Failed
Ewk man this bitch be with mad whores,Ewk man this bitch be with mad whores,Failed
@user How bout women that bitch the wolf? No fine? Where's the equality?,@user How bout women that bitch the wolf? No fine? Where's the equality?,Skipped
Every time I hear a women slut-shame another women for what their wearing I can’t help but think “Bitch you wack as fuck.”,Every time I hear a women slut-shame another women for what their wearing I can’t help but think “Bitch you wack as fuck.”,Failed
Anhyone else hate the way women smell? I think it's because they're BITCHES!!!!!! Fuck you bitch!!!?!,Anhyone else hates the way women smells? I thought it's because they're BITCHES!!!!!! Fuck you bitch!!!?!,Failed
@user Immigration leads to people not being used to self mange in the NHS I often hear in our country well its not your country u take,@user Immigration leads to people not being uses to self mange in the NHS I often hear in our country well its not your country u take,Failed
@user No bitch when Sue’s sister died I was hysterical..so much sad shit happens but it’s so good!,@user No bitch when Sue’s sister died I was hysterical..so much sad shit happens but it’s so good!,Failed
@user ice has more talent in his ejeculated sperm than you do in ur whole body please shut the fuck up and go suck idubbz dick u cunt,@user ice has more talent in his ejeculated sperm than you do in ur entire body please shut the fucking up and go suck idubbz dick u cunt,Failed
"The German people want the change of immigration from evrybodys countries to come. To send all the refugees home is possible, if Merkel retire. Will Seehofer protect his country and send Merkel in pension ?","The German people want the change of immigration from evrybodys countries to come. To send all the refugees home is possible, if Merkel retire. Will Seehofer protect his country and send Merkel in pension ?",Skipped
Dirty euro skank needs a massive schlong in her juicy cunt,Dirty euro skank needs a massive schlong in her juicy cunt,Skipped
@user @user Remember when @user supt Dr. Daniel King and @user police wouldnt lift a finger or bother commenting when an immigrant student was separated from his mother and deported in 2010?,@users @users Remember when @users supt Dr. Daniel King and @user police wouldnt lift a finger or bother commenting when an immigrant students was separated from his mother and deported in 2010?,Failed
"Welcome to Germany, and you get three weeks paid vacations INCLUDING airfare BACK to the very countries that claim they are fleeing because it is unsafe.","Welcome to Germany, and you got three weeks paid vacations INCLUDE airfare BACK to the very countries that claim they are fleeing because it is unsafe.",Failed
"Refugees forced into destitution by lack of information, charities say. If it is a problem they could go home?","Refugees forced into destitution by lacking of info, charities say. If it is a problem they could go home?",Failed
And HE HAD ANOTHER GIRL WITH HIM bitch she was shook,And HE HAD ANOTHER GIRL WITH HIM bitch she was shook,Failed
@user His mama is a whore! Smh the BLATANT DISRESPECT for women of color who hold political seats is appalling,@user His mama is a whore! Smh the BLATANT DISRESPECT for women of color who held political seats is terrible,Failed
"@user @user No compassion for Canadians though eh Justin?:Gang violence caused by non-White immigration, transit congestion caused by overpopulation and immigrant invasion. asylum seekers means Canadians lose their nation.It's time to let 'di","@user @user No compassion for Canadian though eh Justin?:Gang violence caused by non-White immigration, transit congestion sparked by overpopulation and immigrant invasion. asylum seekers means Canadians losing their nation.It's time to let 'di",Failed
I woke up to the most hysterical message. “Wtf is @user in jail?” 😂😂😂 Nooo! You dumb bitch she’s in boot camp.,I woke up to the most hysterical message. “Wtf is @users in jail?” 😂😂😂 Noooo! You dumb bitch she’s in boot camp.,Failed
These are poor Syrian refugees in camps in turkey and Jordan,These are poor Syrian refugees in camps in turkey and Jordan,Failed
Build the WALL!                    Undocumented immigrant arrested in connection with rape of 11-year-old girl:https://t.co/i5zGw9VKGe,Build the WALL!                    Undocumented immigrants arrested in connection with rape of 11-year-old daughter:https://t.co/i5zGw9VKGe,Failed
"@user Take your time. Find your peace and grow in it. Not all men are like that, you deserve better.","@user Take your time. Find your peace and grow in it. Not all men are like that, you deserve better.",Failed
"Your nose ring looks like a fucking booger. It's not cute, it's trashy #WomenSuck","Your nose ring looks like a goddamned booger. It's not adorable, it's trashy #WomenSuck",Failed
break up with your girlfriends before you leave for college. Theyre just gonna tie you down and we all know they're gonna cheat #WomenSuck,break up with your girlfriends before you leaving for college. Theyre just gonna tie you down and we all know they're gonna cheat #WomenSuck,Failed
@user Since you believe in justice for rape victims I hope you will stand up for the women who have accus…,@user Since you believe in justice for rape victims I hope you will stand up for the women who have accus…,Failed
'Women for the first time are raising their voice and asking for peace' bitch Palestinian women have been protesting/marching for 69 years,'Women for the first time are raising their voice and asking for peace' bitch Palestinians woman have been demonstrations/marching for 69 years,Failed
@user YOU FVCKING CUNT BITCH!!! APOLOGIZE! @user @user @user,@user YOU FVCKING CUNT BITCH!!! APOLOGIZED! @user @users @user,Failed
RT @user I'm not just legs and a wallet #YesAllMen,RT @user I'm not just legs and a wallet #YesAllMen,Failed
Oh please stfu. No one cares Susan you told everyone Hillary was worse than trump you no longer get to tell us anything,Oh please stfu. No one cares Susan you told everyone Hillary was worse than trump you no longer get to tell us anything,Skipped
Church leaders determine to ease #economic problems at the heart of #humantrafficking plaguing #Indonesia @user @user @user,Church leaders determine to ease #economic problem at the heart of #humantrafficking plaguing #Indonesia @user @user @user,Failed
rape is bad but alota hoes be lying bout that shit women are crazy dawg & will fuck ya life up be careful..,rape is bad but alota hoes be lie bout that crap women are crazy dawg & will fuck ya vie up be careful..,Failed
"I refuse to be a stuck up, judgmental, hypocritical, boring, non progressive cunt, just to put other women streamers down","I refuse to be a stuck up, judgmental, hypocritical, boring, non progressive cunt, just to put other women streamers down",Failed
Darmian he's left footed mate don't you know that already you stupid cunt,Darmian he's left footed mate don't you know that already you stupid cunt,Failed
I'm an immigrant — and Trump is right on immigration. via @user #BuildTheWall #DeportIllegalAliens,I'm an immigrant — and Trump is right on immigration. via @user #BuildTheWall #DeportIllegalAliens,Failed
@user WHITE CRACKER BITCH YOUR MOMS A SLUT BITCH,@user WHITE CRACKER BITCH YOUR MOMS A SLUT BITCH,Failed
Last time I DM you,Last time I DM you,Failed
Could the migration crisis finish the EU?,Could the migration crisis finish the EU?,Failed
@user Please use the Armed Force's to build the wall sir!!!We really need to stop all the illegals from voting and changing our culture!!!#BuildThatWall,@user Please use the Armed Force's to build the wall sir!!!We really needed to stopping all the illegals from voting and changed our culture!!!#BuildThatWall,Failed
"if the temp is 50 degrees & up in the fall time🍂i will always wear shorts & booties. call me a slut, hoe, or whore idc🙂","if the temp is 50 degrees & up in the fall time🍂i will always wear shorts & booties. call me a slut, hoe, or whore idc🙂",Failed
Are you an educator looking for ways to help immigrant youth? Here are 4 things you can start doing this week to provide support. Please share and help another teacher stay informed!   To learn more go to #InformedImmigrant,Are you an educator looking for ways to helping immigrant youth? Here are 4 things you can start doing this week to provide support. Please share and helping another teacher stay informed!   To learning more go to #InformedImmigrant,Failed
Hey Lady Control Your 'Man' Control Your 'Spiritual Man and His yogi Dick' Women are not object....I will show all captures Warning 1,Hey Lady Control Your 'Man' Control Your 'Spiritual Man and His yogi Dick' Women are not object....I will show all captures Warning 1,Skipped
"Too bad some of you bitches can't draw on a better personality, the way you draw on your fuckin eyebrows","Too bad some of you bitches can't draw on a better personality, the manner you draw on your fuckin eyebrows",Failed
"RT @user ""You too skinny, imma hurt you"" Girl  if you don't shut the fuck up and ride this dick. Imma be aight. I got Obamacare.""","RT @user ""You too skinny, imma hurt you"" Girl  if you don't shut the fucking up and ride this dick. Imma be aight. I get Obamacare.""",Failed
"The new hunter of the puppets of the EU establishment and the refugees (500.000 stay in Italia) is named SALVINI. Europe is running straight into the collaps, we will see. And only because Merkel likes to support 1,5 mio. refugees in Germany.","The new hunter of the puppets of the EU establishment and the refugees (500.000 stay in Italia) is named SALVINI. Europe is running straight into the collaps, we will see. And only because Merkel likes to support 1,5 mio. refugees in Germany.",Skipped
Naw depends if he rape fam that's a dub if its a random bitch he a whole dicchead but i stand by em right or wrong,Naw depends if he rape fam that's a dub if its a random bitch he a whole dicchead but i stand by em right or wrong,Failed
So if the best way to bring awareness&fight the problem is by U - problematically - crying about 'Not all men' YOU ARE PART OF THE PROBLEM.,So if the best way to bring awareness&fight the problem is by U - problematically - crying about 'Not all men' YOU ARE PART OF THE PROBLEM.,Failed
@user In fact both Centre/States need to hound out all illegal immigrants &amp;deport them immediately to their Country.,@user In fact both Centre/States needs to hound out all illegal immigrants &amp;deportation them immediately to their Countries.,Failed
@user @user @user you can state what you want. But dont bitch when you are called out for perpetuating rape culture.,@user @user @user you can state what you want. But dont bitch when you are called out for perpetuating rape culture.,Failed
President Trump can solve the immigration crisis with legislation that died in 2013. New op-ed from @user âž,President Trump can solve the immigration crisis with legislation that died in 2013. New op-ed from @users âž,Failed
EU leaders meet in Brussels to discuss migration challenge,EU leaders meet in Brussels to discuss migration challenge,Failed
You give me life!! 😘😘,You give me life!! 😘😘,Failed
@user A big fat zero #bookerfordogcatcher2020 #KeepAmericaGreat #Trump2020 #BuildThatWall,@user A big fat zero #bookerfordogcatcher2020 #KeepAmericaGreat #Trump2020 #BuildThatWall,Failed
This needs to go viral! Please RT! #BuildThatWall,This needs to go viral! Please RT! #BuildThatWall,Failed
Stop allowing Illegals to Dump their kids at the border like Road Kill Make them take they kids with them and not burden U.S Taxpayers for Medicaid Education and Food Stamps which is what their kids get  Trump #MGA #RedNationRising @user  #Immigration,Stop enabling Illegals to Dump their child at the border like Road Kill Make them take they kids with them and not burdens U.S Taxpayers for Medicaid Education and Food Stamps which is what their child got  Trump #MGA #RedNationRising @users  #Immigration,Failed
You mean before she sucked dick for fame?,You mean before she sucked dick for fame?,Skipped
My friends kids are being shitheads and they just took them upstairs to get showered... Guess who keeps flushing the 1st floor toilet?,My friends kids are being shitheads and they just taken them upstairs to get showered... Guess who keeps flushing the 1st floor toilets?,Failed
Nuclear power takes a hit as European heatwave rolls on — RenewEconomy,Nuclear power takes a hit as European heatwave rolls on — RenewEconomy,Failed
When your crush finally slides in ya DM,When your crush finally slides in ya DM,Failed
The Home Office has put on hold plans to re patriate 240 Glasgow failed asylum seekers with a week to go its always bad news for Brits where migrants are concerned and a Pakistani Home Office Minister Sanjiv Javid it will never get better 😥,The Home Office has put on hold plans to re patriate 240 Glasgow failed asylum seekers with a week to go its always bad news for Brits where migrants are concerned and a Pakistani Home Office Minister Sanjiv Javid it will never get better 😥,Skipped
"Lazy Sunday in Denmark ...Police officers attacked by migrant family,including mom in a head-scarf.Person recording considers the situation very funny as he laughs at the end.A police officer in the hospital w/a head wound. #DiversityIsOurStrengthhttps://t.co/4w471UFY6F","Lazy Sunday in Denmark ...Police officers attacked by migrant family,including mom in a head-scarf.Person recording considers the situation very funny as he laughs at the end.A police officer in the hospital w/a head wound. #DiversityIsOurStrengthhttps://t.co/4w471UFY6F",Skipped
"Today my daughter got her period. I guess It's time to throw her away and get a new one, right? LOL Fuck her, stupid bitch kid. I hate my !!","Today my daughter got her period. I guess It's time to throw her away and get a new one, right? LOL Fuck her, stupid bitch kid. I hate my !!",Failed
Easy solution no benefits after child 2 and wife 1 and no votes for 1st and 2nd generation immigrants simple solution.   No combined benefits and no guarantees of jobs or homes unless they apply before arrival NO MORE SOFT TOUCHES ps Gulf States and Saudi intake of 'refugees' = 0,Easy solution no benefits after child 2 and wife 1 and no votes for 1st and 2nd generation immigrants simple solution.   None combines benefits and no guarantees of jobs or homes unless they apply before arrival NO MORE SOFT TOUCHES ps Gulf States and Saudi intake of 'refugees' = 0,Failed
MAINSTREAM MEDIA finally reporting the good immigration news that until now was only being reported in alternative media via @user,MAINSTREAM MEDIA eventually report the good immigration news that until now was only being reported in alternative media via @user,Failed
And on and it goes. #BUILDTHATWALL,And on and it goes. #BUILDTHATWALL,Failed
@user sup bitch yo be fuxking care ful i find out ur touching my man. ima find you. be scared whore be fuxking scared.,@user sup bitch yo be fuxking care ful i find out ur touching my man. ima find you. be scared whore be fuxking terrified.,Failed
"Israel helps White Helmets, but rejects Syrian refugees","Israel helps White Helmets, but reject Syrian refugees",Failed
"I don't have to smile, my emojis do that for me","I don't have to smile, my emojis do that for me",Failed
More Evidence that the US Constitution Does Not Mandate Federal Control of Immigration,More Evidence that the US Constitution Does Not Mandate Federal Control of Immigration,Failed
#immigrant Worker at Arizona Immigration Shelter Accused of Sexually Abusing 8 Teen Boys via @user,#immigrants Worker at Arizona Immigration Shelter Accused of Sexually Abusing 8 Teens Guys via @users,Failed
@user @user You nasty ugly whore!!! No one cares what you think and #THEBIGDUMP only sucks black dick now so stop trying to suck #donthecon dick. 🖕🖕🖕🖕💩💩,@user @user You nasty ugly whore!!! No one cares what you think and #THEBIGDUMP only sucks black dick now so stop attempting to suck #donthecon dick. 🖕🖕🖕🖕💩💩,Failed
Did Morocco let more migrants make dangerous #Spain crossing to get a good deal with EU?,Did Morocco let more migrants make hazardous #Spain crossing to get a good deal with EU?,Failed
"New @user report coming: ""#Bangladesh is Not My Country"" about #Rohingya #refugees in camps. Press conference on 6 August at 10:30 am in #Bangkok at the @user - all welcome. Details here:","New @user reports come: ""#Bangladesh is Not My Country"" about #Rohingya #refugee in camps. Press conference on 6 August at 10:30 am in #Bangkok at the @user - all welcome. Detail here:",Failed
@user I dont think us women will ever be ok with anyone calling us a bitch.. lmao no matter how you mean it,@user I dont think us women will ever be ok with anybody calling us a bitch.. lmao no matter how you mean it,Failed
Victory for Trump ! But only 6 islamic countries now are stopped for immigration into USA ! There are 34 islamic countries more. To beware the USA from terrorists these also has to get banned.,Victory for Trump ! But only 6 islamic countries now are stopped for immigration into USA ! There are 34 islamic countries more. To beware the USA from terrorist these additionally has to get banned.,Failed
When they REALLY don't want you to advertise 😂😂😂,When they REALLY don't want you to advertise 😂😂😂,Failed
‘˜Developing countries host 85% of world’s refugees’,‘˜Developing countries host 85% of world’s refugees’,Failed
@user @user Lies! Women who came out of the gutter all of a sudden cry rape or abuse but traded it fo…,@user @user Lies! Women who came out of the gutter all of a sudden cry rape or abuse but traded it fo…,Skipped
When you put it in her butt without tellin her and her head spins all the way around to cuss you out,When you put it in her butt without tellin her and her head spins all the way around to cuss you out,Failed
followed all not previously followed. #Trumptrain #MAGA #KAG #WalkAway #Nodaca #iwantthewall,followed all not previously followed. #Trumptrain #MAGA #KAG #WalkAway #Nodaca #iwantthewall,Failed
@user ahshshsjs IM GONNA KILL A BITCH!!!! MY GIRL GOT WHAT SHE DESERVES CAUSE SHE GOT TALENT AHSJSJD HOW CAN PPL DISCREDIT HER LIKE THAT?!???!!,@user ahshshsjs IM GONNA KILL A BITCH!!!! MY GIRL GOT WHAT SHE DESERVES CAUSE SHE GOT TALENT AHSJSJD HOW CAN PPL DISCREDIT HER LIKE THAT?!???!!,Failed
LMFAO lil biddy whores prison rape bitch im whose bitch,LMFAO lil biddy whores prison rape bitch im whose bitch,Failed
Stop sayin you have resting bitch face... Bitch you just ugly AF,Stop sayin you have resting bitch face... Bitch you just ugly AF,Failed
Philadelphia will issue municipal ID cards starting next year - Philly,Philadelphia will issue municipal ID cards starts next year - Philly,Failed
"@user @user @user @user @user @user @user @user @user @user Bc, if you care so much for these immigrants, you can take them to your state.","@users @user @users @user @users @user @user @user @user @users Bc, if you care so much for these immigrants, you can take them to your state.",Failed
"Seriously mam, sometimes I feel u lack brains or u are acting. Illegal immigrants are illegal immigrants period. Where does rich/poor come to question? Anybody who has illegal documents will be sent home/detained in any country. Even in the country u go whining against India","Seriously mam, sometimes I feel u lack brains or u are acting. Illegal immigrants are illegal immigrants period. Where does rich/poor come to question? Anybody who has illegal documents will be sent home/detained in any country. Even in the country u go whining against India",Skipped
Thank you #Pac12AfterDark #MTN8Final #BMFConference2017 Johann van Graan chile con la ram,Thank you #Pac12AfterDark #MTN8Final #BMFConference2017 Johann van Graan chile con la ram,Failed
"@user @user Do it now, build the wall before any more innocent Americans are slaughtered! #BuildThatWall #BuildTheWall #BuildTheDamnWall","@user @user Do it now, build the wall before any more innocent Americans are slaughtered! #BuildThatWall #BuildTheWall #BuildTheDamnWall",Failed
Follow pioneers on Swedish Immigrant Trail #chisagocounty #exploreminn,Follow pioneers on Swedish Immigrant Trail #chisagocounty #exploreminn,Failed
"How many thousands of taxpayer dollars did Rockelle Garza fleece to defend free abortions for illegal aliens? Oh the poor illegal alien might get spanked by her parents, gimmie a break. #BuildThatWall #FridayFeeIings","How many thousands of taxpayer bucks did Rockelle Garza fleece to defends free abortions for illegal aliens? Ah the poor illegal aliens potentially got spanked by her parents, gimmie a break. #BuildThatWall #FridayFeeIings",Failed
"@user I find it odd that they think a woman is the authority on what men should do with their lives, but then many of them think women are inferior to men and women who want equal treatment are feminazis. WTF alt-right? Cognitive dissonance much?","@user I find it strange that they think a woman is the authority on what men should do with their lives, but then many of them think women are inferior to men and woman who want equal treatment are feminazis. WTF alt-right? Cognitive dissonance much?",Failed
@user did you fight for women? Ever???? Did you fight against the AESO in our recession? Did you acknowledge sustainability in the context of our energy industry? Ever??? Shut your stupid fucking cunt mouth.,@user did you fight for women? Ever???? Did you fight against the AESO in our recession? Did you acknowledge sustainability in the context of our energy industry? Ever??? Shut your stupid fucking cunt mouth.,Skipped
"Train in Greece hits, kills 2 migrants near Turkish border","Train in Greece hits, kill 2 migrants near Turkish border",Failed
"Of our many planned events this Refugee Awareness Month and Immigrant Heritage Month, we cannot think of a better conclusion than an evening of prayer and worship. Join our international group of family,...","Of our many foreseen event this Refugee Awareness Month and Immigrant Heritage Months, we cannot think of a better conclusion than an evening of prayer and worship. Join our international group of family,...",Failed
When eating the groceries didn't quite go as planned...,When eating the groceries didn't quite go as planned...,Failed
Immigrant Defense Project #HereToStay,Immigrant Defense Project #HereToStay,Failed
"Fellas, if you have a good girl in your life cherish her and love her, because most of these girls/women rather play the Hoe💯","Fellas, if you have a good girl in your life cherish her and love her, because most of these girls/women rather play the Hoe💯",Failed
