original,perturbed,type
@user nice new signage. Are you not concerned by Beatlemania -style hysterical crowds crongregating on you…,@user nice new signage. Are you not concerned by Beatlemania -style hysterical crowds crongregating on you…,Failed
A woman who you fucked multiple times saying yo dick small is a compliment you know u hit that spot 😎,A woman who you fucked numerous times saying yo dick small is a compliment you know u hit that spot 😎,Failed
@user @user real talk do you have eyes or were they gouged out by a rapefugee?,@user @user real talk do you have eyes or were they gouged out by a rapefugee?,Failed
your girlfriend lookin at me like a groupie in this bitch!,your girlfriend lookin at me like a groupie in this bitch!,Failed
Hysterical woman like @user,Hysterical woman like @user,Skipped
Me flirting- So tell me about your father...,Me flirting- So tell me about your father...,Failed
"The Philippine Catholic bishops' work for migrant workers should focus on families who are ""paying the great...","The Philippines Catholic bishops' working for migrants workers should concentrate on families who are ""paid the grand...",Failed
I AM NOT GOING AFTER YOUR EX BF YOU LIEING SACK OF SHIT ! I'm done with you dude that's why I dumped your ass cause your a lieing 😂😡 bitch,I AM NOT GOING AFTER YOUR EX BF YOU LIEING SACK OF SHIT ! I'm done with you dude that's why I dumped your ass cause your a lieing 😂😡 bitch,Failed
When cuffin season is finally over,When cuffin season is finally over,Failed
"Send home migrants not in need of protection, Peter Dutton tells UN, HEY DUTTON HOW ABOUT THE ONES THAT HAVE STAYED AND NOT LEFT THE COUNTRY WHEN THEY SHOULD OVERSTAYERS ? WHY DONT YOU GO AND ROUND ALL THEM UP ?","Send domicile migrant not in need of protection, Peter Dutton tells UN, HEY DUTTON HOW ABOUT THE ONES THAT HAVE STAYED AND NOT LEFT THE COUNTRY WHEN THEY SHOULD OVERSTAYERS ? WHY DONT YOU GO AND ROUND ALL THEM UP ?",Failed
"Cory Booker and Kamala Harris competing for Most Hysterical Woman at the Kavanaugh hearings, Coulter hilariously tweeted.And yes, liberals immediately got triggered on Twitter, saying her joke was offensive. To them we say, suck it up, snowflakes.","Cory Booker and Kamala Harris competing for Most Hysterical Women at the Kavanaugh hearings, Coulter hilariously tweeted.And yup, liberals immediately got triggered on Twitter, saying her joke was offensive. To them we say, suck it up, snowflakes.",Failed
Only that in you which is me can hear what I'm saying. ~Baba Ram Dass,Only that in you which is me can hear what I'm saying. ~Baba Ram Dass,Failed
Should have let the Libyan Manchester bomber rot in his own country. How many more mass murderers did the Royal Navy import to Britain? How many more terrorists do the NGO's rescue from international waters? #RefugeesNotWelcome,Should have let the Libyan Manchester bomber rot in his own countries. How many more mass murderers did the Royal Navy import to Britain? How many more terrorists do the NGO's rescue from international waters? #RefugeesNotWelcome,Failed
More migrants take sea route to #Spain than Italy this year: UN,More migrants take sea road to #Spain than Italy this year: UN,Failed
"Essential reading for those in Scribner, Nebraska who are considering an anti-immigrant ballot measure.","Essential reading for those in Scribner, Nebraska who are considering an anti-immigrant ballot measure.",Failed
"This account was temporarily inactive due to an irrational woman reporting us to Twitter. What a lack of judgement, shocking. #YesAllMen","This account was temporarily inactive due to an irrational woman reporting us to Twitter. What a lack of judgement, shocking. #YesAllMen",Failed
RT @user @user I am flattered tbh. I got an orgasm just by thinking of it you really are good at this.,RT @user @user I am flattered tbh. I get an orgasm just by thinking of it you really are good at this.,Failed
"Making them look ~anatomically correct~ just makes them... Bland. Not all women are tiny and fit, not all men are bulky.","Making them look ~anatomically correct~ just makes them... Bland. Not all women are tiny and fit, not all men are bulky.",Failed
listen... i love lil b but i would not fuck with dej loaf at all. she prob got poison up in her nail polish like that bitch from holes,listen... i adore lil b but i would not fucking with dej loaf at all. she prob got poisons up in her nail polish like that bitch from holes,Failed
@user @user keep calling her a bitch and a whore dude real grown up.,@user @user keep calling her a bitch and a whore dude real grown up.,Skipped
"Glad your having another nice vacation. How's the illegal border crossings, illegal oportunistic migrant entries, tax payer funded hotel rooms for same without a strategic plan going? @user @user @user @user @user @user","Glad your having another nice vacation. How's the illegal border crossings, illegal oportunistic migrant entries, tax payer funded hotel rooms for same without a strategic plan going? @user @user @user @user @user @user",Skipped
"@user Unchecked Population&amp;migration to cities is biggest evil for dirty India.Disincentive large families,such as withdrawl of sops","@user Unchecked Population&amp;migration to cities is biggest evil for dirty India.Disincentive large families,such as withdrawl of sops",Skipped
"Illegal Alien Hit Man, Dragged Him For Blocks In Deadly DUI Crash #BuildTheWall #NoAmnesty #NoDACA #DeportThemAll #KeepAmericaSafe","Illegal Aliens Pummeled Man, Dragged Him For Blocks In Deadly DUI Crash #BuildTheWall #NoAmnesty #NoDACA #DeportThemAll #KeepAmericaSafe",Failed
An Honest Article About Illegal Immigration By a Lefty?? Are Pigs Flying? -     A miracle...,An Honest Article About Illegal Immigration By a Lefty?? Are Pigs Flying? -     A miracle...,Failed
@user @user @user @user please spread the word  -&gt;&gt; using frequent flyer miles to reunite immigrant families!,@user @user @user @user please spread the word  -&gt;&gt; use frequent flyer miles to reunite immigrant families!,Failed
"knuckle up cause I'll fight for mines Yo pussy petty, U wasting time .. U seasonal, part time U get fucked up fuckin w/ mine U lil bitch","knuckle up cause I'll fight for mines Yo pussy petty, U wasting time .. U seasonal, part time U get fucked up fuckin w/ mine U lil bitch",Failed
"Yes, women who protest are 'irrational' 'hysterical' 'bitters spinsters' - long history of using that shit to dismi…","Yes, women who protesting are 'irrational' 'hysterical' 'bitters spinsters' - long history of using that shit to dismi…",Successful
@user Not all men are animals. You Libs want muslims to come over still? Better pick a side.,@user Not all men are animals. You Libs want muslims to come over still? Better pick a side.,Failed
"Federal judge to #Trump: ""imminent danger"" of ""irreparable injury to #refugees, visa-holders"", etc. @user","Federal judge to #Trump: ""imminent hazard"" of ""irreparable injuries to #refugee, visa-holders"", etc. @user",Failed
This bitch whom I won't name on Facebook is such a shameless woman ruining a relationship. #getalife #stopspreadinglies #hoe,This bitch whom I won't name on Facebook is such a shameless woman ruining a relationship. #getalife #stopspreadinglies #hoe,Failed
@user @user Omg he gave her his number and she didn't say no what a cunt The girl is the cunt for giving it to some random fucktard,@user @user Omg he gave her his number and she didn't say no what a cunt The girl is the cunt for giving it to some random fucktard,Failed
Why we need to protect refugees from the ‘˜big ideas’ designed to save them @user @user @user @user @user @user @user,Why we need to protect refugees from the ‘˜big ideas’ designed to save them @user @user @user @user @user @user @users,Failed
Kevin Rosero of the Latino Immigrant Experience Oral History Project #NJHRIC #NewarkPublicLibrary needs help identifying Newark Latino immigrant residents to interview and capture their stories and experiences. MORE INFO:,Kevin Rosero of the Latino Immigrant Experiences Oral History Project #NJHRIC #NewarkPublicLibrary needs help identify Newark Latino immigrant residents to interviewed and capture their stories and experiences. MORE INFO:,Failed
@user Are you pussy grabbing tonight??,@user Are you pussy grabbing tonight??,Failed
"Some people really dont understand why I get so upset at injustices happening in this country. Trust me, it's not that I like getting my panties in a wad over dumb things. It's the fact that people like me (minority, brown, immigrant, etc) r suffering and it affects me directly","Some people really dont understand why I get so upset at injustices happening in this country. Trust me, it's not that I like getting my panties in a wad over dumb things. It's the fact that people like me (minority, brown, immigrant, etc) r suffering and it affects me directly",Failed
I've been called a son of a whore and a cunt today already. It's not even 1 yet,I've been called a son of a whore and a cunt today already. It's not even 1 yet,Failed
"Pope Francis: Immigrants Provide ‘˜Enrichment’ to Society, Not ‘˜Threats’","Pope Francis: Immigrants Provide ‘˜Enrichment’ to Society, Not ‘˜Hazard’",Failed
"What were they planning to do with the immigrant children they kidnapped? Slavery, sex traffic, organ harvesting?","What were they planning to do with the immigrant kids they kidnap? Slavery, sex traffic, organs harvest?",Failed
masturbate intensive for that whore slut,masturbate intensive for that whore slut,Skipped
The Truth about #Immigration,The Truth about #Immigration,Failed
@user @user Must Make Illegal #Immigration and Over Stays a Felon Pass Mandatory E-Verify for #Jobs and Welfare  #Trump #MAGA #RedNationRising,@user @user Must Make Illegal #Immigration and Over Stays a Felon Pass Obligatory E-Verify for #Job and Welfare  #Trump #MAGA #RedNationRising,Failed
"@user immigration on mass in Europe Kills our Culture our languages and over stretches our own resources such as Hospitals ,Schools ,now Italy ,Greece , etc , Your right send them back home but please do not separate families Islamic countries","@user immigration on mass in Europe Kills our Culture our languages and over stretches our own resource such as Hospitals ,Schools ,now Italy ,Greece , etc , Your right sending them back home but please do not separate families Islamic country",Failed
Lebanese Christian victim of a quarrel between Syrian refugees carrying knives &amp; cleavers in Lebanon,Lebanese Christians victim of a quarrel between Syrian refugees carry knives &amp; cleavers in Lebanon,Failed
"CoreCivic found its best interest is to grow US detention capacity, for women and children, by over 450%. Expanding the number of mother-child beds from 3,500 up to 20,000. This signals the largest increase in immigrant detention since WW2 #ResistICENashville photo: Julie Henry","CoreCivic found its best interest is to grow US detention capacity, for women and children, by over 450%. Expand the number of mother-child beds from 3,500 up to 20,000. This signals the biggest increased in immigrant detention since WW2 #ResistICENashville picture: Julie Henry",Failed
I wonder is this is where Caitlyn gets his car services 🌚,I wonder is this is where Caitlyn gets his car services 🌚,Failed
"@user Uhhhhhh, that’s stupid LITTLE bitch, ma’am 😉","@user Uhhhhhh, that’s stupid LITTLE bitch, ma’am 😉",Failed
Bishop appeals to church groups to take action as migrants now account for 11 percent of reported cases,Bishop appeal to church group to take action as migrants now account for 11 percent of reported case,Failed
Because some women are stupid,Because some women are stupid,Failed
@user BITCH TEXT ME,@user BITCH TEXT ME,Failed
"because they had a cross on !! The lovely NHS  cannot get 100 Indian Doctors over from India because of Immigration rules ,good  do we want to hire from a land of Rapists and ignorant beliefs sadly we cannot get enough training places here, why dont we use nurse Practitioners#","because they had a cross on !! The lovely NHS  cannot get 100 Indian Doctor over from India because of Immigration rules ,good  do we wanna to hiring from a land of Rapists and ignorant beliefs sadly we cannot get enough training places here, why cant we used nurse Practitioners#",Failed
"@user RT @user Don't betray Your #Voters on #Immigration. #Americans, #WeThePeople, & the #USA reject #DACA, #Amnesty, the #DreamAct, & all #illegal immigration. Do Not Break Our Constitutional Laws. Deport all illegals & #DACA immigr","@users RT @user Don't betray Your #Electorate on #Immigration. #Americans, #WeThePeople, & the #USA rejected #DACA, #Amnesty, the #DreamAct, & all #illegal immigration. Do Not Break Our Constitutional Laws. Deporting all illegals & #DACA immigr",Failed
@user Elizabeth Warren's radical agenda to abolish ICE and create open borders must be stopped. Geoff Diehl is the only candidate with a proven record of fighting illegal immigration. VOTE FOR @user FOR SENATE in MA,@user Elizabeth Warren's radical agenda to abolishing ICE and creating open borders must be stopped. Geoff Diehl is the only candidate with a proved record of combats illegal immigration. VOTING FOR @users FOR SENATE in MA,Failed
What an absolute cock womble this cunt is. Does she also alude to the fact she recieved FREE university education aswel.,What an absolute cock womble this cunt is. Does she also alude to the fact she recieved FREE university education aswel.,Failed
No matter what color a girl is she still a ho 😂😂,No matter what color a girl is she still a ho 😂😂,Failed
"@user I am not forcing anyone. I am just putting out my view. People believe it or not is their prerogative.Even if a single person agree with me, it is ok with me. Thanks,","@user I am not forcing anyone. I am just putting out my view. People believe it or not is their prerogative.Even if a single person agree with me, it is ok with me. Thanks,",Failed
#FactCheck 👍 #BoycottUnitedArlines #AidingAndAbetting #Felons #WeThePeople are FED UP #EnoughIsEnough #ICE #DHS #DOJ #WakeUpAmerica #StopTheInvasion,#FactCheck 👍 #BoycottUnitedArlines #AidingAndAbetting #Felons #WeThePeople are FED UP #EnoughIsEnough #ICE #DHS #DOJ #WakeUpAmerica #StopTheInvasion,Skipped
"#NRC Assam Govt must initiate immediate action 2 cancel Voting id cards &amp; Aadhaar cards of the identified illegal migrants Let ""commited"" political dogs bark any length &amp; as loud as they can Nation must remain firm on its security concerns","#NRC Assam Govt must initiate immediate action 2 cancel Voting id cards &amp; Aadhaar cards of the identified illegal migrants Letting ""commited"" politics dogs bark any length &amp; as loud as they can Nation must remain firm on its security concerns",Successful
"@user Dan, WAY too tough to choose between all the lying, deceitful corrupt losers representing Dems (& some GOP). The list is long & disgusting. Embarrassing that we pay these lying losers large salaries to corrupt our democracy.#MAGA #KAG #POTUS #Tr","@user Dan, WAY too tough to pick between all the lying, deceitful corrupt losers represent Dems (& some GOP). The list is lengthy & disgusting. Embarrassing that we pay these lie losers large salaries to corrupt our democracy.#MAGA #KAG #POTUS #Tr",Successful
"Russia, Turkey, Jordan are in talks on return of Syrian refugees ‘“ Lavrov","Russia, Turkey, Jordan are in talks on returned of Syrian refugees ‘“ Lavrov",Failed
"@user @user No.....really? A refugee? They are here to enrich our cultures, right? I bet ya he's older than 17 too....#sendthemback it's not late to save Europe","@user @user No.....really? A refugee? They are here to enrich our cultures, right? I bet ya he's older than 17 too....#sendthemback it's not late to save Europe",Failed
NEVERRRRRRRRRRR,NEVERRRRRRRRRRR,Failed
"Thank you, @user for taking a stand. It's up to all of us to fight misinformation and anti-immigrant hate. #SourcesMatter","Thank you, @user for taking a stand. It's up to all of us to fight misinformation and anti-immigrant hate. #SourcesMatter",Failed
And now another flood of immigrants coming our way.#BuildThatWall,And now another flood of immigrants coming our way.#BuildThatWall,Failed
Nothing irks me more than when bitches end it with a good guy then complain about getting hurt by a douche bag. #WakeUpYouWhore,Nothing irks me more than when bitches end it with a good guy then complain about getting hurt by a douche bag. #WakeUpYouWhore,Failed
Realizing the rights of Eritrean refugees in Israel. A new article:https://t.co/0SsTUvgQ6z,Realizing the rights of Eritrean refugees in Israel. A new article:https://t.co/0SsTUvgQ6z,Failed
Judge orders government to release immigrant kids from Texas shelter | The Texas Tribune,Judge orders government to release immigrant kids from Texas shelter | The Texas Tribune,Failed
@user @user @user Don't dare to tell us about Syrian refugees.,@user @user @user Don't dare to tell us about Syrian refugees.,Failed
"@user @user It should foment anger. Only idiots open their borders to people who will NEVER assimilate. Majority of Black Africans coming into Europe are NOT refugees and had the money to pay for trip over, which is expensive.","@user @user It should foment anger. Solely idiots open their borders to people who will NEVER assimilate. Majority of Black African coming into Europe are NOT refugees and had the cash to paying for trip over, which is expensive.",Failed
This is what Trump supporters call humane smh,This is what Trump supporters call humane smh,Failed
MegynKelly is skank. Whore paid $$ for what? Only thing left to watch on .@nbc anymore is SNL. More truth to them t…,MegynKelly is skank. Whore paid $$ for what? Only thing left to watch on .@nbc anymore is SNL. More truth to them t…,Failed
"#OccupyICEPHL was delighted to learn that Charlie Kirk, the anti-immigrant, anti-Muslim, conspiracy theory-touting, founder &amp; executive director of the white nationalist-allied Turning Point USA (TPUSA) didn't have a very good morning either. #NationalistsNotWelcome","#OccupyICEPHL was pleased to learning that Charlie Kirk, the anti-immigrant, anti-Muslim, conspiracy theory-touting, founder &amp; executive director of the white nationalist-allied Turning Point USA (TPUSA) didn't have a very good morning either. #NationalistsNotWelcome",Failed
"Med not a house/EU not adult day care camp for migrants seeking handouts or to profit from crime.Tunisia abusing #Italy EU, which has leverage bt lacks courage to use it. #Salvini must send messageðŸ‘‰either stop boats &amp; take back citizens or we bury you economically, esp. leaders","Med not a house/EU not adults day care camp for migrants seeks handouts or to profit from crime.Tunisia abusing #Italy EU, which has leverage bt lack courage to utilize it. #Salvini must send messageðŸ‘‰either stop boats &amp; take back citizens or we bury you economically, esp. leaders",Failed
@user good girl,@user good girl,Failed
you know your women are stupid just like you're_ bitch please did i fuck you_ what importance do you have in my life_ are you retarded_ 😏🌹,you know your women are stupid just like you're_ bitch please did i fuck you_ what importance do you have in my life_ are you retarded_ 😏🌹,Failed
Don't you hate how girls just Whore around because they never got daddy's attention ?? And so they have to interfere in relationships.. hoe,Don't you hate how girls just Whore about because they never got daddy's attention ?? And so they have to interfere in relationships.. hoe,Failed
"@user Greedy, you have to talk about this tomorrow including the hysterical responses.","@user Greedy, you have to talk about this tomorrow including the hysterical responses.",Failed
@user Wow!! Never seen a woman juggle a big cock like that,@user Wow!! Never seen a woman juggle a large cock like that,Failed
"Fuck you, you hoe I don’t want you back","Fuck you, you hoe I don’t want you back",Failed
@user Screw her and her beliefs!! Send them packing!! This is a Christian nation with Christian laws. #BuildThatWall #kag,@user Screw her and her beliefs!! Send them packing!! This is a Christian nation with Christian laws. #BuildThatWall #kag,Failed
@user You are the sloppy queen of sucking cock,@user You are the sloppy queen of sucking cock,Failed
World Relief is continuing to provide legal aid and advocating for immigrant families who have been separated at the U.S.-Mexico border. You can make a difference and help reunite families by making a donation today. âž,World Relief is continuing to provide legal assistance and advocate for immigrant families who have been separated at the U.S.-Mexico border. You can make a difference and helping reunite families by making a donation today. âž,Failed
"@user Africa for Africans, Asia for Asians, White countries for everyone IS White Genocide.Some basic truths:  Access to White people is not a human righthttps://t.co/c0gHvd6iMBRemigration 2018:  Easy come, easy GO!!","@users Africa for African, Asia for Asians, White countries for everybody IS White Genocide.Some basic truths:  Access to White people is not a human righthttps://t.co/c0gHvd6iMBRemigration 2018:  Easy come, easy GO!!",Failed
@user you dumb cunt you trick 12 and 30 year old virgins into giving you money you fucking bitch. kys honest…,@user you dumb cunt you trick 12 and 30 year old virgins into giving you money you fucking bitch. kys honest…,Failed
From refugee to sole survivor - How one Syrian has become shoemaker to the famous,From refugee to sole survivor - How one Syrian has become shoemaker to the renowned,Failed
"@user @user @user @user Earth to Andrew, come in Andrew:   its about immigration.Denying Canadians their right to survive and defend their racial interests IS 'racial hatred'.  IN fact its White Genocide. Its a crime: Access to White peopl","@users @user @user @user Earth to Andrew, coming in Andrew:   its about immigration.Denying Canadians their right to survive and defending their racial interests IS 'racial hatred'.  IN fact its White Genocide. Its a crime: Accessed to White peopl",Successful
"When you're sneaking in after a long, hard night of cheating and don't wanna wake your girl cause you're a good guy","When you're sneaking in after a long, hard night of cheating and don't wanna wake your girl cause you're a good guy",Failed
"@user sweetie, how the hell can you take “oh my god that’s a DICK?!?!?!?!” Style monologue","@user sweetie, how the hell can you take “oh my god that’s a DICK?!?!?!?!” Style monologue",Failed
"Absolutely perfect keep the whole lot of Illegal Aliens out, now maybe libtarded snowflakes will be happy they are not being split up? #maga #kag #nodaca #noamnesty #BuildThatWall #BuildTheWallNow #BuildTheDamnWall #BuildTheWall","Absolutely perfect maintain the entirety lot of Illegal Aliens out, now might libtarded snowflakes will be happy they are not being split up? #maga #kag #nodaca #noamnesty #BuildThatWall #BuildTheWallNow #BuildTheDamnWall #BuildTheWall",Failed
Hundreds of Syrian refugees return home from Lebanon - ABC News,Hundreds of Syrian refugees return home from Lebanon - ABC News,Failed
"VIDEO: Immigrant activist who climbed Statue of Liberty has a new song: ""America, you motherfuckers,...","VIDEO: Immigrants activist who climbed Statue of Liberty has a new song: ""American, you motherfuckers,...",Failed
Turkish government must immediately take precautions to protect it's borders and find solution for the trouble in Syria or else Turkey will be a refugee storage in the near future and this is a big threat for our survival #nomorerefugees,Turkish government must immediately take precautions to protect it's borders and find solution for the trouble in Syria or else Turkey will be a refugee storage in the near future and this is a big threat for our survival #nomorerefugees,Skipped
"//'We will send back the illegal immigrants to Bangladesh. Tough days are ahead, we will not tolerate any illegal immigrants in Bengal.'With these statements, West Bengal...","//'We will send back the illegal immigrants to Bangladesh. Tough days are ahead, we will not tolerate any illegal immigrants in Bengal.'With these statements, West Bengal...",Failed
RT @user I bet a lot of people's therapists are dying to meet me just to see if the stories are true.,RT @user I bet a lot of people's therapists are dying to meet me just to see if the stories are true.,Failed
HOLLERINGGGGGGG. stupid baby bitch.,HOLLERINGGGGGGG. stupid baby bitch.,Failed
a bitch in which I find attractive can take her sock off and my dick will suddenly become hard as shit ..,a bitch in which I find attractive can take her sock off and my dick will suddenly become hard as crap ..,Failed
RT @user 'You miss 100% of the shots you don't take.' -- Wayne Gretzky,RT @user 'You miss 100% of the shots you don't take.' -- Wayne Gretzky,Failed
"@user Actually that is any benefits which would make a Immigrant a ""Public Charge"" law on the books for over 100 years not entitled to hold a green card or become a citizen but #Dems wont enforce it !  That is why 73% of  Mexican and Central Amer","@user Actually that is any benefits which would make a Immigrant a ""Public Charge"" law on the books for over 100 years not entitled to hold a green card or become a citizen but #Dems wont enforcing it !  That is why 73% of  Mexican and Central Amer",Failed
How much is John McCains funeral costing tax payers? Not including his no vote to scrap Obamacare. Next time use our hard earned money for something useful like building the wall!!#BuildThatWall#McCainFuneral #Baloney,How much is John McCains funeral costs tax payers? Not including his no vote to scrap Obamacare. Next time used our hard earned money for something useful like building the wall!!#BuildThatWall#McCainFuneral #Baloney,Failed
