original,perturbed,type
"Media has sold out to Soros, etc, and selling USA Public down the river for power and money, we are nothing to them @user @user #BuildTheWall #LockThemUp #EndDACA #BoycottNFL #BoycottNike enough already","Media has sold out to Soros, etc, and sells USA Public down the river for power and money, we are nothing to them @user @user #BuildTheWall #LockThemUp #EndDACA #BoycottNFL #BoycottNike enough already",Failed
All of a sudden the guy went hysterical because he thought that the girl is assuming that something’s going on between the both of them.,All of a sudden the guy went hysterical because he thinks that the girl is assuming that something’s going on between the both of them.,Failed
When your makeup's on point and still nobody wants you,When your makeup's on point and still nobody wants you,Failed
@user Where were u when Pandits were made Refugees in their Homeland.U never raised voice then. Now fighting for illegal migrants,@user Where were u when Pandits were made Refugees in their Homeland.U never raised voice then. Now fighting for illegal migrants,Failed
Women who strive to be 'equal' to men lack ambition #YesAllMen,Women who striving to be 'equal' to men lack ambition #YesAllMen,Failed
@user horrified to see @user London anti-immigrant rhetoric appearing in official @user July publication on economy trying to stir up race hate. These dark money think tank infest everything and corrupt them. Very angry! (29 year ICAEW member!) B,@user horrified to behold @user London anti-immigrant rhetoric appearing in official @user July publication on economy trying to stir up race hates. These dark money think tank infest every and corrupt them. Very angry! (29 year ICAEW members!) B,Failed
"If she's doin this, she's about to suck the souls of 10 dead men out your dick","If she's doin this, she's about to suck the souls of 10 dead men out your dick",Failed
@user You can't call anyone a whore when you're taking up the ass from your father cunt.,@user You can't call anyone a whore when you're taking up the ass from your father cunt.,Failed
RT @user If you play field hockey there's a good chance you're a lesbian.,RT @user If you play field hockey there's a good chance you're a lesbian.,Failed
Glam Skanks -Karma/Bad Bitch Double Feature [Official Video]: via @user,Glam Skanks -Karma/Bad Bitch Double Feature [Official Video]: via @user,Failed
how the hell that bitch know him? hmmm she just proved to me that she's really a whore,how the hell that bitch know him? hmmm she just proved to me that she's really a whore,Failed
@user you give me a penis boner 😘,@user you give me a penis boner 😘,Failed
IDF murders non threatening protestors in Gaze,IDF murders non threatening protestors in Gaze,Failed
Pro-Trump Counter Protester Arrested At Immigration Rally For Brandishing Gun,Pro-Trump Counter Protester Arrested At Immigration Rally For Brandishing Gun,Failed
"Stop talking about yourself, we will let you rest while you are in prison for treason, high crimes, etc @user @user #BuildTheWall #LockThemUp #EndDACA now !!!","Stop talking about yourself, we will let you rest while you are in prison for treason, high crimes, etc @user @user #BuildTheWall #LockThemUp #EndDACA now !!!",Failed
"Online seller, pls display price you cunt!","Online seller, pls display price you cunt!",Failed
"Join @user for a teach-in about surviving violence, ICE and the experiences of criminalized immigrant survivors this Thursday in SF","Join @user for a teach-in about surviving violence, ICE and the experience of criminalized immigrants survivors this Wednesday in SF",Failed
This is the kind of Easter egg hunt I need,This is the kinds of Easter egg hunt I need,Failed
Your hoes vs my hoes,Your hoes vs my hoes,Skipped
Do not announce your not all men argument when I tell you that in the 16th century anything a woman did without the OK of her husband...,Do not announce your not all men argument when I tell you that in the 16th century anything a woman did without the OK of her husband...,Failed
@user @user @user This kunt is from Chicago too you know that right? Another Alinsky foll…,@user @user @user This kunt is from Chicago too you know that right? Another Alinsky foll…,Failed
"In commemoration of #WorldRefugeeDay and beautiful families who have made #Memphis home through refugee resettlement, visit our photo exhibit ""Images of Inspiration &amp; Integration"" at @user through Wednesday!","In commemoration of #WorldRefugeeDay and lovely families who have made #Memphis domicile through refugee resettlement, visit our picture exhibits ""Images of Inspiration &amp; Integration"" at @users through Tuesday!",Failed
"It amazes me how many women masturbate at work... Please come work for me, I have a position open under my desk","It amazes me how many women masturbate at work... Please come working for me, I have a position open under my desk",Failed
"off your left wing high horse @user Certainly not the average person's take on a ""refugee"". Remove the country shoppers, the opportunist migrants, those with criminal or terrorist ties, those with hidden wealth and who's left?","off your left wing high horse @user Certainly not the average person's take on a ""refugee"". Removing the country shoppers, the opportunist migrant, those with criminal or terrorist ties, those with hidden wealth and who's left?",Successful
"""I'm going to LARP as someone from a TV show because otherwise I might not get to engage in recreational infanticide"" said the well adjusted and not at all hysterical woman.","""I'm going to LARP as somebody from a TV show because otherwise I might not get to engaging in recreational infanticide"" said the well adjusted and not at all hysterical woman.",Failed
"A director can lose a job because of 10 year old jokes but @user can grab them by the pussy, be a pussy for Putin 🇷🇺, be an ah to a queen 🇬🇧, be a tyrant for latin immigrant families but marry a white immigrant.","A director can lose a job because of 10 year old jokes but @user can grab them by the pussy, be a pussy for Putin 🇷🇺, be an oh to a queen 🇬🇧, be a tyrant for latin immigrants familial but marry a white immigrant.",Failed
Oxymoron of the Day: Factual Feminist See the Blog:,Oxymoron of the Day: Factual Feminist See the Blog:,Failed
"@user Um excuse you I am a twank, a twink and a skank","@user Um excuse you I am a twank, a twink and a skank",Failed
Why tf these hoes be hoein while pregnant? Bitch you can't get a regular ass job for 9months or what? Smdh,Why tf these hoes be hoein while pregnant? Bitch you can't get a regular ass job for 9months or what? Smdh,Failed
"Immigrant girl hides escaped Homestead detention center | Miami Herald  More importantly, some one needs to interview her IN HER LANGUAGE about her experiences at the immigrant detention center.","Immigrant girl hide escaped Homestead detention center | Miami Herald  More importantly, some one need to interview her IN HER LANGUAGE about her experience at the immigrant detention center.",Failed
cormacs such a cunt won’t even let me squeeze his blackheads pussy bitch,cormacs such a cunt won’t even let me squeeze his blackheads pussy bitch,Failed
"IF FOR NO OTHER REASON, REMEMBER TRUMP’S ADMINISTRATION IS RESPONSIBLE FOR THIS ATROCITY AND VOTE STRAIGHT DEMOCRAT IN NOVEMBER!","IF FOR NO OTHER REASON, REMEMBER TRUMP’S ADMINISTRATION IS RESPONSIBLE FOR THIS ATROCITY AND VOTE STRAIGHT DEMOCRAT IN NOVEMBER!",Failed
"One of our newest releases investigates experiences surrounding hate and bias crimes and incidents, and the reasons and factors affecting reporting and under-reporting among youth and adults in LGBT, immigrant, Hispanic, Black, and Muslim communities.","One of our newest releases investigates experiences surrounding hate and bias crimes and incidents, and the reasons and factors impacting reporting and under-reporting among youth and adult in LGBT, immigrant, Hispanic, Black, and Muslims communities.",Failed
Check this out and Retweet if you Agree ! #draintheswamp #buildthatwall #kag #politics #government #gop #Trumplicans #PresidentTrump #MAGA #TrumpTrain #AmericaFirst #donaldtrump #sorrynotsorry #politicalmemes #madmax #trumplicans #whitehouse #patriot,Check this out and Retweet if you Agree ! #draintheswamp #buildthatwall #kag #politics #government #gop #Trumplicans #PresidentTrump #MAGA #TrumpTrain #AmericaFirst #donaldtrump #sorrynotsorry #politicalmemes #madmax #trumplicans #whitehouse #patriot,Failed
"Italian mayor abandons international human rights laws, cuts electricity supply to refugee shelters ""You are not welcome here"" - Free Speech Time - @user","Italian mayor abandons international human rights laws, cuts electricity supply to refugee shelters ""You are not welcome here"" - Free Speech Time - @user",Skipped
"Get excited! On May 30 at 8PM CST we're releasing a brand new video on our Facebook page that tells the inspiring story of Al, a former refugee from Iraq who recently became a U.S. citizen. Make sure you've liked our page so you don't miss it! âž","Get excited! On May 30 at 8PM CST we're releasing a brand new video on our Facebook page that tells the inspiring stories of Al, a former refugee from Iraq who recently became a U.S. citizen. Make sure you've liked our page so you don't miss it! âž",Failed
"I don't run from my problems, I laugh at them and act like they don't exists like a normal human being","I don't run from my problems, I laugh at them and act like they don't exists like a normal human being",Failed
"Sweden: If the country needs the money for refugees to give them a better life, the swedish retireage must increase. This is the end of socialwelfare for Swedisch people.","Sweden: If the country need the money for refugees to give them a better life, the swedish retireage must increase. This is the end of socialwelfare for Swedisch people.",Failed
We appreciate the ongoing advocacy for immigrants by @user and @user,We appreciate the ongoing advocacy for immigrants by @user and @user,Failed
@user You ungrateful whore. . . I'd have bought it n everything 😂,@user You ungrateful whore. . . I'd have purchased it n everything 😂,Failed
Russian meddling in Syrian refugee repatriation:https://t.co/nCjMUFCJc0,Russian meddling in Syrian refugee repatriation:https://t.co/nCjMUFCJc0,Failed
@user 😘😘 down bitch. That’s what women do. Provide for her man and put his head towards God when he have doubts. I love you 💙,@user 😘😘 down bitch. That’s what women do. Provide for her man and put his head towards God when he have doubts. I love you 💙,Failed
@user @user To take over your reign of the Most Hysterical Woman on a Delta Airlines flight?,@user @user To take over your reign of the Most Hysterical Woman on a Delta Airlines flight?,Failed
@user Bitch show me attention too you whore,@user Bitch show me attention too you whore,Failed
@user bonnie is a sneaky cunt bitch and she probably has something to do with whatever happened to laurels baby,@user bonnie is a sneaky cunt bitch and she probably has anything to do with whatever happened to laurels baby,Failed
Monday you slag,Monday you slag,Failed
This ignorant cunt bitch @user bout people hate her cus she’s lightskin...no. We hate you cus you are a man.,This ignorant cunt bitch @user bout people hate her cus she’s lightskin...no. We hate you cus you are a man.,Failed
One of many dumb deals this country has and is doing regarding immigration.,One of many dumb deals this country has and is doing regarding immigration.,Skipped
"Sick barstewards! This is what happens when we put up the refugees welcome signs! They not only rape our wives or girlfriends, our daughters but our ruddy mothers too!!","Sick barstewards! This is what happens when we put up the refugee welcome signs! They not only rape our wives or girlfriends, our daughters but our ruddy mothers too!!",Failed
If she dressed like a hoe in the cold she a real Whore ✋🏾😂😭,If she dressed like a hoe in the cold she a actual Whore ✋🏾😂😭,Failed
Rape is DISGUSTING. No woman or man deserves to go through something as traumatic as that. Nothing can ever justify rape. Rape is a choice.,Rape is DISGUSTING. No woman or man deserve to go through something as traumatic as that. Nothing can ever justify raping. Rape is a choice.,Failed
RT @user Lol when you have two girlfriends @user #huntermourer,RT @user Lol when you have two girlfriends @user #huntermourer,Failed
Just seen a girl on tinder who's bio just said 'I'm a hoe.' So poetic. I might marry this woman fam.,Just seen a girl on tinder who's bio just said 'I'm a hoe.' So poetic. I might marry this woman fam.,Skipped
@user I run from those bitches,@user I run from those bitches,Failed
"Chicago's a killing field from decades of inept corrupt liberal leaders, the mayor distracts by attacking Trump &amp; endorsing illegals, national media distracts with stories of Russia, Trump hate &amp; endless parades of climate change, immigrant rights, race baiting &amp; victimization..","Chicago's a killing field from decades of incompetent corrupted liberal leaders, the mayor distracts by attacking Trump &amp; endorsing illegals, national media distracts with story of Russia, Trump hated &amp; endless parades of climate change, immigrant rights, race baiting &amp; victimization..",Failed
@user @user You seem hysterical.,@user @user You seem hysterical.,Skipped
"@user Do MeP,s visit ,Greece to see ,the refugee reductions already trying to justify the Turkey deal ,afraid its not working","@user Do MeP,s visit ,Greece to behold ,the refugees reductions already attempting to justify the Turkey deal ,afraid its not work",Failed
I Can't Stand #Hypocrites The #LooneyLeft #Liberals and #Demoncrats Are Miserable Ppl,I Can't Stand #Hypocrites The #LooneyLeft #Liberals and #Demoncrats Are Miserable Ppl,Failed
âš¡ï¸ 2.9 million more refugees fled their home countries between 2016 and 2017.That's the biggest increase we have seen in a single year. Ever.https://t.co/JuUlS4r1DQ,âš¡ï¸ 2.9 million more refugees fled their domicile countries between 2016 and 2017.That's the biggest increase we have seen in a single year. Ever.https://t.co/JuUlS4r1DQ,Failed
Nutting inside a bitch is rape ???,Nutting inside a bitch is rape ???,Failed
"@user @user A man with 3 wives, 15 women accused him of assault, 13 yr old girl accused him of rape, makes speech about religion &; values. Funny!","@user @users A man with 3 wives, 15 woman accused him of assault, 13 yr old girl accused him of rape, makes speech about religion &; value. Funny!",Failed
"Tajani, Weber on migrant issue as they arive for EU summit","Tajani, Weber on migrant issue as they arive for EU summit",Failed
@user Cobra didn’t do anything. Insecure drunken whore ass Lily basically lied & manipulated out of anger bc Jr didn’t want a slut!,@user Cobra didn’t do anything. Insecure drunk whore ass Lily essentially lied & manipulated out of anger bc Jr didn’t want a slut!,Failed
Its time - to stop the immigration - to USA ! Specially from 40 muslim countries. The president named it: SHITHOLE-countries. And he is right and also his wall must be build. But all foreign invaders inside of USA must go home !,Its time - to halt the immigration - to USA ! Specially from 40 muslim countries. The presidents named it: SHITHOLE-countries. And he is right and also his wall must be build. But all foreign invaders inside of USA must go home !,Failed
You'll never be girlfriend or wife or none of that 😌 that's MY place bitch know your role and play your position 🤣🤣🤣 the rebound one 😂😭😭😩✌🏾,You'll never be girlfriend or wife or none of that 😌 that's MY place bitch know your role and playing your position 🤣🤣🤣 the rebound one 😂😭😭😩✌🏾,Failed
To make an open Europe for many refugees the poltical puppets will open all borders. They believe that the costs of workers fall down and the rich earn more money. So the establishment works in Europe against the voters.,To make an open Europe for many refugees the poltical puppets will open all borders. They believe that the costs of workers fall down and the rich earn more money. So the establishment works in Europe against the voters.,Skipped
"I can't believe that amidst a rape discussion, a whole woman called in to remind us that not all men are trash. Increds.","I can't believe that amidst a rape discussion, a whole woman called in to remind us that not all men are trash. Increds.",Failed
I swear that I am watching a show about immigration fraud! #90DaysFiance,I swear that I am watching a show about immigration fraud! #90DaysFiance,Failed
What's the difference between a pencil arguing and a woman arguing? A pencil has a point,What's the differences between a pencil arguing and a woman arguing? A pencil has a point,Failed
"And the US State Department just increased the number of refugees we are taking in!!  Can't anyone but us ""common...","And the US State Department just increased the number of refugees we are taking in!!  Can't anyone but us ""common...",Skipped
As someone who works with refugees; thank you Sprudge.,As someone who works with refugees; thank you Sprudge.,Failed
@user Women don’t do cunt,@user Women don’t do cunt,Skipped
UNSC faces difficult dilemma with #Rohingya crisis #ucanews #voiceforthevoiceless #UN #humanrights #Bangladesh @user @user @user @user @user @user @user,UNSC face tricky dilemma with #Rohingya crisis #ucanews #voiceforthevoiceless #UN #humanrights #Bangladesh @users @user @user @user @user @user @user,Failed
Is it rape if you stick your finger in a bootyhole when they sleep?,Is it rape if you stick your finger in a bootyhole when they sleep?,Failed
When you send a dick pic and get no response,When you send a dick pic and get no reply,Failed
Bitches that wear chokers that aren't complete whores is why I hate you bitches,Bitches that wear chokers that aren't completes whores is why I hate you bitches,Failed
"Stephen Miller (right) and Larry McKenney of Capitol Radiology listen as Trump speaks during a meeting at the White House last year. are not in 1950, we have to start limiting legal immigration. And completely stop illegal immigration.","Stephen Miller (right) and Larry McKenney of Capitol Radiology listen as Trump speaks during a meeting at the White House last year. are not in 1950, we have to begin limiting legal immigration. And completely halts illegal immigration.",Successful
"#Refugees cost American taxpayers over $8 BILLION EVERY YEAR. They cost more than they contribute.  I only can afford 1 child. Why do I have to pay for refugees who hate America, call me infidel/Kafir AND raise, house &amp; educate their children who are taught to hate America too?","#Refugees costs American taxpayers over $8 BILLIONS EVERY YEAR. They cost more than they contribute.  I only can afford 1 child. Why do I have to paying for refugees who hate America, calling me infidel/Kafir AND raising, house &amp; educate their children who are taught to hate America too?",Failed
"@user only if a woman of good standing can back up what they are saying, I mean, can we trust men to not be hysterical?","@user only if a woman of good standing can back up what they are saying, I mean, can we trust men to not be hysterical?",Failed
Do you get up off the couch and stand for the Anthem when youre at home? Then shut the fuck up.,Do you get up off the couch and stand for the Anthem when youre at home? Then shut the fuck up.,Failed
"@user That woman is a grade A, attention seeking cunt of the highest order.","@user That woman is a grade A, attention seeking cunt of the highest order.",Skipped
"#Burundi—Rubaya Ramazani, a Congolese refugee was illegally arrested (no warrant) on Monday by the police. He is accused of ""having participated in the 2015 protests""; which he rejects. Testimonies from neighbors support his assertion .","#Burundi—Rubaya Ramazani, a Congolese refugee was illegally arresting (no warrant) on Monday by the police. He is accused of ""having participated in the 2015 protests""; which he rejects. Testimonies from neighbor supporting his affirmation .",Failed
@user Cameron we need a break from u forget benefits we do not want mass immigration. stop immigration and get out of Europe no probs,@user Cameron we need a break from u forget benefits we do not want mass immigration. stops immigration and got out of Europe no probs,Failed
"Nazi sympathizing congressman Steve King wants to replace immigrant labor with ""thousands"" of children under 16. #MakeChildrenWorkAgain","Nazi sympathizing congressman Steve King wants to replace immigrants labor with ""thousands"" of child under 16. #MakeChildrenWorkAgain",Failed
"“The companies that really want to have a global impact need to understand cultural differences,”","“The companies that really wanna to have a global impact need to understand cultural differences,”",Failed
2015! OLD BUT GOOD ENOUGH! 62% of Illegal Immigrant Households on Welfare | Steven Camarota and Ste... via @user,2015! OLD BUT GOOD ENOUGH! 62% of Illegal Immigrant Households on Welfare | Steven Camarota and Ste... via @user,Failed
Daily work for Germans police. Smuggler take 21 refugees out of their car on landscape in Bajuvaria.,Daily working for Germans police. Smuggler take 21 refugees out of their cars on landscape in Bajuvaria.,Failed
Some migrants study in NZ and go back to their home countries. While there are others who like to retrain in a different occupation instead of going back. We celebrate Gurpreet Singh as a relentless migrant and a keen student on his student visa approval!#BrainGainNewZealand,Some migrants study in NZ and go back to their home countries. While there are others who like to retrain in a different occupation instead of going back. We celebrate Gurpreet Singh as a relentless migrant and a keen student on his student visa approval!#BrainGainNewZealand,Failed
Bloody immigrants like uk say you must obide the law of the country should be put in prison until the immigrant pays the fine,Bloody immigrants like uk say you must obide the law of the country should be put in prison until the immigrant pays the fine,Failed
@user Time for some honest discussions on the struggle faced by councils to house refugees and failed asylum seekers it is better to say sorry we have not got a big enough housing stock to cater for everyone while our own people languish on ever,@user Time for some honest discussions on the struggle faced by councils to domicile refugee and failed asylum seekers it is better to say sorry we have not got a big enough housing stock to cater for everybody while our own people languish on ever,Failed
"@user @user @user Wrong! None are refugees, Zero! The are economic migrants/invaders colonizing at the expense of host countries while pretending to be ""asylum seekers"" They are a disaster for the countries that allow this to hap","@user @user @user Incorrect! None are refugees, Zero! The are economic migrants/invaders colonizing at the expense of host countries while pretend to be ""asylum seekers"" They are a disaster for the countries that allows this to hap",Failed
"@user @user , you don't have to be a skank anymore. He, the skunk, done you wrong. Someone standing up and exposing your philandering immoral husband is a hero @user @user","@user @user , you don't have to be a skank anymore. He, the skunk, done you wrong. Someone standing up and exposing your philandering immoral husband is a hero @user @user",Skipped
Via Daniella Peled 'hysterical' Jews and 'frenzied' women,Via Daniella Peled 'hysterical' Jews and 'frenzied' women,Skipped
ICE raid hits 77 businesses in Northern California #StopTheInvasion #TherIsMoreOfThemOutThere #TheICEManCometh #DeportationsEqualPublicSafety,ICE raid hits 77 businesses in Northern California #StopTheInvasion #TherIsMoreOfThemOutThere #TheICEManCometh #DeportationsEqualPublicSafety,Failed
When you bust a nut in 30 seconds,When you bust a nut in 30 seconds,Failed
RT @user You don't need to explain your happiness to anyone.,RT @user You don't need to explain your happiness to anyone.,Failed
"@user Remigration 2018:  Easy come, easy GO!!   Anti-White Proposition:  White Genocide Definedhttps://t.co/kqEv7xdS26","@user Remigration 2018:  Easy come, easy GO!!   Anti-White Proposition:  White Genocide Definedhttps://t.co/kqEv7xdS26",Failed
"@user Ann, I thought Most Hysterical Woman was engraved on the participation trophy they gave you at the GOP convention. Bless your heart.","@user Ann, I thought Most Hysterical Woman was engraved on the participation trophy they gave you at the GOP convention. Bless your heart.",Failed
Proposed relaxation of immigration rules for non-EU skilled workers | Migration Watch UK,Proposed relaxation of immigration rules for non-EU skillful workers | Migration Watch UK,Failed
I'm picky AF when it comes to girls... Until a girl wants to bring her not so cute friend over for a threesome,I'm picky AF when it comes to girls... Until a girl wants to bring her not so adorable friend over for a threesome,Failed
224 illegal migrants held in western Turkey,224 illegal migrants held in western Turkey,Failed
"#Repost @user with get_repost ・・・ ""If you go inside my heart, it will explain my joy to you ... I cannot express it with my words."" . Eritrean refugee Berek fled home in 2017 and…","#Repost @user with get_repost ・・・ ""If you go inside my heart, it will explain my joy to you ... I cannot express it with my words."" . Eritrean refugee Berek fled home in 2017 and…",Failed
